id,abstract
122203283,谷歌 首席 人才 官 拉斯洛 • 博克 权威 力作 谷歌 公开 认可 的 谷歌 高层 作品 首度 揭秘 谷歌 颠覆 工业 时代 模式 的 人才 和 团队 管理 的 核心 法则 纽约时报 畅销 榜 第一名 BusinessInsider2015 最佳 商业 书籍 谷歌 的 创造力 就 在于 此 编辑 推荐 1 谷歌 人才 官 首次 公开 谷歌 人才 和 团队 管理 的 核心 秘籍 在 谷歌 执掌 人事 多年 的 拉斯洛 • 博克 是 人才 和 团队 管理 的 顶级 专家 他 加入 谷歌 后 谷歌 的 员工 数从 六千 增长 到 近 五万 在 全球 四十多个 国家 设立 了 七十多个 办公 机构 财富 杂志 史无前例 地 五次 将 谷歌 列为 美国 最佳雇主 也 让 谷歌 成为 目前 职业 人士 最 向往 的 工作 地 之一 在 这 本书 里 阅人 无数 的 拉斯洛 将 谷歌 选人 用人 培养人才 的 团队 管理 法则 进行 了 梳理 和 总结 首次 公开 了 谷歌 天马行空 的 自由 文化 眼花缭乱 的 产品 形态 背后 的 工作 逻辑 和 管理 原则 包括 花 重金 投入 招聘 收回 经理 的 权利 赋权 予 员工 薪酬 差异化 等等 从 招聘 人才培养 人才 管理 人才 各 方面 全方位 揭秘 打造 创新 高效 幸福 公司 的 方法 2 工业 时代 的 团队 管理模式 已经 过时 互联网 时代 的 团队 无需 成人 监管 工业 时代 层级 森严 的 垂直 化 团队 管理模式 已经 不再 适应 当今 的 需求 在 互联网 时代 谷歌 扁平化 自由 组织 无需 成人 监管 的 管理模式 才 是 激发 团队 创新 的 动力 本书 首次 剖析 了 谷歌 的 内部 组织 模式分析 了 组织 文化 和 价值观 是 如何 形成 和 构建 的 以及 如何 打造 一个 不断创新 的 学习型 组织 3 谷歌 招聘 流程 内部 绩效 管理 和 薪资 结构 大 公开 谷歌 是 众多 优秀人才 向往 最佳 工作 场所 它 的 招聘 流程 究竟 是 怎样 的 在 谷歌 工作 收入 如何 为什么 谷歌 不 重视 绩效考核 却 同样 能 让 每 一个 员工 卖力 工作 创造 最优 的 业绩 谷歌 提供 免费 福利 给 员工 到底 花费 几何 作者 在 书 中 一一 回答 了 这些 问题 而且 你 会 发现 谷歌 的 做法 非常 奇葩 招聘 面试 曾经 一度 高达 20 多轮 对于 离职 的 员工 会 给 一大笔钱 不同 员工 的 收入 差 能够 相差 50 倍 内容简介 谷歌 何以 网罗 到 世界 上 最 优秀 的 人才 为 其 工作 为什么 在 谷歌 人力 管理 中 招聘 是 头等 重要 的 大事 谷歌 如何 培养人才 留住 人才 最大 限度 地 发掘 人 的 创造力 谷歌 为何 要 提供 餐饮 洗衣 医疗 游乐场 公立学校 等 免费 福利 给 员工 谷歌 如何 让 每 一个 员工 都 像 创始人 一样 富有 激情 地 工作 谷歌 如何 超越 苹果 微软 亚马逊 等 公司 成为 世界 顶尖 人才 心目 中 的 最佳雇主 在 本书 中谷歌 首席 人才 官 拉斯洛 • 博克 结合 自己 9 年来 领导 谷歌 人力 部门 的 实战经验 首次 公开 谷歌 人力 和 团队 管理 的 核心 方法 其中 包括 uf0a5 \t 赋予 工作 意义 uf0a5 \t 相信 员工 向 所有 员工 开放 公司 信息 uf0a5 \t 只 聘用 比 你 优秀 的 人 不计 时间 地 找到 他们 uf0a5 \t 限制 经理人 的 权力 赋予 员工 足够 的 自由度 uf0a5 \t 规避 直觉 重新 定义 面试 uf0a5 \t 绩效 管理 不 受欢迎 关注 人才 的 成长 胜过 评分 与 奖赏 uf0a5 \t 关注 团队 的 两端 最优 员工 和 最差 员工 uf0a5 \t 支付 不 公平 薪酬 因为 这 反而 更 公平 作者 在 书 中 指出 在 谷歌 人 始终 被 当作 企业 唯一 最 重要 的 财富 谷歌 管理层 始终 将 发掘 培养 和 留住 人才 作为 企业 最高 战略 这是 谷歌 成为 幸福 企业 和 成功 企业 的 根本 正如 作者 所说 谷歌 的 这些 原则 对 任何 团队 的 组建 和 管理 都 适用 不管 你 是 苦于 找 不到 合伙人 的 初创 公司 老板 还是 面临 好 人才 跳槽 的 企业 经理人 抑或 是 面对 互联网 转型 的 企业 高管 都 能 从 书 中 重新 发现 人才 的 重要性 和 团队 的 价值 
122203945,精益 创业 实战 第 2 版 融合 了 精益 创业 法 客户 开发 商业模式 画布 和 敏捷 ／ 持续 集成 的 精华 讲解 精益 创业 实战 法 作者 以 自己 的 创业项目 为主 线 结合 大量 真实 案例 并 融入 一些 伟大 创业者 的 智慧 创建 了 一套 思考 验证 和 发布 产品 的 系统 那些 想要 验证 自己 的 创意 解决 实际 问题 和 渴望 拥有 成功 事业 的 人 可以 把 精益 创业 实战 第 2 版 当成 一套 明确 的 实践 计划 一幅 清晰 的 创业 路线图 一本 实践 指南 或者 一套 反复 实践 的 方法论 
122205444,首先 通过 概念分析 使 读者 了解 到 互联网 治理 的 独特 之 处 以及 国家 是 如何 塑造 并 限制 这些 独特 之处 的 接着 叙述 了 全球 互联网 治理 机构 的 历史 演化过程 最后 考察 了 四种 驱动 互联网 治理 变革 的 主要 力量 以及 互联网 用户 与 著作权 和 商标 拥有者 之间 的 斗争 互联网安全 与 国家 安全 之间 的 关系 对 互联网内容 进行 的 监管 与 审查 由 关键 互联网 资源 的 跨国 治理 引起 的 公共政策 议题 与 制度 困境 等 网络 与 国家 : 互联网 治理 的 全球 政治学 不仅 适合 信息 与 传播学 通信 与 信息 的 政治经济学 专业 领域 的 人士 阅读 也 适合 关注 互联网 管理 与 政策 领域 的 普通 读者 阅读 
122210878,一场 数字 革命 正在 加速 进行 一些 科幻小说 里 的 场景 已经 在 现实 中 发生 无人驾驶 汽车 开上 了 公路 智能 设备 能 高效 地 翻译 人类 语言 人工智能 系统 在 智力竞赛 里 击败 了 所有 人类 选手 工厂 雇主 开始 购买 更 多 的 新 机器 却 不 招新 工人 这些 例子 都 证明 数字 技术 正在 快速 地 掌握 原本 只 属于 人类 的 技能 并 深刻 地 影响 了 经济 虽然 大多数 影响 是 积极 的 数字 革新 将 提高效率 降低 商品价格 甚至 到 免费 以及 增加 经济总量 但 数字 革新 也 改变 了 经济总量 分配 的 方式 对 处于 中层 的 工作者 来说 情况 并 不 乐观 随着 技术 继续 领跑 更 多 的 人 将 被 甩开 工人 的 技能 被 计算机 掌握 后 他们 获得 的 工作 机会 将 更少 他们 的 薪酬 和 前景 也 将 进一步 缩减 和 暗淡 创业 式 的 商业 模型 新式 的 组织 结构 和 其他 机构 都 需要 保证 员工 的 平均水平 不能 落后 于 迅速 发展 的 机器 在 与 机器 赛跑 里布 林 约尔 松和麦 卡菲 汇集 了 一系列 数据 案例 和 论证 证明 了 技术 进步 正在 加速 进行 而 这种 趋势 对 技能 薪酬 和 就业机会 都 有 深层 影响 本书 将 告诉 你 造成 糟糕 的 就业 现状 的 原因 并 不是 技术 的 停滞 而是 人类 和 我们 的 机构 无法 赶上 机器 的 脚步 
122211382,在 科技 想要 什么 一书中 凯文 • 凯利 向 我们 介绍 了 一种 全新 的 科技 观他 认为 作为 整体 科技 不是 由 线路 和 金属 构成 的 一团乱麻 而是 有 生命力 的 自然 形成 的 系统 它 的 起源 完全 可以 回溯到 生命 的 初始 时期 正如 生物进化 呈现出 无意识 的 趋势 科技 也 是 如此 通过 追踪 这些 长期趋势 我们 可以 对 科技 想要 什么 有所 理解 凯文 • 凯利 预测 了 未来 数十年 科技 的 12 种 趋势 包括 创造 大脑 这一 得寸进尺 之 举 不过 为了 让 人类 创造 的 世界 实现 收益 最大化 需要 对 这种 全球 体系 产生 的 问题 和 代价 保持 敏感 凯利 详细 讲述 了 值得 我们 学习 的 阿米 什 早期 使用者 和 其他 批判 科技 自我 主义 倾向 的 人 所 具有 的 智慧 凯利 的 新 科技 理论 提供 了 三种 实践经验 通过 倾听 科技 的 需求 我们 和 我们 的 孩子 可以 更加 出色 地 做好 准备 迎接 必将 到来 的 科技 通过 采用 主动 融合 原则 我们 可以 驾驭 科技 使 之 发挥 最大 作用 通过 遵从 这 种类 生命 系统 的 长期 原则 我们 可以 获得 它 的 全部 馈赠 凯利 令人吃惊 地 宣称 现在 人类 已 定义 的 生命 形态 仅 包括 植物 动物 原生 生物 真菌 原 细菌 真 细菌 六种 但 技术 的 演化 和 这 六种 生命体 的 演化 惊人 相似 技术 应该 是 生命 的 第七种 存在 方式 技术 是 生命 的 延伸 它 不是 独立 于 生命 之外 的 东西 这是 一部 关于 科技 的 巅峰 之作 必定会 成为 现代 思想体系 中 的 一座 里程碑 
122212059,失控 全人类 的 最终 命运 和 结局 全新 修订本 是 一部 思考 人类 社会 或 更 一般 意义 上 的 复杂 系统 进化 的 大部头 著作 对于 那些 不 惧于 头脑 体操 的 读者 来说 必然 会 开卷有益 大众 智慧 云 计算 物 联网 虚拟现实 网络 社区 网络 经济协作 双赢 电子货币 我们 今天 所知 的 绝大多数 是 我们 二十年 前 就 已知 的 并且 都 在 这 本书 中 提及 了 凯文 凯利 失控 成书 于 1994 年 2010 年 中文版 首次 面世 此 版本 为 东西 文库 最新 修订 版本 从头至尾 全篇 重新 校对 推荐 语 本世纪 对 西方 世界 产生 巨大 影响 的 最 重要 的 著作 之一 东西 文库 这 可能 是 1990 年代 最 重要 的 一 本书 长尾 作者 克里斯 安德森 凯文 凯利 的 失控 我 给 很多 人 推荐 如果 我们 面试 一个 大学生 他 告诉 我 他 看 完 了 这 本书 我 肯定 就 录用 他 不过 他们 不 知道 这个 秘诀 如果 做 互联网 产品 的 不 看 一下 这 本书 我 认为 知识 是 不 全面 的 微信 之父 张小龙 
122212523,本书 的 目标 是 运用 网络 经济 中 的 经济学 知识 从 经济 研究 和 作者 自己 的 经验 中 提取 出 适合 信息 相关 产业 的 经理 们 的 知识 本书 描述 的 思想 概念模型 和 思考 方法 会 帮助 读者 作出 更好 的 决策 
122213283,市面上 已经 有 很多 专业 的 用户 体验 书籍 但 解决 用户 体验 设计师 在职 场中 遇到 的 众多 现实 问题 的 图书 并 不多见 本书 从 用户 体验 设计师 的 角度 出发 系统地 介绍 了 其 职业生涯 中 的 学习 方法 思维 方式 工作 流程 等 覆盖 了 用户 体验 设计 基础知识 设计师 的 角色 和 职业 困惑 工作 流程 需求 分析 设计规划 和 设计标准 项目 跟进 和 成果 检验 设计师 职业 修养 以及 需要 具备 的 意识 等 力图 帮助 设计师 解决 在 项目 中 遇到 的 一些 常见问题 找到 自己 的 职业 成长 之 路 本书 由 资深 的 一线 用户 体验 设计师 编写 书中 融入 了 宝贵 的 职业 经验 和 专业 思考 对于 交互 设计师 视觉 设计师 用户 研究员 等 具有 一定 参考价值 和 借鉴 意义 同时 本书 也 适用 于 产品 经理 运营 开发 等 用户 体验 相关 人员 以及 相关 专业 的 学生 阅读 思考 
122213735,可用性 设计 是 Web 设计 中 最 重要 也 是 最 困难 的 一项 任务 点石成金 的 作者 根据 自己 多年 从业 的 经验 剖析 用户 的 心理 在 用户 使用 的 模式 为 浏览 进行 设计 导航 设计 主页 布局 可用性 测试 等 方面 提出 了 许多 独特 的 观点 并 给出 了 大量 简单易行 的 可用性 设计 的 建议 这 本书 短小精悍 语言 轻松 诙谐 书中 穿插 大量 色彩 丰富 的 屏幕 截图 趣味 丛生 的 卡通 插图 以及 包含 大量 信息 的 图表 使 枯燥 的 设计 原理 变得 平易近人 此书 适合 从事 Web 设计 和 Web 开发 的 技术人员 阅读 特别 适合 为 如何 留住 访问者 而 苦恼 的 网站 网页 设计 人员 阅读 
122215549,在 免费 : 商业 的 未来 这 本书 克里斯 安德森 认为 新型 的 免费 并 不是 一种 左 口袋 出右 口袋 进 的 营销 策略 而是 一种 把 货物 和 服务 的 成本 压低 到 零 的 新型 卓越 能力 在 上 世纪 免费 是 一种 强有力 的 推销 手段 而 在 21 世纪 它 已经 成为 一种 全新 的 经济 模式 究竟 什么 是 免费 商业模式 根据 克里斯 安德森 的 说法 这种 新型 的 免费 商业模式 是 一种 建立 在 以 电脑 字节 为 基础 上 的 经济学 而 非 过去 建立 在 物理 原子 基础 上 的 经济学 这是 数字化 时代 一个 独有 特征 如果 某样 东西 成 了 软件 那么 它 的 成本 和 价格 也 会 不可避免 地 趋于 零 这种 趋势 正在 催生 一个 巨量 的 新 经济 这 也 是 史无前例 的 在 这种 新 经济 中 基本 的 定价 就是 零对 我们 个人 来说 免费 是 一种 涤荡 旧有 思维 的 商业 体验 而 对 企业 来说 免费 更 多 的 是 一种 生存 法则 一种 可以 改变 旧有 发展 模式 而 实现 脱胎换骨 的 动力 机器 
122220643,本书 主要 讨论 网络 中 的 民主 问题 网络 技术 已经 深刻 地 影响 了 我们 的 生活 我们 随时 可以 获得 我们 需要 的 信息 我们 也 随时 可以 与 别人 联系 那么 网络 技术 是不是 就是 民主 的 福音 呢 作者 回答 说 不 他 认为 通过 网络 人们 更 容易 获得 的 是 自己 喜欢 的 信息 而 拒绝接受 自己 不 喜欢 的 信息 事实上 人们 得到 的 是 窄化 的 信息 很多 的 网站 也 不 和 与 自己 立场 相反 的 网站 链接 而 在 一个 真正 的 民主 的 环境 中 信息 应是 多元 的 并且 不是 我们 事先 选择 的 在 其中 我们 还 拥有 一些 共同 的 经验 例如 公园 和 街谈巷议 作者 认为 信息 的 窄化 其 结果 是 社会 会 趋于 分裂 各种 仇恨 群体 更 容易 相互 联系 和 影响 也 更 容易 对 社会 发动 攻击 作者 认为 政府 应 积极 介入 以 提供 一个多元 的 信息 环境 本书 译文 质量 较差 
122221886,当代 软件技术 领域 最 重要 的 著作 中文版 首次 出版 大 教堂 与 集市 是 开源 运动 的 圣经 颠覆 了 传统 的 软件开发 思路 影响 了 整个 软件开发 领域 作者 EricSRaymond 是 开源 运动 的 旗手 黑客 文化 第一 理论家 他 讲述 了 开源 运动 中 惊心动魄 的 故事 提出 了 大量 充满 智慧 的 观念 和 经过 检验 的 知识 给 所有 软件 开发人员 带来 启迪 本书 囊括 了 作者 最 著名 的 五部曲 并 经过 作者 的 全面 更新 增加 了 大量 注释 提高 了 可读性 是 经典收藏 开源 运动 对 软件业 和 互联网 带来 了 巨大 影响 本书 作为 开源 运动 的 独立宣言 其 影响力 远远 超出 编程 领域 如果 想 在 互联网 时代 做生意 这 本书 是 必读 经典 详细 内容 本书 是 开源 运动 的 独立宣言 它 清晰 透彻 和 准确 地 描述 了 开源 运动 的 理论 与 实际 应用 对 开源 软件 运动 的 成功 和 Linux 操作系统 的 广泛 采用 都 起到 了 至关重要 的 作用 作者 EricSRaymond 是 开源 运动 和 黑客 文化 的 元老级 人物 他 是 INTERCAL 编程语言 的 主要 创作者 之一 是 Fetchmail 程序 的 作者 并 为 EMACS 编辑器 作出 过 贡献 1997 年 以后 他 成为 开放 源代码 运动 的 主要 理论家 以及 开放 源代码 促进会 的 主要 创办人 之一 作者 观察 到 在 互联网 世界 里 有 一种 与 传统 软件开发 模式 大 教堂 模式 截然不同 的 全新 的 模式 集市 模式 大 教堂 模式 是 封闭 的 垂直 的 集中式 的 开发 模式 反映 一种 由 权利 关系 所 预先 控制 的 层级 制度 而 集市 模式 则 是 并行 的 点对点 的 动态 的 多 人 协同 开发 模式 开发者 之间 通常 仅仅 靠 互联网 联系 在 这种 貌似 混乱 而 无序 的 开发 环境 中 居然 产生 了 质量 极高 和 极具 效率 与 生命力 的 软件 产生 了 诸如 Linux 这种 世界级 的 操作系统 这是 怎么 做到 的 呢 作者 通过 亲自 实践 研究 了 这种 模式 的 成功 原因 和 主要 特点 给出 了 19 条 软件开发 的 真知灼见 解释 了 黑客 愿意 无偿 贡献 自己 代码 的 动机 研究 了 开源 软件 的 经济 动力 和 盈利 机制 并 预测 了 软件业 将 必然 面临 的 根本性 变革 作者 在 书 中 对 黑客 hacker 这一 通常 被 误用 的 称呼 做 了 正名 指出 黑客 并 不是 计算机 犯罪分子 而是 醉心于 软件 和 网络 的 编程 高手 是 乐于 分享 和 喜欢 突破 极限 的 问题 解决 专家 天才 发明家 和 艺术家 对于 想要 成为 一名 黑客 的 读者 作者 指出 了 黑客 应 具备 的 基本 态度 黑客 和 骇客 的 本质区别 黑客 应有 的 格调 和 如何 掌握 黑客 的 基本技能 作者 指出 黑客 文化 靠 声誉 运转 只有 当 其他 黑客 一致 称 你 为 黑客 时 你 才 是 黑客 本书 囊括 了 作者 被 业界 称为 五部曲 的 核心 著作 黑客 圈 简史 ABriefHistoryofHackerdom 大 教堂 和 大 集市 TheCathedralandtheBazaar 如何 成为 一名 黑客 HowToBecomeAHacker 开拓 心智 层 HomesteadingtheNoosphere 和 魔法 锅 TheMagicCauldron 其中 最 著名 的 当属 大 教堂 和 大 集市 本书 在 开源 运动 中 的 地位 相当于 基督教 的 圣经 用 黑客 们 的话 说 这 是 黑客 藏经阁 的 第一 收藏 本书 并 不 只是 在 讲 开源 和 黑客 所有 关心 软件开发 和 IT 发展 的 人 都 应该 花些 时间 通读 全书 书中 给出 了 大量 充满 智慧 的 观念 和 有趣 的 知识 如 命令 体系 礼物 文化 以少成 多 内部 市场 竞次 反公地 模型 委员会 设计 同侪 声誉 模因 工程 SNAFU 现象 进化 不利条件 软件业 是 服务行业 组织 结构 决定 产品 结构 准入 门槛 越低 稳定性 越高 程序员 是 资产 而 非 成本 等 这些 内容 一定 会 给 你 带来 新 的 启示 和 思考 
122222403,本书 全面 介绍 了 新 媒体 运营 以及 新 媒体 运营 各 模块 的 具体内容 第 1 章 重点 介绍 新 媒体 运营 的 基本概念 其中 包括 运营 的 定义 发展 历史 及 专业术语 第 2 章 重点 介绍 新 媒体 运营 的 职业 发展 通过 企业 需求 反推 能力 清单 引导 读者 全面 了解 新 媒体 运营 的 岗位 及 相关 要求 第 3 章 重点 介绍 用户 运营 的 方法 与 策略 包括 描述 用户 画像 搭建 用户 体系 吸引 精准 用户 及 提升 用户 活跃度 等 具体 技巧 第 4 章 重点 介绍 产品 运营 的 思路 特别 是 产品类别 识别 及 生命周期 管理 的 方法 第 5 章 重点 介绍 内容 运营 的 核心 与 技巧 包括 内容 运营 的 七个 环节 长短 内容 的 设计 方式 和 结合 场景 设计 内容 的 具体 技巧 第 6 章 重点 介绍 活动 运营 的 策划 与 执行 尤其 是 跨界 活动 的 策划 方式 及 活动 方案 的 执行 方法 第 7 章 重点 介绍 新 媒体 运营 案例 的 拆解 并 通过 平台 运营 活动 运营 及 个人 品牌 运营 等 三个 具有 代表性 的 案例 引导 读者 了解 新 媒体 案例 拆解 的 技巧 本书 既 适合 企业 新 媒体 运营 的 学习者 和 从业者 使用 也 可 作为 本科 院校 及 职业院校 市场营销 类 企业 管理 类 商务 贸易 类 电子商务 类 等 专业 新 媒体 运营 课程 的 教学 用书 
122224049,本书 是 作者 为 北京大学 新闻 与 传播学院 硕士生 开设 的 互联网 前沿 思想 课程 的 讲义 作者 力图 从 技术 经济 和 社会 的 角度 在 大 尺度 上 观察 互联网 究竟 根植 于 什么样 的 文化 土壤 作者 选择 了 复杂性 社会 网络分析 公共 空间 这 三个 维度 展开 分析 为 读者 呈现出 了 脱胎 于 工业 时代 的 互联网 继承 了 哪些 思想 并 对 哪些 思想 做出 了 彻底 的 颠覆 
122225423,本书 是 一本 针对 所有 层次 的 Python 读者 而作 的 Python 入门 书 全书 分两 部分 第一 部分 介绍 用 Python 编程 所 必须 了解 的 基本概念 包括 matplotlibNumPy 和 Pygal 等 强大 的 Python 库 和 工具 介绍 以及 列表 字典 if 语句 类 文件 与 异常 代码 测试 等 内容 第二 部分 将 理论 付诸实践 讲解 如何 开发 三个 项目 包括 简单 的 Python2D 游戏 开发 如何 利用 数据 生成 交互式 的 信息 图 以及 创建 和 定制 简单 的 Web 应用 并 帮 读者 解决 常见 编程 问题 和 困惑 
122230080,你 或许 相信 在 太空 中 唯一 能 看到 的 人工 建筑 就是 万里长城 可乐 能 腐蚀 人体 骨骼 我们 的 大脑 使用 了 10% 与此同时 你 却 记不得 上周 例会 上 领导 的 安排 昨天 看过 的 那本书 里 写 了 什么 上次 参加 培训 的 主要 内容 为什么 这 就 引发 出让 创意 更 有 黏性 的 核心 问题 什么样 的 观点 或 创意 具有 强有力 的 黏性 能 被 他人 牢牢 记住 国际 知名 行为 心理学家 希思 兄弟 根据 大量 的 社会心理学 研究 案例 揭示 了 让 创意 或 观点 具有 黏性 的 六条 路径 简单 意外 具体 可信 情感 和 故事 简单 精炼 核心 信息 意外 吸引 维持 注意 具体 帮人 理解 记忆 可信 让 人 愿意 相信 情感 使人 关心 在乎 故事 促人起 而 行动 让 创意 更 有 黏性 自 出版 之 日 开始 就 风靡 多国 6 年来 高踞 亚马逊 畅销书 排行榜 是 纽约时报 的 经典 畅销书 不管 是 需要 说服 下属 的 公司 主管 还是 需要 打动 客户 的 销售 抑或 需要 打造 直抵 人心 创意 的 广告人 各行各业 的 人 都 可以 从中 找到 表达 创意 或 观点 的 最具 黏性 的 方法 
122230668,互联网 的 发展 蔚为壮观 如今 全球 的 互联网 用户 达到 20 亿之众 约 占 世界 人口 的 30% 这 无疑 是 一个 新 的 现象 对于 当代 各国 的 经济 政治 和 社会 生活 意义 重大 有关 互联网 的 大量 大众 读物 和 学术著作 鼓吹 其 潜力 将 从根本上 被 重新认识 这 在 20 世纪 90 年代 中期 一片 唱 好 时 表现 尤甚 那时 许多 论者 都 对 互联网 敬畏 三分 惊叹 有加 虽然 敬畏 和 惊叹 可能 已成 过去 然而 它 背后 的 技术 中心主义 相信 技术 决定 结果 却 阴魂不散 与 之 伴生 的 则 是 对 互联网 的 误读 不能 将 其 置于 社会 经济 政治 语境 中 去 理解 本书 从 史学 社会学 政治学 和 经济学 的 视角 简明扼要 地 讨论 互联网 对 社会 的 影响 全书 分三 部分 第一 部分 讲 互联网 的 历史 总览 其 社会 地位 第二 部分 聚焦 于 互联网 的 规制 和 互联网 经济 第三 部分 审视 互联网 的 政治 影响 和 文化 影响 
122231345,本书 作者 一直 从事 互联网 产品 的 研究 和 实战经验 丰富 同时 作为 导师 指导 了 大量 优秀 的 产品 经理 本书 的 内容 也 是 作者 8 年来 培养 产品 经理 新兵 的 经验 集萃 如果 你 缺乏 培养 产品 经理 的 教材 本书 正好 总结 了 产品 经理 知识 体系 无疑 是 你 很 好 的 选择 本书 覆盖 了 相当 全面 的 互联网 知识 对于 想要 了解 互联网 行业 或 想要 借助 互联网 进行 营销 的 人 来说 都 是 很 好 的 入门 读物 本书 并 不是 一本 完善 的 互联网 创业 指南 而是 写给 胸怀 互联网 梦想 的 人 最 诚挚 的 枕边书 从 互联网 产品 经理 的 视角 结合 作者 本人 的 成长 实践 深入 剖析 了 互联网 公司 的 产品 运作 方式 和 互联网 产品 的 成功 要素 通过 本书 你 可以 学习 到 如何 成为 一名 互联网 产品 经理 互联网 中 细分 市场 的 划分 和 特点 创建 互联网 产品 的 第一线 经验 优化 用户 体验 让 产品 赢得 千万级 用户 怎样 保持 产品 的 竞争力 如何 建立 创新 文化 
