id,abstract
122272971,划时代 的 商业 著作 传统 企业 转型 互联网 创业 的 实战 指南 爆品 是 一种 极端 的 意志力 是 一种 信仰 是 整个 企业 运转 的 灵魂 小米 创始人 雷军 亲自 作序 推荐 小米 联合 创始人 黎万强 分众传媒 创始人 江南春 美的 董事长 方洪波 九阳 董事长 王旭宁 等 众多 一线品牌 创始人 联袂 推荐 创 图书 类众 筹 新纪录 众筹 上线 2 小时 金额 达到 10 万元 上线 1 星期 金额 突破 100 万元 未售 先火 出版 前 已 在 企业家 产品 经理 群体 中 广为流传 爆品 专家 金错 刀 深入 几千家 企业 调研 历时 几年 时间 打磨 出 极具 指导性 的 爆品 研发 实战 指南 超级 爆品 案例 小米 手机 福特 T 型车 美团乐视 华为 头条 女王 范冰冰 iPhone 宜家 爆品 总裁 马化腾 AirbnbUber 滴滴 微信 红包 Beats 科宝 博洛尼 酒仙 网青米 公司 金错 刀 在 书 中 写 到 一句 话 在 这种 无尽 黑暗 中 只有 爆品 才能 绽放 一朵 烟花 被 更 多 的 用户 看到 几朵 小 烟火 都 不行 都 会 很快 被 黑暗 吞噬 是 的 在 当今 的 互联网 时代 要 想 成功 必须 要 做出 爆品 有 引爆 市场 的 产品 和 策略 温水 你 哪怕 做到 99 ° C 也 没 啥 用 唯有 沸腾 之后 才 有 推动 历史 进步 的 力量 雷军 小米 创始人 爆品 是 一个 信条 相 不 相信 有没有 魄力 只 做 一个 单品 做到 这个 品类 的 市场 第一 产品线 不 聚焦 难于 形成 规模 效应 资源 太 分散 会 导致 参与感 难于 展开 爆品 是 互联网 时代 必备 的 产品 思维 金错 刀 是 深入研究 爆品 战略 的 第一 人黎万强 小米 联合 创始人 在 这个 破坏 重构 与 巨变 的 时代 所有 中国 家电企业 的 商业模式 已经 失效 我 有 一次 问马云 传统 企业 怎么 进行 互联网 改造 他 说 了 一句 话 关键 取决于 你 董事长 美的 正在 对 企业 进行 一个 翻天覆地 的 组织 改造 和 文化 改造 所有 的 组织 结构 围绕 用户 来 设计 目的 就是 打造 爆品 金错 刀 提出 的 爆品 战略 本质 是 用户 战略 极致 口碑 也 是 创始人 的 必修 产品 课 方洪波 美的 董事长 正如 金错 刀 所说 产品 是 1 营销 是 0 在 互联网 上 一切 中间环节 被 砍掉 只有 产品 够 尖叫 你 才 有 通过 营销 放大 10 倍 100 倍 的 威力 一个 靠 渠道 靠 营销 引爆 市场 的 时代 已经 结束 如果 产品 本身 不够 尖叫 在 互联网 时代 一切 皆 会 归零 所以 读 爆品 战略 一书 就是 去 帮 你 找到 N 个 0 前面 的 最初 那个 1 江南春 分众传媒 创始人 董事长 爆品 的 核心 是 引流 而 选择 入口 级 的 产品 做 爆品 又 是 重中之重 博洛尼 就是 参考 金错 刀 的 爆品 战略 将 家装 的 入口 施工 部分 做成 变态 级 环保 同时 放弃 施工 利润 除了 施工队 的 钱 之外 公司 30% 的 毛利 全部 放弃 给 到 客户 换来 了 博洛尼 家装 板块 的 大幅 增长 蔡明 科宝 博洛尼 董事长 一年 多 时间 出货 2000 万 只 小米 手环 这是 华米 公司 亲历 的 智能 硬件 业内 的 第一 爆品 我 感受 深刻 我 在 带领 华米 团队 创业 的 过程 中 亲历 了 做 爆品 的 种种 艰难 和 挑战 也 品尝 了 爆品 带来 的 成果 和 喜悦 希望 广大读者 从金错 刀 的 书 中 真正 领悟 爆品 之 道 黄 汪华米 创始人 兼 CEO 爆品 是 一种 匠心 的 坚持 是 用 心灵 去 创新 是 用 新 的 价值链 的 重构 在 残酷 的 市场竞争 中 脱颖而出 生生不息 传统 企业 要 学习 跨界 思考 跨界 竞争 创新 产业链 让 人 产品 价值 完美 融合 金错 刀 老师 的 新作 爆品 战略 的 最大 价值 在于 其中 不仅 有 战略 层面 的 分析 更 有 可以 落地 的 方法论 正如 他 所说 忘掉 互联网 思维 开始 互联网 行为 林海峰 青米 创始人 做 爆品 先要 有 勇气 和 决心 背水一战 才能 一战 成名 做 爆品 也 要 有 毅力 十年磨一剑 要 耐得 住 寂寞 做 爆品 更 需要 方法 要 找到 产品 与 用户 内心深处 产生 共振 的 方法 金错 刀 一把 帮助 大家 解剖 爆品 奥秘 的 快刀 张峰 
122274755,在 这个 信息 爆炸 的 年代 我们 如何 找到 出路 在 纷繁 交错 的 信息流 中 我们 如何 筛选 出 想要 的 信息 既然 Google 已经 魔法 般地 将 正确 答案 呈现 在 我们 面前 为什么 信息 架构 的 方式 依然 重要 Web 信息 架构 的 作者 PeterMorville 用 了 10 年 时间 回答 以上 问题 随意 搜寻 是 一趟 奇妙 的 旅程 让 未来 触手可及 无论 何时何地 我们 都 能 找到 任何人 任何 东西 这 本书 即 是 路线图 也 是 信息时代 的 玛雅 预言 它 解释 了 在 普适 计算 和 互联网 的 交叉路口 搜索 和 寻路 技术 对 经济 文化 产生 的 冲击 随意 搜寻 为 我们 描绘 了 一条 新 路径 贯穿 了 营销 和 设计 的 崭新 蓝图 这 本书 充满 洞察力 它 可能 改变 你 的 思维 方式 改变 你 的 目标 甚至 改变 你 的 人生 我 希望 你 也 跟 我 一样 让 这本 随意 搜寻 引导 你 思考 结合 你 的 环境 与 经验 触发 你 的 行动 蔡学镛 中国银联 移动 支付 首席 产品 架构师 前 创新 工场 首席 布道 师 这 是 一场 让 人 身临其境 乐在其中 且 大开眼界 的 旅途 这趟 旅途 关注 的 主题 正 日益 变得 重要 变成 现实 DavidWeinberger 小块 松散 组合 线车 宣言 作者 搜索引擎 营销 SEM 是 当今 互联网 上 最 热门 的 事情 而且 也 名副其实 随意 搜寻 不但 拓宽 了 搜索引擎 营销 的 范围 也 提供 了 基于 用户 行为 的 深入 见解 本书 还 能 带动 你 的 在线 业务 将 你 的 业务 带入 一个 充满 可能 的 新世界 JakobNielsen 博士 Web 可用性 设计 作者 在 随意 搜寻 中 PeterMorville 全身心 地 投入 了 心智 层 的 电子 世界 这是 一本 给 所有人 的 必读 物是 设计师 不可 错过 的 实践 指南 GaryMarchionini 博士 北卡罗来纳 大学 
122281049,信息时代 的 世界 工厂 最 关切 我们 未来 的 思想 @ 网络 中国 丛书 之一 互联网 中国传媒 参考书 我们 生活 在 信息时代 我们 的 国家 是 世界 工厂 但 你 是否 想过 信息时代 与 世界 工厂 之间 有何 联系 本书 认为 回答 此 问题 必须 了解 网吧 短信 小灵通 山寨 机等 中低端 信息 传播 工具 必须 走进 城中村 厂矿 宿舍 工殇 医院 以及 各式各样 的 新 媒体 事件 因为 那里 的 流动 打工者 那里 的 老 与 少 正在 构建 方兴未艾 的 新 工人阶级 因为 他们 的 网络 社会 才 是 世界 工厂 的 支柱 和 信息时代 的 基础 关于 新 工人阶级 的 网络 社会 本书 经 十年 积累 内容 分三 部分 上编 网络 之 普及 讨论 网吧 与 手机 的 技术 扩散 及其 相关 文化 现象 制度 问题 与 社会 影响 中编 信息 中下阶层 梳理 流动人口 劳工 青少年 及 老年人 如何 在 社会 大 转型 背景 下 利用网络 科技 应对 生存 议题 进行 草根 创新 下 编新 工人阶级 之 雏形 在 空间 和 时间 的 维度 上 考察 新 工人阶级 形成 的 特点 包括 网络 条件 下 的 控制 与 颠覆 文化 表达 及 重大 社会 事件 2009 年 麻省理工学院 出版社 推出 英文版 以来 本书 得到 国际 学术界 广泛 关注 并 获简 • 雅各布 斯 城市 传播 图书奖 提名 牛津大学 互联网 研究所 主任 比尔 • 达顿 教授 如此 评价 互联网 及 相关 信息 传播 技术 如何 在 经济 高速 发展 的 中国 产生 社会 作用 迄今为止 此书 的 探讨 最有 洞见 且 以 实证 为 根基 
122281566,互联网 运营 作为 一个 新兴 的 岗位 一方面 它 是 企业 的 核心 岗职 身负重任 另一方面 又 由于 其 短暂 的 历史 缺乏 成熟 体系 的 工作 方法论 而 目前 业界 主流 的 运营 方法 却是 从 企业 视角 出发 存在 极大 的 改进 空间 进化 式 运营 从 互联网 菜鸟 到 绝顶 高手 作者 基于 自身 十年 的 互联网 洞察 实践经验 并 融合 了 信息论 心理学 经济学 管理学 甚至 包括 生态学 进化论 等 跨学科 跨 学业 的 知识 从无到有 地 构建 了 一套 全新 的 互联网 运营 体系 基于 用户 视角 的 用户 养成 运营 框架 并 从 产品 运营 过程 中 的 四大 生命周期 入手 阐述 如何 灵活 地 将 该 运营 框架 运用 于 产品 的 各个 生命周期 从而 彻底 地使 所有 运营 从业者 能够 从 各种 运营 困惑 中 解脱 出来 由内而外 地 激发 运营 思路 从根本上 提升 运营 工作 成效 进而 打造 个人 的 核心 运营 竞争力 
122282272,在 很多 方面 周鸿祎 都 是 互联网 领域 的 颠覆者 他 重新 定义 了 微 创新 提出 从 细微 之 处 着手 通过 聚焦 战略 以 持续 的 创新 最终 改变 市场 格局 为 客户 创造 全新 价值 他 第一个 提出 了 互联网 免费 安全 的 理念 也 由此 让 奇虎 360 拥有 了 超过 4 亿 的 用户 在 周鸿祎 自述 我 的 互联网 方法论 中 周鸿祎 首次 讲述 了 自己 的 互联网 观 产品 观 和 管理 思想 厘清 了 互联网 产品 的 本质特征 和 互联网 时代 的 新 趋势 列举 了 颠覆 式 创新 在 现实 中 的 实践 和 应用 周鸿祎 自述 我 的 互联网 方法论 首次 解密 360 的 产品 秘籍 和 盈利模式 同时 针对 目前 传统 企业 的 互联网 转型 焦虑 也 提出 了 一套 系统 解决方案 
122291268,信息 社会 理论 第 3 版 坚持 从 梳理 资本 的 历史 脉络 中 洞察 信息 社会 的 本质 借助 勾勒 贝尔 吉登斯 哈贝马斯 卡斯特 等 重要 信息 社会 理论家 的 论述 优劣 敏锐 揭示 了 信息 社会 成为 当下 资本主义 的 核心 特征 展示 出 商业 文明 覆盖 全球 的 所向披靡 之势 而 政治 压力 与 商业 技术 迷思 经新 自由主义 经济 的 整合 严重 消弱 了 公共服务 与 民主 基础 
122292375,可 伸缩 架构 技术 是 所有 互联网 技术 中 最 重要 也 是 最 引人入胜 的 技术 互联网 创业 核心技术 构建 可 伸缩 的 web 应用 针对 互联网 创业 需求 快速 迭代 业务 快速 发展 短时间 内 用户 数据 访问量 激增 的 特点 提纲挈领 地 描述 了 伸缩性 架构 的 基本原理 与 设计 原则 详细 阐述 了 Web 应用 前端 层 服务 层 数据 层 的 可 伸缩 架构 并花 大量 篇幅 讲述 了 缓存 技术 和 异步 处理 技术 的 可 伸缩 设计 及其 在 Web 系统 中 的 具体 应用 互联网 创业 核心技术 构建 可 伸缩 的 web 应用 面向 互联网 创业 公司 工程师 也 适用 于 所有 互联网 行业 的 工程师 对非 互联网 行业 的 软件 工程师 也 有 借鉴 作用 事实上 互联网 创业 核心技术 构建 可 伸缩 的 web 应用 适合 所有 对 可 伸缩 架构 有 兴趣 的 软件 技术人员 阅读 
122293429,为什么 把 每件 事情 都 做 对 了 仍 有 可能 错失 城池 为什么 无人 可敌 的 领先 企业 却 在 一夜之间 虎落平阳 现象 层面 的 总结 是 经验 哲学 和 科学 层面 的 提炼 石 世界观 其 力量 不可同日而语 互联网 思维 成就 了 创业 明星 成功 的 企业 创造 了 全新 的 商业模式 和 管理 方式 然而 互联网 思维 到底 是 什么 在 今天 这个 时代 什么 是 支撑 繁杂 表象 背后 的 逻辑 爱因斯坦 说 在 提出 问题 的 表层 不能 解决问题 我们 必须 回到 体系 的 原点 找到 颠覆 一切 的 公理 从 物理 哲学 管理 思维 多个 维度 进行 推演 这个 公理 包含 了 伟大 而 神奇 的 隐喻 它 是 撬动 互联网 时代 的 一个 支点 是 对 就 旧 思维 土崩瓦解 摧枯拉朽 的 引爆 力 是从 工业 时代 逃逸 出去 的 重生 通道 
122294055,不管 我们 度量 时间 的 方式 如何 这 的确 是 一个 变动 的 时刻 在 20 世纪 后 四分之一 期间 一场 以 信息 为 中心 的 技术 革命 改变 了 我们 思考 生产 消费 贸易 管理 沟通 生活 死亡 战争 以及 做爱 的 方式 一个 动态 的 全球 经济 已经 在 地球 各处 建构 起来 将 全世界 有 价格 或 价值 的 人 及 活动 联结 在 一起 但 那些 与 支配 利益者 无关 的 人 与 地 它们 与 权力 和 财富 的 联结 网络 却 被 关闭 了 一个 真实 虚拟 的 文化 围绕 着 相互影响 日益 加强 的 视听 宇宙 被 建构 起来 渗透到 每一处 精神 表征 和 沟通 传播 中以 电子 超文本 整合 文化 的 丰富性 空间 与 时间 做 为 人类 经验 的 物质基础 已经 被 转化 了 流动 空间 支配 了 地方 空间 无 时间性 的 时间 废除 了 工业 年代 的 时钟 时间 对抗 信息化 与 全球化 逻辑 的 社会 的 表达 围绕 着 原初 的 认同 而 建构 起来 形成 以 上帝 地域 种族 或 家庭 之名 而 建立 起来 的 防御性 社区 在 此 同时 要 建立 父权 家长制 和 民族 国家 等 如此 位高权重 的 社会制度 将会 在 信息 和 财富 的 全球化 以及 认同 与 合法性 的 地方化 相互 结合 形成 的 压力 之下 引起 质疑 u3000u3000 在 前 两卷 分析 了 这些 结构 变动 的 过程 及其 引发 的 宏观 的 政治 与 社会 脉络 的 基本 转化 所 塑造 与 决定 的 全世界 人类 经验 与 社会 行动 本卷 将 继续 探索 此一 宏观 转化 试着 将 它们 解释 为 几种 具有 信息时代 特性 的 过程 相互作用 所 造成 的 结果 如 信息化 全球化 网络化 认同 的 建构 父权 家长制 与 民族 国家 的 危机 等 虽然 并 不是 所有 历史 变动 的 重要 向度 都 包含 在 本卷 的 论述 中 但 作者 认为 在 以下 各章 中 所 罗列 与 分析 的 趋势 的确 建构 了 一种 新 的 历史 图景 它 的 动力 很 可能 对 我们 的 生活 与 我们 后代子孙 的 生活 造成 持续性 影响 u3000u3000 本卷 以 苏联 的 解体 为 分析 的 起点 并非 偶然 1917 年 俄国 革命 及其 点燃 的 国际共产主义运动 乃是 20 世纪 重要 的 政治 与 意识形态 现象 共产主义 与 苏联 与 对抗性 的 回应 曾 触动 整个 世界 并 深深地 影响 整个 世纪 的 社会 与 人民 然而 此 巨大 的 帝国 与其 强大 的 神话 却 在 短短 几年 中 崩溃 了 成为 全无 预料 的 历史 变动 中 的 最 离奇 例子 作者 认为 此 过程 的 根源 显示 了 一个 历史 时代 的 终结 表现 出 国家主义 无能 处理 向 信息时代 的 过渡 第一章 将试 提供 这个 陈述 的 经验性 基础 
122295296,1 本书 是 一本 超越 黑天鹅 的 惊世 之作 如果说 塔勒 布 认为 人类 行为 是 随机 的 都 是 小 概率 事件 是 不 可以 预测 的 那么 全球 复杂 网络 权威 Barabasi 则 认为 人类 行为 93% 是 可以 预测 的 2Barabasi 的 研究 是 在 人类 生活 数字化 的 大 数据 时代 基础 上 进行 的 移动电话 网络 以及 电子邮件 使 人类 行为 变得 更加 容易 量化 将 我们 的 社会 变成 了 一个 巨大 的 数据库 他 认为 人类 正 处在 一个 聚合 点上 在 这里 数据 科学 以及 技术 都 联合 起来 共同 对抗 那个 最大 的 谜题 我们 的 未来 3 在 本书 中 Barabasi 揭开 人类 行为 背后 隐藏 的 模式 爆发 提出 人类 日常行为 模式 不是 随机 的 而是 具有 爆发性 的 爆发 揭开 了 人类 行为 中 令人 惊讶 的 深层次 的 秩序 使得 人类 变得 比 预期 中 更 容易 预测 得 多 4 ． 爆发 模式 的 揭示 其 影响力 将 与 20 世纪 初期 的 物理学 或者 基因 革命 的 影响力 不相上下 
122295861,内容简介 随着 信息技术 和 互联网 的 发展 人们 逐渐 从 信息 匮乏 的 时代 走入 了 信息 过载 informationoverload 的 时代 在 这个 时代 无论是 信息 消费者 还是 信息 生产者 都 遇到 了 很大 的 挑战 对于 信息 消费者 从 大量 信息 中 找到 自己 感兴趣 的 信息 是 一件 非常 困难 的 事情 对于 信息 生产者 让 自己 生产 的 信息 脱颖而出 受到 广大 用户 的 关注 也 是 一件 非常 困难 的 事情 推荐 系统 就是 解决 这一 矛盾 的 重要 工具 推荐 系统 的 任务 就是 联系 用户 和 信息 一方面 帮助 用户 发现 对 自己 有 价值 的 信息 另一方面 让 信息 能够 展现 在 对 它 感兴趣 的 用户 面前 从而 实现 信息 消费者 和 信息 生产者 的 双赢 
122300980,我 在 阿里 做 运营 是 一本 散发 着 浓浓 阿里 味儿 的 运营 书 作者 进入 互联网 行业 7 年 曾 就职 于 携程 阿里巴巴 等 大 平台 也 服务 过小微 企业 传统 企业 及 诸多 职场 新人 不仅 经历 过 各类 运营 岗 也 经历 过 市场 品牌 等 岗位 对 精细化 运营 数据 化 运营 和 低成本 运营 有着 深刻 见解 本书 展示 了 在 阿里 这样 的 大 平台 做 运营 工作 的 真实 场景 也 提炼 了 适用 于小微 企业 的 经验 以及 让 运营 新人 快速 上手 的 技能 和 自我 修养 职业规划 
122301594,四步 创业 法获 李开复 推荐 是 精益 创业 理论 的 奠基 之作 作者 StevenGaryBlank 博士 是 硅谷 资深 企业家 他 一共 创办 了 八家 企业 并 担任 多家 硅谷 公司 的 董事 和 创业 顾问 本书 总结 作者 25 年 创业 经验 提出 全新 的 客户 发展 方法 诣 在 弥补 传统 产品 开发方法 的 缺陷 掀起 了 硅谷 近年 精益 创业 的 浪潮 七印 部落 正在 翻译 作者 的 博客 和 授课 视频 欢迎 访问 微博 http : weibocom7seals 本年度 最佳 科技 创业 图书 MarcAndreessen 网景公司 及 AndreessenHorowitz 风险投资 公司 创始人 这本 书我买 了 整整 一箱 送给 我 认识 的 每位 创业者 EricRies 精益 创业 TheLeanStartup 作者 Steve 用 客户 发展 方法 拯救 了 产品 开发方法 BabakNiviVentureHacks 网站 创始人 兼 主编 
122302082,删除 讲述 了 遗忘 的 美德 为 读者 展现 了 大 数据 时代 的 取舍 之道 删除 从大 数据 时代 信息 取舍 的 目的 和 方法 分别 诠释 了 被 遗忘 的 权利 维克托 首先 回溯 了 人类 追寻 记忆 的 过程 之后 提出 数字 技术 与 全球 网络 正在 瓦解 我们 天生 的 遗忘 能力 对此 他 考察 了 促进 遗忘 终止 4 大 驱动力 数字化 廉价 的 存储器 易于 提取 全球性 访问 之后 他 提出 了 当前 数字化 记忆 的 两大 威胁 信息 权力 与 时间 并 给出 了 应对 威胁 的 6 大 对策 数字化 节制 保护 信息 隐私权 建设 数字 隐私权 基础设施 调整 人类 的 现有 认知 打造 良性 的 信息 生态 完全 语境 化 最后 他 提出 了 一种 应对 数字化 记忆 与 信息安全 的 极 有 可能 的 关键 对策 给 信息 设定 存储 期限 删除 开启 了 一场 互联网 遗忘 运动 让 我们 始终 记得 遗忘 的 美德 这 本书 告诉 我们 在 大 数据 时代 面对 海量 信息 人类 该 如何 取舍 怎样才能 构建 一个 积极 而 安全 的 未来 删除 讲述 了 遗忘 的 美德 为 读者 展现 了 大 数据 时代 的 取舍 之道 数字 技术 赋予 了 我们 前所未有 的 权利 它 也 产生 了 意想不到 的 可怕 后果 facebook 上 照片 会 被 网络 永远 铭记 甚至 会 影响 到 一个 人 的 职业 发展 Google 记得 所有 我们 搜索 过 的 信息 和 时间 数字 王国 记住 了 那些 有时 最好 被 遗忘 的 信息 删除 大 数据 取舍 之道 就是 把 有 意义 的 留下来 把 无 意义 的 去掉 只有 理解 了 在 大 数据 中 需要 的 是 什么 以及 如何 判断 这种 需要 才能 举一反三 地 明白 到底 为什么 要 去掉 那些 不 需要 的 维克托 • 迈尔 舍恩 伯格 大 数据 时代 的 预言家 科学 自然 等 著名 学术期刊 最 推崇 的 互联网 研究者 之一 大 数据 商业 应用 第一 人 拥有 在 哈佛大学 牛津大学 耶鲁大学 和 新加坡国立大学 等 多个 互联网 研究 重镇 任教 的 经历 中国社科院 信息化 研究 中心 秘书长 姜奇平 作序 倾情 推荐 北京大学 新闻 与 传播学院 副教授 胡泳 中国科学院 理论物理研究所 研究员 李淼 麻省理工学院 教授 大卫 • 克拉克 国际 著名 信息 隐私权 专家 保罗 • 施瓦茨 斯坦福大学 互联网 与 社会 中心 创办人 劳伦斯 • 莱斯 格 波士顿咨询公司 高级 副总裁 菲利普 • 埃文斯 联袂 推荐 删除 一经 出版 即 获得 美国 政治 科学 协会 颁发 的 唐 • 普赖斯 奖 以及 媒介 环境 学会 的 最高 荣誉 马歇尔 • 麦克 卢汉奖 同时 受到 连线 自然 华尔街日报 纽约时报 等 各大 权威 媒体 广泛 好评 删除 洞见 了 被 遗忘 的 权利 探索 了 大 数据 时代 人类 该 如何 构建 积极 而 安全 的 未来 
122302645,设计 属于 所有人 也 意在 为 所有人 使用 这 既 是 设计 的 价值 也 是 设计 的 责任 本书 内容 包括 设计 理念 设计 方法 用户 研究 体验 设计 设计 流程 和 工具 以及 团队 成长 与 管理 等 方面 的 知识 与 经验 分享 
122303164,20 世纪 60 年代 早期 在 美国 大众 眼中 计算机 只是 冷战 中 冰冷 的 机器 然而 到 了 90 年代 互联网 到来 之 时 计算机 却 呈现出 一个 截然不同 的 世界 它们 模拟出 了 一个 数字 乌托邦 般的 协同 体而 这 正是 曾经 最 反对 冷战 的 嬉皮士 们 的 共同 愿景 本书 正是 探索 这次 非同寻常 且 颇具 讽刺 意味 的 变革 的 第一 本书 作者 挖掘出 那些 在 旧金山湾 区 的 先驱者 斯图尔特 布兰德 和 他 的 全球 网络 鲜为人知 的 故事 1968 年 到 1998 年 期间 通过 全球 概览 全球 电子 链接 WELL 和 最终 取得 巨大成功 的 连线 杂志 布兰德 和 他 的 伙伴 们 长期 扮演着 旧金山 嬉皮士 运动 和 新兴 科技 聚集区 硅谷 的 中间人 的 角色 正 由于 他们 富有 远见 的 努力 反 主流 文化 分子 和 科技 人士 一同 重新 定义 了 计算机 的 形象 计算机 是 解放 自我 的 武器 计算机 建筑 了 令人 耳目一新 的 虚拟社区 计算机 还 让 人们 能 更 大胆 地 拓展 社会 的 新疆 界 对于 全球 概览 人们 最 熟悉 的 莫过于 印在 最后 一期 1974 封底 的 一行 字 StayHungryStayFoolish 这句 话 被 苹果公司 创始人 史蒂夫 乔布斯 引作 格言 而 被 世人 所知 全球 概览 是 一本 由 斯图尔特 布兰德 发行 的 反 主流 文化 期刊 于 1968 至 1972 年 正常 发行 之后 也 偶有 出版 这本 杂志 把 所有 可以 售卖 的 产品 都 收录 进来 包括 衣服 书籍 工具 机器 种子 一切 对 创造力 和 自给自足 的 生活 方式 有用 的 东西 不过 杂志 本身 并 不 卖 任何 商品 乔布斯 曾 说 这本 杂志 是 影响 了 他们 那 一代人 的 杂志 并 称之为 那个 年代 的 Google 斯图尔特 布兰德 1938 – 是 美国 未来 学家 与 早期 网络 文化 的 推动者 全球 概览 创始人 TheWELL 和 全球 商业 网络 GBN 的 创办人 之一 斯图尔特 于 1996 年 创办 了 恒今 基金会 LongNowFoundation 以 推动 人们 养成 长线 思考 的 习惯 作出 更 理性 的 选择 他 最新 的 计划 是 制造 一座 万年 大钟 推荐 语 作为 书中 的 人物 之一 我 认为 这是 记录 我 是 如何 一步步 走 过来 的 最好 的 一 本书 作者 的 分析 取材 广博 可读性 强 凯文 凯利 连线 杂志 创始 主编 失控 作者 弗雷德 特纳 将 广博 的 学识 优雅 的 文笔 和 叙事 者 的 激情 都 融入 书 中将 dotcom 时代 的 的 各个 点 dots 都 连接 到 一起 他们 才 是 真正 的 技术 上 文化 上 和 精神 上 的 领袖 道格拉斯 洛 西克 夫 媒介 理论家 编程 或 被 编程 作者 作为 一个 出现 在 书 中 的 人 我 本 应该 对 作者 的 书 有 各种 吹毛求疵 的 意见 但是 我 没有 他 对 许多 简短 的 历史背景 进行 了 详尽 的 研究 和 准确 的 描述 令 我 印象 深刻 即使 是 对 经历 过 那些 时刻 的 人 来说 这 也 很 难 做到 斯图尔特 • 布兰德 全球 概览 创始人 地球 的 法则 作者 
