id,abstract
122135490,华盛顿邮报 金融时报 时代 福布斯 年度 最佳 图书奖 当 整个 世代 犯下 同一个 罪行 会 造成 怎样 的 后果 过去 我们 听 音乐 需要 购买 磁带 CD 那时 的 音乐 是 要 付费 的 但 不知 从 何时 开始 音乐 居然 成 了 网络 上 点 一下 鼠标 即可 享用 的 免费 午餐 本书 作者 斯蒂芬 • 维特 花费 五年 时间 飞越 美 欧亚 三 大洲 写成 这本 盗版 音乐 发展史 抽丝剥茧 探究 数字 音乐 盗版 的 真正 源头 维特 从 德国 开始 造访 了 发明 MP3 音频格式 的 声音 工程师 们 接着 来到 纽约 找到 捧 红 美国 国民 天后 泰勒 • 斯威夫特 等 流行 歌手 的 唱片业 大亨 再 转向 苏格兰 场 和 美国联邦调查局 然后 一路 追查 到 北卡罗莱纳州 西部 小镇 的 一名 CD 制造厂 员工 及其 背后 在 11 年 时间 里 泄露 超过 两万 张 专辑 的 音乐 爱好者 小组 最后 进入 互联网 的 黑暗 深处 挖掘出 音乐 产业 从 巅峰 迅速 没落 的 惊人 真相 这 不仅 是 一个 关于 音乐 产业 的 故事 更是 一段 从未 被 讲述 过 的 互联网 历史 
122141389,引爆 点 是 纽约 客 怪才 格拉 德威尔 的 一部 才华横溢 之作 他 以 社会 上 突如其来 的 流行 潮为 切入点 从 全新 角度 探索 了 控制 科学 和 营销 模式 他 认为 思想 行为 信息 及 产品 常会 像 传染病 暴发 一样 迅速 传播 正如 一个 病人 就 能 引起 全城 流感 几位 涂鸦 爱好者 能 在 地铁 掀起 犯罪 浪潮 一位 满意 而 归 的 顾客 还 能 让 新 开张 的 餐馆 座无虚席 发起 小规模 流行 的 团队 能 引发 大规模 流行 风暴 这些 现象 均 属 社会 流行 潮 它 达到 临界 水平 并 爆发 的 那一刻 就是 一个 引爆 点 格拉 德威尔 走访 了 宗教团体 成功 的 高科技 公司 以及 全球 最 优秀 的 推销员 他 分析 了 几种 有利于 开创 流行 潮 的 性格特征 剖析 了 种种 极具 感染力 的 事件 如 各种 风尚 吸烟 现象 儿童 电视节目 商业广告 等 并 阐明 背后 的 导火索 揭示 出 引发 流行 并 保持 势头 的 原则 和 方法 这样 的 引爆 点 正是 你 想 成为 出色 的 父母 市场部 经理 政策 制定者 和 生意人 的 秘诀 所在 
122142633,数字化 信息 交流 和 网络 社交 平台 占领 了 我们 的 生活 被 数字化 了 的 生命 实际上 导致 了 社群 公共 空间 的 坍塌 也 慢慢 侵蚀 了 政治 行动 的 可能 妨害 了 有 意义 的 政治 议程 数字化 交流 激发 了 瞬间 的 冲动性 反应 发送 和 接收 这种 信息 的 民众 变成 了 一个个 数字化 的 蜂群 这 不是 大众 而 不过 是 一些 被 相互 隔离 的 个体 不足以 称为 我们 不能 形成 解决问题 的 主导性 力量 不能 筹谋 未来 因为 他们 深陷 当下 数字 群是 一个 破碎 的 整体 当 信息 胜过 思想 一切 按照 脸书 股市 和 情报机构 的 法则 运行 民主 将 受到 威胁 自由 将 受到 损害 韩炳哲 作品 系列 见识 城邦 出品 精神 政治学 Psychopolitik 爱欲 之 死 AgoniedesEros 在 群中 ImSchwarm 他者 的 消失 DieAustreibungdesAnderen 疲怠 社会 M ü digkeitsgesellschaft 娱乐 何为 GuteUnterhaltung 暴力 拓扑学 TopologiederGewalt 透明 社会 Transparenzgesellschaft 美的 救赎 DieErrettungdesSch ö nen 阅读 韩炳哲 的 作品 无论如何 都 是 富有 才思 智慧 的 享受 阿兰 • 巴迪欧 AlainBadiou 法国 哲学家 韩炳哲 属于 这 一类 哲学家 在 他们 之前 没有 人 寻求 改变 世界 之道 甚至 没有 人 充分 意识 到 这种 改变 的 必要性 高等教育 内部 参考 InsideHigherEd 韩炳哲 揭示 出 在 大 数据 时代 批判 理论 将且 必将 重整旗鼓 威尔 • 戴维斯 WillDavies 大 数据 时代 形成 的 纷繁 现象 需要 新 的 哲学 思维 和 框架 韩炳哲 的 几本书 堪称 最 敏锐 最 犀利 的 时代 探测器 是 大 数据 时代 的 哲学 批判 指南 思郁 自由 写作者 德国 哲学家 韩炳哲 的 几本 小 书 大题小做 举重若轻 触及 现代人 生活 的 多个 层面 是 东西方 人文精神 碰撞 的 结晶 走进 了 读者 的 心灵 何道 宽 翻译家 深圳大学 英语 及 传播学 教授 海德格尔 曾经 把 人 的 生存 状态 描述 为 沉沦 亦 即 每 一个 个体 失去 了 去 存在 的 能力 置身于 闲谈 好奇 和 两 可 的 公众 舆论 之中 在 这里 貌似 穷尽 了 一切 可能性 而 实际上 没有 给 行动 留下 任何 可能性 韩炳哲 进一步 揭示 了 数字 时代 人 所 面临 的 困境 我们 痴迷 于 数字 媒体 从而 被 重新 编程 然而 对于 后果 如何 却 陷入 了 盲目 和 麻木 在 群里 每个 人 都 是 个人 但 每个 人 又 都 不是 他 自己 张志伟 中国人民大学 哲学 院 教授 韩炳 哲以 其 哲学 的 睿智 与 分析 的 犀利 迫使 我们 去 反思 数字 网络媒体 时代 的 生存 情调 与 伦理 处境 他 推进 了 大众 社会 考察 的 很多 关键 范畴 比如 对 倦态 与 山寨 的 思考 在 本雅明 的 技术 复制 与 福柯 的 生命 政治 之后 他 发现 了 数字 全景 监狱 的 新 现象 以此 把 社会 批判 理论 推进 到 心灵 政治学 的 层面 重新 连接 了 哲学 与 经验 在 他 的 思考 中 透露 出 东方 哲人 的 细腻 与 韵味 夏可君 哲学家 与 策展 人 中国人民大学 文学院 副教授 扫一扫 跟 扫 没有 任何 关系 渐渐 远离 大地 的 我们 是否 仍 有 力量 的 来源 迷恋 于 数字化 的 主动 和 便利 的 同时 我们 也 在 被 监视 中 迷失 也许 已经 没有 我们 只有 群 韩炳哲 的 在 群中 以 其 一贯 的 犀利 带给 我 凝视 深渊 的 勇气 贾克防 西北 师大 范 大学 哲学系 副教授 韩炳哲 是 互联网 时代 的 精神 分析师 在 他 精确 冷静 的 诊断 之下 智能手机 社交 媒体 大 数据 物 联网 种种 技术 进步 都 显示 出新 自由主义 秩序 对于 人类 生活 的 全面 宰制 资本主义 这一以 自由 为名 的 型态 早已 成为 一个 政治经济 文化 科技 的 联合体 它 
122144904,大多数 的 企业 管理 的 书籍 都 会 告诉 你 制定 商业 计划 分析 竞争 形势 寻找 投资人 等等 如果 你 要 找 的 是 那样 的 书 那么 把 这 本书 放 回 书架 吧 这 本书 呈现 的 是 一种 更好 更 简单 的 经商 成功 之道 读完 这 本书 你 就 会 明白 为什么 计划 实际上 百害 而 无 一益 为什么 你 不 需要 外界 投资人 为什么 将 竞争 视而不见 反倒 会 发展 得 更好 事实 是 你 所 需要 的 比 你 想象 的 少 得 多 你 不必 成为 工作狂 你 不必 大量 招兵买马 你 不必 把 时间 浪费 在 案头工作 和 会议 上 你 甚至 不必 拥有 一间 办公室 所有 这些 都 仅仅 是 借口 用 直截了当 的 语言 和 崇尚 简约 的 方式 重来 是 每 一个 梦想 着 拥有 自己 的 事业 的 人 的 完美 指南 不管 是 作为 中坚力量 的 企业家 小 企业主 还是 深陷 令人 不快 的 工作 中 的 职场 中人 被 炒鱿鱼 的 受害者 抑或 是 想要 脱贫 的 艺术家 都 能 在 这 一页 页 中 找到 弥足珍贵 的 指引 
122151280,本书 对 互联网 基盘 HTTP 协议 进行 了 全面 系统 的 介绍 作者 由 HTTP 协议 的 发展 历史 娓娓道来 严谨 细致 地 剖析 了 HTTP 协议 的 结构 列举 诸多 常见 通信 场景 及 实战 案例 最后 延伸 到 Web 安全 最新 技术 动向 等 方面 本书 的 特色 为 在 讲解 的 同时 辅以 大量 生动 形象 的 通信 图例 更好 地 帮助 读者 深刻理解 HTTP 通信 过程 中 客户端 与 服务器之间 的 交互 情况 读者 可 通过 本书 快速 了解 并 掌握 HTTP 协议 的 基础 前端 工程师 分析 抓包 数据 后 端 工程师 实现 RESTAPI 实现 自己 的 HTTP 服务器 等 过程 中所 需 的 HTTP 相关 知识点 本书 均 有 介绍 本书 适合 Web 开发 工程师 以及 对 HTTP 协议 感兴趣 的 各层次 读者 
122152282,覆雨翻云 的 中国 网 事 荡气回肠 的 产业 传奇 虚拟世界 的 真实 讲述 万象 网络 的 还原 走笔 本书 记录 了 一群 在 中国 创造 属于 自己 历史 的 人 和 他们 的 故事 他们 是 中国 互联网 自 1995 年 兴起 的 波澜壮阔 中 的 弄潮儿 和 财富 新贵 的 代表 马化腾 丁磊 张朝阳 马云 陈天桥 李彦宏 史玉柱 田溯宁 张树新 王志东 王峻涛 雷军 周鸿祎 陈一舟 他们 用 互联网 创造 和 推动 着 这个 国家 的 历史 并 改写 了 自己 的 财富 路径 他们 分 属于 三类 人 海归 从 海外 归来 的 创业者 本土 技术 爱好者 极客 和 商业价值 发现者 商人 中国 互联网 产业 作为 一个 产业 从 诞生 到 现在 不过 15 年 时间 但 在 短短的 15 年里 却 产生 了 接近 40 家 在 海外 市场 上 上市 的 公司 其中 超过 15 家 公司 达到 过 10 亿美元 市值 的 高位 这些 公司 的 领袖 以 其 无比 阳光 的 财富 路径 成为 新一代 中国 企业家 的 中坚力量 但 我们 不能 简单 地 把 中国 互联网 的 成功 看作 是 一个 支柱产业 的 崛起 这么 简单 而 更 应该 把 它 看作 是 我们 这个 民族 在 改革开放 的 大 时代 下 自我意识 觉醒 的 一次 大 的 提升 一次 全民 自发 的 集体性 的 自我 赶超 一次 从下到上 由 民众 自觉 自发 的 创富 运动 它 让 一代人 开始 有 了 自我意识 的 觉醒 并 帮助 我们 这个 国家 更好 的 开放 更好 的 用 世界 通行 的 商业 语言 进行 沟通 林军 和 他 撰写 的 这本 关于 中国 互联网 产业 历史 的 书 脉络 清晰 生动 鲜明 地 把 这样 一大批 创业者 的 形象 和 他们 的 动人 故事 呈现 在 读者 眼前 值得 一读 中国 互联网 协会 理事长 中国科协 副 主席 胡启恒林军 和 他 的 这本 关于 中国 互联网 产业 历史 的 著作 用 足够 多 的 事实 告诉 我们 我们 是 完全 有 可能 遵从 不 作恶 的 基本 道德 底线 做 最好 的 自己 的 Google 全球 副总裁 大中华区 总裁 李开复 中国 互联网 产业 发展 可 分 三个 阶段 窄带 互联网 的 建设 能 上网 宽带 互联网 的 建设 更 快 上网 和 目前 的 互联网 大规模 应用 创新 更好 上网 幸运 的 是 我 都 作为 一 分子 积极 地 参与 到 其中 而 更 宽广 的 路 才 刚刚开始 可贵 的 是 林军 先生 在 他 的 书 中用 他 的 笔和心 记录 下 这 一切 中国 宽带 产业 基金 董事长 田溯宁 读林军 的 这本 关于 中国 互联网 产业 历史 的 书 就 像 回到 了 那段 激情 燃烧 的 岁月 卓越 网 创始人 金山公司 副董事长 雷军 林军 对 互联网 这个 行业 的 观察 和 记录 超过 12 年 写 这 本书 的 时间 超过 3 年用 这么 长 的 时间 做 这样 一件 有 功德 的 事情 难能可贵 林军 和 这本 关于 中国 互联网 产业 历史 的 书 值得 期待 松禾 资本 董事长 罗 飞身 为 互联网 投资 领域 的 先驱 之一 我 一向 认为 中国 有朝一日 必将 成为 互联网 的 主要 市场 如今 事实 已经 摆在 眼前 林军 这 本书 记述 了 中国 的 互联网 发展 历史 描摹 出 一群 优秀 的 互联网 企业家 和 风险投资 人 生动 地 再现 了 梦想 变成 现实 的 过程 若想 了解 中国 互联网 的 过去 与 未来 林军 这 本书 不 容错过 零 重力 作者 美国 畅销书 作家 风险投资 人 史蒂夫 • 哈蒙 
122152764,人类 与 信息 遭遇 的 历史 由来已久 詹姆斯 • 格雷 克 笔下 的 这段 历史 出人意料 地 从 非洲 的 鼓语 讲 起 第 1 章 非洲 土著 部落 在 尚未 直接 跨越 到 移动电话 之前 曾用 鼓声 来 传递 讯息 但 他们 是 如何 做到 的 呢 后续 章节 进而 讲述 了 这段 历史 上 几个 影响 深远 的 关键 事件 包括 文字 的 发明 第 2 章 罗伯特 • 考 德里 的 第一本 英语词典 第 3 章 查尔斯 • 巴贝奇 的 差分 机与 爱达 • 拜伦 的 程序 第 4 章沙普 兄弟 的 信号 塔 与 摩尔 斯 电码 第 5 章 但 人类 开始 自觉 地 理解 和 利用 信息 始于 克劳德 • 香农 在 1948 年 创立 的 信息论 第 67 章 香农 的 信息论 不仅 推动 了 信息技术 的 发展 也 引发 了 许多 学科 的 信息 转向 第 8 章 改变 了 人们 对于 诸如 麦克斯韦 妖 第 9 章 生命 的 编码 第 10 章模 因 第 11 章 随机性 第 12 章 量子 信息论 第 13 章 等 的 理解 部分 科学家 甚至 认为 构成 世界 的 基础 不是 物质 不是 能量 而是 信息 正如 物理学家 约翰 • 惠勒 所说 万物 源自 比特 现如今 信息 如 洪流 般 淹没 了 我们 使 我们 深陷 信息 焦虑 信息 过载 信息 疲劳 的 困扰 但 回顾历史 这 并 不是 件 新鲜事 人们 也 总是 能 想 出 应对 手段 维基百科 第 14 章 Google 第 15 章 便是 我们 的 应对 之一 无论 对于 信息 的 未来 持何 态度 有 一点 是 确定无疑 的 即 我们 人类 是 信息 的 造物 作为 混沌 费曼 传 越来越快 牛顿 传等 畅销书 的 作者 格雷 克 不仅 在 书 中 细致 还原 了 历史 细节 通俗 解释 了 各种 理论 还 生动 刻画 了 几位 不 为 大众 所知 的 人物 可编程 计算机 先驱 超越 时代 的 查尔斯 • 巴贝奇 第一位 程序员 诗人 拜伦 之女 爱达 • 拜伦 计算机科学 之父 天妒 英才 的 阿兰 • 图灵 以及 全书 的 主人公 信息论 之 父 克劳德 • 香农 
122154530,互联网 革命 最 伟大 的 思考者 克莱 • 舍基继 未来 是 湿 的 之后 最新 力作 看 自由 时间 如何 变革 世界 的 未来 如果说 未来 是 湿 的 揭示 的 是 无 组织 的 组织 力量 那么 认知 盈余 揭示 的 就是 无 组织 的 时间 力量 腾讯 董事会 主席 兼 首席 执行官 马化腾 首度 亲笔 作序 倾情 推荐 克莱 • 舍基 说 美国 人 一年 花 在 看电视 上 的 时间 大约 2000 亿个 小时 而 这 几乎 是 2000 个 维基百科 项目 一年 所 需要 的 时间 如果 我们 将 每个 人 的 自由 时间 看成 一个 集合体 一种 认知 盈余 那么 这种 盈余 会 有 多 大 我们 已经 忘记 了 我们 的 自由 时间 始终 属于 我们 自己 我们 可以 凭 自己 的 意愿 来 消费 它们 创造 它们 和 分享 它们 我们 可以 通过 积累 将 平庸 变成 卓越 
122155196,一个 企业 的 发展 与 崛起 绝非 只是 空有 领导 强人 即可 达成 任何 的 决策 同期 的 商业 环境 都 在 都 影响 着 企业 的 兴衰 浪潮 之巅 不 只是 一本 历史 书 除了 讲述 科技 顶尖 企业 的 发展 规律 对于 华尔街 如何 左右 科技 公司 以及 金融风暴 对 科技产业 的 冲击 也 多 有 着墨 此外 这 本书 也 着力 讲述 很多 尚 在 普及 或 将要 发生 的 比如 微博和云 计算 以及 对 下一代 互联网 科技产业 浪潮 的 判断 和 预测 因为 在 极度 商业化 的 今天 科技 的 进步 和 商机 是 分不开 的 诚如 作者 所言人 的 商业 知识 和 眼光 不是 天生 的 需要 不断 地有 心地 学习 经过 多年 的 学习 思考 和 实践 我 认定 这样 一个 规律 就是 科技 的 发展 不是 均匀 的 而是 以 浪潮 的 形式 出现 每 一个 人 都 应该 看清楚 浪潮 赶上 浪潮 如此 便 不 枉 此生 
122160368,全球 商业 领域 中 许多 企业 曾 叱咤风云 但 面对 市场 变化 及 新 技术 的 挑战 最终 惨遭 淘汰 究其原因 竟然 是因为 它们 精于 管理 信奉 客户 至上 等 传统 商业 观念 这 就是 所有 企业 如今 都 正 面临 的 创新者 的 窘境 在 创新者 的 窘境 中 管理 大师 克里斯 坦森 指出 一些 看似 很 完美 的 商业 动作 对 主流 客户 所 需 赢利 能力 最强 的 产品 进行 精准 投资 和 技术 研发 最终 却 很 可能 毁掉 一家 优秀 的 企业 他 分析 了 计算机 汽车 钢铁 等 多个 行业 的 创新 模式 发现 正是 那些 暂时 遭到 主流 客户 拒绝 的 关键 的 突破性 的 技术 逐渐 演变成 了 主导 新 市场 的 破坏性 创新 如果 企业 过于 注重 客户 当下 的 需求 就 会 导致 创新能力 下降 从而 无法 开拓 新 市场 常常 在 不经意 间 与 宝贵 机遇 失之交臂 而 更 灵活 更具 创业精神 的 企业 则 能 立足 创新 把握 产业 增长 的 下 一波 浪潮 克里斯 坦森 根据 大量 企业 的 成败 经验 提出 将 破坏性 创新 进行 资本化 运作 的 一系列 规则 何时 不 应 盲从 客户 何时 应 投向 性能 较 低 利润 空间 较 小 的 产品 何时 需 舍弃 看似 规模 更大 利润 更 高 的 市场 转而 发展 细分 市场 创新者 的 窘境 将助 你 预知 即将来临 的 变化 在 险象环生 的 商业 竞争 中 实现 基业 长青 
122161401,几年 前 数学 之美 系列 文章 原 刊载 于 谷歌 黑板报 获得 上百万 次 点击 得到 读者 高度评价 读者 说读 了 数学 之美才 发现 大学 时学 的 数学知识 比如 马尔可夫 链 矩阵 计算 甚至 余弦 函数 原来 都 如此 亲切 并且 栩栩如生 才 发现 自然语言 和 信息处理 这么 有趣 在 纸 本书 的 创作 中 作者 吴军 博士 几乎 把 所有 文章 都 重写 了 一遍 为的是 把 高深 的 数学原理 讲得 更加 通俗易懂 让 非专业 读者 也 能 领略 数学 的 魅力 读者 通过 具体 的 例子 学到 的 是 思考问题 的 方式 如何 化繁为简 如何 用 数学 去 解决 工程 问题 如何 跳出 固有 思维 不断 去 思考 创新 第二 版 增加 了 针对 大 数据 和 机器 学习 的 内容 以便 满足 人们 对 当下 技术 的 学习 需求 同时 根据 专家 和 读者 的 反馈 更正 了 一些 错漏 并 更新 了 部分 内容 数学 之美 第一版 荣获 国家图书馆 第八届 文津 图书奖 入选 广电总局 2014 年 向 全国 青少年 推荐 百种 优秀 图书 书目 荣获 20122013 年度 全 行业 优秀 畅销书 浪潮 之巅 文明 之光 作者 吴军 博士 最新 力作 李开复 作序 推荐 Google 黑板报 百万 点击 新版 增加 了 大 数据 和 机器 学习 等 最新 内容 以 满足 人们 对 当下 技术 的 学习 需求 同时 根据 专家 和 读者 的 反馈 更正 了 错漏 并 更新 了 部分 内容 
122163149,追求 简单 易用 是 人类 的 本性 无论是 互联网 产品 还是 移动 应用 亦 或 其他 交互式 设计 简单 易用 始终 都 是 赢得 用户 的 关键 同时 简单 易用 的 程度 也 与 产品 寿命 的 长短 密切相关 在 简约 至上 : 交互式 设计 四 策略 中 作者 Giles 托 20 多年 交互式 设计 的 探索 与 实践 提出 了 合理 删除 分层 组织 适时 隐藏 和 巧妙 转移 这 四个 达成 简约 至上 的 终极 策略 讲述 了 为什么 应该 站 在 主流 用户 一边 以及 如何 从 他们 的 真实 需求 和 期望 出发 简化 设计 提升 易用性 创造 出 卓而不群 历久弥新 的 用户 体验 
122164134,在 当今 整个 中国 社会 都 处于 互联网 转型 的 浪潮 中 不管 是 政府职能 单位 业务 规模 庞大 的 央企 还是 面临 最 激烈 竞争 的 零售 行业 都 处于 一个 重要 的 转折点 这个 转折 对 企业 业务 模式 带来 了 冲击 当然 也 给 企业 的 信息中心 部门 带来 了 挑战 如何 构建 IT 系统 架构 更好 地 满足 互联网 时代 下 企业 业务 发展 的 需要 阿里巴巴 的 共享 服务 理念 以及 企业级 互联网 架构 建设 的 思路 给 这些 企业 带来 了 不少 新 的 思路 这 也 是 我 最终 决定 写 这 本书 的 最 主要 原因 本书 从 阿里巴巴 启动 中 台 战略 说起 详细 阐述 了 共享 服务 理念 给 企业 业务 发展 带来 的 业务 价值 接着 会 分享 阿里巴巴 在 建设 共享 服务体系 时 如何 进行 技术 框架 的 选择 哪些 重要 的 技术 平台 支撑 起 了 共享 服务体系 这 也 是 迄今为止 对 阿里巴巴 集团 中间件 体系 对外 最 全面 系统 的 介绍 除了 技术 层面 之外 本书 还 分享 了 阿里巴巴 内部 的 一些 经验 和 实践 如 组织 的 架构 和 体制 如何 更好 地 支持 共享 服务体系 的 持续 发展 
122164821,小米 新 零售 如何 做到 20 倍 坪 效天 猫 小店 如何 利用 大 数据 助力 线下 零售 盒马 鲜生 为什么 坚持 必须 用 App 才能 买单 名 创优 品 实体 小店 在 电商 冲击 下 如何 拥抱 春天 新 零售 的 未来 在 何方 什么样 的 思维 模式 才 可 应对 新 零售 不是 商界 大佬 的 专用名词 它 就 在 我们 生活 触手可及 的 各个 角落 小到 便利店 的 酸奶 大到 京东 商城 的 冰箱 都 蕴含着 消费者 货物 经营场所 三者 共同 作用 的 经济 逻辑 新 零售 是 互联网 时代 我们 每天 都 会 接触 到 的 时尚 经济学 新 零售 也 不是 只有 电商 从业者 才 需要 发掘 的 秘宝 而是 所有 跟 销售 有关 的 从业人员 都 应该 武装 的 新思维 新 武器 因为 在 这个 大 数据 时代 有 交易 的 地方 就 有 新 零售 
122165540,第三次 浪潮 作者 托夫勒 在 20 多年 前 预见 的 未来 是 跨国企业 将 盛行 电脑 发明 使 SOHO 在家 工作 成为 可能 人们 将 摆脱 朝九晚五 工作 的 桎梏 核心家庭 的 瓦解 DIY 自己 动手做 运动 的 兴起 时过境迁 如今 我们 才 发现 托夫勒 的 预言 竟 大多 已 成为 了 现实 u3000u300020 年前 的 第三次 浪潮 在 打开 国门 之初 给 人们 心灵 造成 的 冲击 其 影响 至今 仍然 连绵不绝 托夫勒 在 这 本书 中将 人类 社会 划分 为 三个 阶段 第一次 浪潮 为 农业 阶段 从 约 1 万年前 开始 第二阶段 为 工业 阶段 从 17 世纪末 开始 第三阶段 为 信息化 或者 服务业 阶段 从 20 世纪 50 年代 后期 开始 我们 现在 正 亲历 着 如 托夫勒 所言 的 第三次 浪潮 社会 变化 的 浪潮 冲击 又 重叠 造成 冲突 和 压力 也 带来 新生 和 转机 大 变革 的 强烈 冲击 让 我们 感到 动荡 和 不安 而 托夫勒 的 著作 则 给 我们 指引 出 了 清晰 的 路向 u3000u3000 托夫勒 也许 并 没有 给 我们 带来 直接 财富 但 他 许给 了 人们 一个 梦想 多年 以后 当年 阅读 托夫勒 的 年轻人 已 成为 中国 经济 建设 的 中流砥柱 托夫勒 的 思想 或多或少 仍 在 指引 看 他们 创造 未来 u3000u3000 在 新世纪 之初 让 我们 重温 托夫勒 的 这部 经典作品 感受 托夫勒 惊人 的 激情 预言 
122170536,本书 作者 近距离 地 采访 了 与 Facebook 相关 的 人士 其中 包括 Facebook 的 创始人 员工 投资人 意向 投资人 以及 合作伙伴 加 起来 超过 了 130 人 这 是 真切 详实 的 访谈 更是 超级 精彩 的 故事 作者 以 其 细腻 的 笔触 精巧 的 叙事 结构 解密 了 Facebook 如何 从 哈佛 的 宿舍 里 萌发 创始人 的 内讧 权力 之争 如何 放弃 华盛顿邮报 的 投资 怎样 争取 到 第一个 广告 客户 而 第一轮 融资 又 如何 获得 一 亿美元 的 估值 让 人 痴迷 的 图片 产品 如何 上线 面对 Twitter 的 竞争 与 Google 的 世纪 之争 一个 创办 仅 7 年 就 拥有 5 亿 活跃 用户 年收入 超过 5 亿美元 估值 超过 200 亿美元 的 传奇 企业 再 加上 一个 年仅 26 岁 的 的 娃娃 CEO 在 你 面前 裸奔 激情 澎湃 的 创业精神 智慧 传奇 的 融资 经历 一个 聚合 世界 的 社交 帝国 向 你 彻底 开放 你 还 等 什么 
122171760,继 重新 定义 公司 重新 定义 团队 之后 谷歌 重磅 作品 谷歌 方法 强势 来袭 作为 全球 顶级 的 科技 公司 之一 谷歌 成功 的 核心 方法 在于 吸引 创意 精英 提供 平台 打造 卓越 产品 谷歌 方法 以谷歌 地图 为 切入口 讲述 了 谷歌 如何 通过 上述 方法 用 6 年 时间 将 谷歌 地图 打 造成 月活 用户 超过 10 亿 的 伟大 产品 在 谷歌 方法 中 你 将 看到 谷歌 招揽 英才 提供 不 设限 的 平台 资源 收购 新创 公司 背后 的 逻辑 拉里 佩奇 与 谢尔盖 布林 从 大处 着想 利用 地图 产品 实现 谷歌 的 战略 布局 谷歌 突破 技术 的 限制 相继 推出 谷歌 地图 谷歌 地球 谷歌 街景 彻底改变 了 人类 游览 世界 的 方式 谷歌 地图 如何 促成 了 AirbnbUber 无人驾驶 汽车 等 基于 地图 的 新兴 企业 和 科技 的 发展 现象 级 AR 游戏 精灵 宝可梦 GO 如何 引爆 全球 用户 创意 精英 如何 跳脱 传统 的 商业 原则 实现 梦想 与 开创 未来 的 
