id,abstract
47837,用心 暖化 你 百度 云 下载 鱼 的 记忆 只有 七秒 而 我 却 爱 了 你 七年 乔初 浅 乔初 浅 从 没有 想到 在 回国 的 第一天 她 会 遇到 她 的 前夫 沈 北川 外界 传言 娱乐圈 大亨 沈 北川 矜贵 冷酷 不近人情 不 碰 女色 却 无人 知道 他 结过婚 还 离过婚 甚至 还有 个 儿子 谁 的 他 冰冷 开口 我 我 自己 生 的 哦 不如 请乔 秘书 给 我 示范 一下 如何 自交 他 一字一顿 步步 趋近 将 她 逼 的 无路 可退 乔景言 小朋友 不依 了 一口 咬住 他 的 大腿 放开 我 妈咪 我 是 妈咪 和 陆祁 叔叔 生 的 和 你 无关 男人 的 眼神 骤然 阴鸷 陆祁 叔叔 
47838,关于 阎王 关于  高干  阎王 入 ; gt ; 本文 将 于 12 月 30 日入 V 周一 届时 将 更新 三章 谢谢 支持 ; gt ; 三代 长得帅 性格 不骄不躁 脾气 偶尔 略 爆 插班生 纪悄 孤僻 症 见光死 同学 眼中 的 活死人 老师 眼中 的 优等生 说 的 是 外号 阎王 的 高富帅 看上 了 班里 新来 的 白面书生 于是 强取豪夺 之 本 以为 那人 最 多 是 一个 阴郁 虚弱 的 白无常 却 不知 人家 才 是 冷面 冷心 的 活阎王 一句 话 文案 阎王 遇上 活阎王 其实 就是 一篇 流水账 的 校园 小 故事 属性 对外 霸气 侧漏 对 受 狗腿 攻 ; gt ; 1 到 2 日 一 更 热 金牌 坑品表 催文哟 
47840,重生 回来 的 蓝天 决定 踹 掉 她 前世 的 渣 夫带 着 奶奶 叔叔 婶婶 过 她 的 幸福 小日子 没事 的 时候 种种 田修 修仙 等 奶奶 他们 寿终正寝 后 选个 深 山野 林 避世 修炼 飞升 谁知 前世 的 渣夫 洗心革面 重生 做人 死 扒 着 她 不放 蓝天 很 苦恼 很 困惑 一向 冷酷 不近人情 的 人 突然 耍起 无赖 来 怎么办 在线 等 急 
47841,一句 话 简介 这是 一个 女扮男装 的 女主 被 送入 京城 为质 后 被 暴君 强取豪夺 了 的 故事 二贱 蠢萌 质子 X 无 节操 男神 暴君 
47842,卫安 这 一世 都 好似 活在 一场 梦里 这个 梦 平静 得 如同 一汪 死水 直到 有 一天 这 汪 湖水 被 一颗 叫做 死亡 的 石子 给 打破 了 从此 死水 成 了 吞噬 人 的 海 她 的 人生 在 最后 时期 终于 波澜壮阔 石破天惊 死亡 和 永别 来 的 猝不及防 又 无法挽回 生 离 尚有 可会 之期 死别 却 再 无 重逢 之时 当 她 明白 这个 道理 的 时候 她 已经 没 了 选择 的 机会 可一 睁开眼睛 又 好像 做 了 一个 梦 命运 的 齿轮 才 刚刚开始 转动 一 念 前程 美 似锦 一 念 高墙 锁 芳华 从此 她 才 是 那 只 掌控 自己 命运 的 遮 天大 手是 仍旧 活 的 浑浑噩噩 如同 台上 木偶 被 人 摆布 还是 当 摆布 木偶 的 人 这 是 个 问题 
47843,作者 百里 玺 题材 仙凡 幻想 简介 此生 尘缘 早已 尽 我 本 尘世 一仙凡 起于 微末 傲 红尘 修 得 蜉蝣 忘 江湖 
47844,简介 现代 她 是 一名 白领 古代 她 是 绣艺 高超 的 绣 女 奈何 一朝 回乡 却 遇到 一个 反派 里 的 极品 恶毒 老娘 这 日子 该 怎么 过 呢 且 看 现代人 如何 用 古代 技艺 发家致富 抱拥 相爷 大 男神 
47845,在 古代 禁毁 小说 中 真正 属于 淫书 今天 仍 被 查禁 的 应属 少数 而 大多数 作品 不乏 古代 文学遗产 中 的 精华 在 思想 和 艺术 上 有 一定 价值 值得 我们 来 研究 正是 由于 古代 禁毁 小说 的 特殊 地位 和 价值 我们 才 编选 这套 中国 十大 禁毁 小说 文库 书中 的 小说 有 的 反映 当时 的 进步 思想 有 的 表现 重要 历史 事件 有 的 暴露 封建社会 的 罪恶 有 的 在 艺术 技巧 上 可供 借鉴 都 可供 读者 学习 和 讨论 因此 这 套书 不仅 给 读者 以 过去 雪夜 闭门 读 禁书 的 神秘感 更 使 人 领略到 一些 被 历史 隐没 的 古代 小说 佳作 的 全貌 
47846,云 阅读 玄幻 大赛 高手 奖 作品 十年 前 的 绝世 天才 被 废 十年 后 一块 神秘 的 玉石 因缘 出现 少年 一朝 觉醒 得 无上 传承 从此 鱼跃龙门 拳碎 虚空 以无上 神威 打入 那 神秘 的 远古 世界 踏上 横扫 九天 十地 的 逆袭 之路 读者群 217878558 
47847,混沌 那么 大 我 想 去 看看 混沌 之外 是 什么 洪荒 天道 是 什么 混沌 大道 是 什么 不 能够 威压 诸天 万界 说 什么 洪荒 至尊 一个 穿越 少年 的 无限 洪荒 之路 ps 本书 偏 设定 党 和 嘴 炮流 洪荒 流 ＋ 无限 流 主角 配角 反派 龙套 智商 正常 
47848,李秀英 长 的 黑 还是 个 喝水 就 胖 的 体质 丈夫 又 整日 里 与 小姨子 搞 暧昧 重生 的 李秀英 在 渣夫 与 白莲花 妹妹 之间 周旋 时 还要 掐着 腰 大声 制止 外来人员 那个 首长 请 你 不要 打着 关心 名义 干涉 一个 小保姆 的 生活 新书 重生 九零 之 军长 俏 娇妻 
47849,格林 穿越 到 了 一个 剑 与 魔法 的 世界 中 并且 成为 了 魔王 后来 发现 这个 这个 世界 除了 剑 与 魔法 外 竟然 还有 迷宫 自己 这个 魔王 似乎 有 能力 对 迷宫 进行 改造 真是 越来越 有 RPG 游戏 的 感觉 了 格林 回头一看 发现 改造 需要 大量 混沌 魔力 而 自己 初期 因为 挥霍 了 太 多 魔力 破产 了 
47850,在 孤儿院 长大 的 郭毅强 在 他 年满 十八岁 那 一年 也 终于 到 他 独立自主 的 时候 了 于是 他 离开 生活 了 十七年 的 家 告别 了 照顾 他 多年 的 院长 毅然 的 选择 出外 创业 期待 有 一天 他 能 衣锦还乡 为 孤儿院 作出贡献 在 创业 的 过程 中 他 凭借 身体 能 发出 媚惑 异性 香气 的 异能 而 得到 了 形色 各异 女性 的 帮助 在 短时间 内 成就 了 一番 丰功伟业 
47851,她 进错 了 房 他 睡 错 了 人 一个 意外 的 小 生命 让 本 是 商场 死对头 的 两人  不得不 走进 婚姻 盛世 婚礼 他 在 当天 飞往 巴黎 寻求 心爱 女子 原谅  丢下 她 只身一人 在 婚礼 上 受尽 难堪 结婚 五年 他 在外 风流 她 视若 无 堵 他 冷嘲热讽 她 恍若 未闻 她 骄傲 无法 卑微 祈求 却 相信 时间 可以 让 他 对 自己 改观 直到 妈妈 我 想见 爸爸 手术室 里 女儿 奄奄一息 的 昵喃 着 要 爸爸 她 含泪 拔 了 他 的 电话 顾泽恺 轩轩 马上 要 准备 手术 我 没 时间 和 你 废话 她 一 开口 便 被 打断 再拔 已 关机 顾泽恺 为了 那 女人 的 儿子 你 连 亲生骨肉 都 不要 了 吗 当 难以 预 
47852,时来 天地 皆 同力 运去 英雄 不 自由 归藏 剑阁 三十二 代 弟子 宋明 庭 天赋 平庸 悟性 愚钝 却 凭着 大 恒心 大 毅力 一步步 赶上 同门 然而 就 在 宋明 庭 一步步 赶超 同门 之际 归藏 剑阁 突遭 魔宗 奇袭 一夕之间 山门 被 毁 同门 凋零 此后 宋明 庭便 开始 了 一百多年 的 逃亡 生涯 然而 纵使 他 如何 挣扎 最终 却 还是 难逃 死亡 命运 再次 醒来 宋明 庭 却 发现自己 正 躺 在 年少 时期 常 练功 的 水潭 底 本书 严肃 向 正剧 向主 配角 智商 正常 反派 有 风骨 
47853,机遇 与 危险 共存 只要 豁出 性命 在 轮回 乐园 中 就 能 得到 一切 被 轮回 乐园 选中 成为 猎杀者 的 那一刻 苏晓 就 明白 他 将 与 所有人 为 敌 乐园 虽然 残酷 但 无所不能 
47854,顾母 的 命 让 孟 含成 了 要挟 顾未辞 结婚 的 恶毒 女人 他 为了 母亲 娶 了 她 却 更 恨 她 婚后 的 每个 日夜 孟含 都 在 苦苦 解释 她 没有 做 可是 顾未辞 不信 他 盯 着 她 的 眼睛 吐出 的 话语 比 刀剑 更 伤人 孟含 收起 你 的 龌龊 心思 我 永远 不会 爱 你 更 不会 让 我 孩子 的 身体 里 流淌 着 你 那 肮脏 的 血 
47855,不可 错过 的 世界 爱情 经典小说 女 主人公 简爱 是 一个 心地纯洁 善于 思考 的 女性 她 生活 在 社会底层 受尽 磨难 但 她 有 倔强 的 性格 和 勇于 追求 平等 幸福 的 精神 她 的 爱情 是 扎根 于 相互理解 相互尊重 的 基础 之上 的 深挚 爱情 
47856,上辈子 明微 疲于奔命 终究 没 能 改变 国运 失去 了 最 重要 的 亲人 睁开眼 她 发现自己 回到 了 七十年 前 昏庸 的 灵帝 还 没 登位 凶悍 的 胡人 还 没 建立 西魏 南楚 的 野心家 还 没 掌权 北齐 仍然 兵强马壮 这 还 等 什么 赶紧 把 该 干掉 的 干掉 该 弄死 的 弄死 收一波 人头 啊 接着 找到 帝星 辅佐 他 登上 帝位 好好 治理 天下 她 就 可以 美滋滋 回去 与 亲人 团聚 享受 盛世 了 然后 来 都 来 了 不当 个 皇后 再 走 
47857,林风 穿越 了 变身 了 还 附带 一个 修仙 大 宗主 系统 ． 没有 瓶颈 一步一个脚印 不 当天 才 从不 越级 挑战 打造 无数 位面 最强 的 修仙 宗门 貂婵 别 叫 掌门 嗯 请 叫 我 宗主 大人 
47858,尚 在 拼搏 奋斗 的 影视 小 编剧 韩觉 一 觉醒 来 发现 不仅 自己 变 了 连 世界 都 变 了 这里 的 华夏 娱乐 产业 之 发达 超过 大洋彼岸 的 好莱坞 金马奖 已 成为 全世界 含金量 最大 的 电影 奖项 歌手 作为 歌手 顶级 赛场 已经 出 到 第十 季 华夏 好 声音 每 三年 一次 每次 播放 都 是 全民 狂欢 华夏 有嘻哈 第八 季 报名 人数 超过 十万 蒙面 歌王 每周 一期 永远 不缺 被 埋没 的 声音 街上 很 容易 可以 看到 拍 节目 的 剧组 举着 手机 的 主播 恶作剧 路人 的 视频网 红 这里 是 文娱 从业者 们 最好 的 时代 现世 作为 一个 过 气 偶像 明星 的 韩觉 身处 这 娱乐 盛世 的 边缘 已经 完全 不 
47859,依旧 华娱 系列 从小 鲜肉 到 大 导演 世界 有点 乱群 号 608668087 
47860,新书 名门 女帝 已开 欢迎 入坑 名满天下 的 顾玉青 在 她 的 新婚之夜 被 至亲 之人 灌下 一杯 鹤顶红 原以为 命丧 黄泉 再 睁眼 却 又 重新 回到 十三岁 身边 还 多 了 一块 能说会道 要 吃 要 喝毒 舌 又 话 唠 的 上古 神玉 重生 不易 既 是 上天 垂怜 她 便 绝不 负 此生 上 一世 的 仇要 报 这 一世 的 日子 也 要 过 只是 男主 你 能 不能 消停 一会 吃 干 抹 净 也 就算 了 干嘛 总给 吃 瓜 群众 发糖 Ps : 本文 虐 渣打 脸大爽 文男主卖 萌宠文 
47861,带 着 一身 通天本领 强势 回归 会 治病 会 算命 会 炼药 会 摆阵会 炼符 这个 世界 上 没有 我 办不到 的 事情 沈风 
47862,一个 人 的 命运 啊 当然 要 靠 自我 奋斗 但是 也 要 考虑 到 历史 的 行程 你 说 我 一个 好好 的 天朝 白领 怎么 就 来到 了 新 东京 成 了 一个 声优 经纪人 呢 一个 天朝 伪宅 和 另 一个 世界 线 的 自己 重合 了 这个 世界 没有 钉宫 也 没有 东山 没有 佐仓 而 他 成 了 一个 即将 倒闭 的 事务所 的 声优 经纪人 面对 自己 的 声优 即将 沦落 到 配里 番 的 状况 中 既然 穿越 了 那 就 成为 新世界 的 卡密 没有 钉宫 那 就 造 一个 钉宫 没有 东山 那就造 一个 东山 Lovelive 不 只是 二次元 我 还要 办 现实 世界 的 学院 偶像 比赛 没有 漫展 那 就 引爆 同人界 的 原子弹 虚拟 偶像 
47863,程燃 重生 在 这个 熟悉 又 陌生 的 世界 程程 皆 燃 
47865,诺兰 大陆 的 混乱 之 城中 有着 一家 奇怪 的 餐厅 在 这里 精灵 要 和 矮 人 拼 桌兽 人 被 严禁 喧哗 巨龙 只能 围坐在 餐厅 前 的 小 广场 上 恶魔 甚至 需要 自己 带 特制 的 凳子 但 就是 这么 一家 规矩 奇葩 的 餐厅 门口 却 每天 都 排着 长队 精灵 们 不顾 仪态 的 撸 串 巨龙 们 握 着 漏勺 围坐在 火锅 前 恶魔 们 吃 着 可爱 的 团子 这里 的 美食 在 大陆 上 找 不到 第二家 这个 老板 是 个 天才 有 客人 这样 评价 然后 偷偷 看 了 一眼 门口 的 的 方向 还有 千万别 想着 抓走 老板 或者 吃 霸王餐 不然 你 会 死 的 很惨 吃饭 给钱 不然 通通 打死 一个 可爱 的 小萝莉 在 门口 踱 着 脚步 奶 
47866,方源 在 玩游戏 的 时候 被雷击 死亡 被 带到 了 一个 和 地球 十分相似 的 平行 世界 重生 之后 方源 发现自己 居然 有 一枚 神级 建村令 自此 方源 的 生活 改变 了 看方源 怎么 利用 这枚 神级 建村令 在 这个 世界 混 的 风生水 起 
47867,原名 旧事重提 是 鲁迅 的 一部 短篇 回忆录 集 收录 了 鲁迅 在 1928 年间 所写 的 回忆录 十篇 前 五篇 写于 北京 后 五篇 写于 厦门 一向 得到 极高 的 评价 鲁迅 说 这些 文章 都 是从 记忆 中抄 出来 quot ; 的 回忆 文 quot ; 
47868,苏叶 重生 2017 年 成为 RNG 的 替补 上单 并 获得 高玩黑 科技 系统 英雄 联盟 斩 SKT 踏 三星 灭龙珠 春季 赛 夏季 赛 MSIS7 这些 冠军 我 全都 要 绝地 求生 杀 李逵 吊打 FAZE 这群 臭 鱼烂虾 也 配 与 我 相提并论 极限运动 德州 扑克 灵异 探险 荒野 生存 他 是 游戏 界 的 一个 神话 是 行走 在 世间 的 传说 求 收藏 和 推荐 票 
47869,小说 通过 保尔 柯察金 的 成长 道路 告诉 人们 一个 人 只有 在 革命 的 艰难困苦 中 战胜 敌人 也 战胜 自己 只有 在 把 自己 的 追求 和 祖国 人民 的 利益 联系 在 一起 的 时候 才 会 创造 出 奇迹 才 会 成长 为 钢铁 战士 
47870,此书 以 隋唐 史事 为 背景 以 隋炀帝 朱贵儿 和 唐明皇 杨玉环 这 对 轮回 恋人 的 两世 姻缘 的 风流 艳情 故事 为 框架 描写 了 从 隋文帝 起兵 伐 陈到 唐明皇 还 都 去世 前后 170 多年 的 历史 讲述 了 秦琼 徐 懋功 程咬金 李靖 尉迟恭 罗成 等 人 反 隋兴 唐 的 英雄 传奇 描述 了 精场帝 的 宫闹 秽闻 与 唐玄宗 的 帝妃 恋情 以及 唐太宗 李世民 收纳 反 隋 英雄 玄武门 杀兄 夺权 开创 大唐 盛世 的 武功 文治 以及 唐玄宗 宠爱 杨贵妃 导致 安史之乱 的 悲剧 结局 
47872,沈 明明 以为 自己 狗 带 了 被 系统 忽悠 穿越 各个 世界 后来 发现自己 没有 死 她 仰天长叹 我 到底 是 为什么 要来 受 这份 苦 啊 且 看 她 如何 步步 成神 
47873,梦回 坎坷 艰难 的 西行 在 神魔 仙境 中 畅游 与 孙大圣 一起 龙宫 寻宝 大闹天宫 修改 生死簿 与 唐僧 一起 去 取经 西方 看 途中 风土人情 还有 好吃懒做 的 猪八戒 与 辛劳 的 沙僧 偷吃 人参果 三打 白骨精 莲花 洞 降妖 收服 红孩儿 女儿国 奇遇 世界 上 最 经典 的 神话 传奇 故事 你 不得不 看 
47874,最 喜欢 和 鬼 玩 捉迷藏 等 鬼 藏 好 了 我 就 回家 吃饭 
47875,已 定 本周 日入 v 届时 万字 掉落 注意 查收 欢迎 小天使 继续 支持 ┗ | ｀ O ′ | ┛ 嗷 本文 日 更 一般 情况 下 每晚 8 : 00 更新 RQ 伟大 的 轮回 者 以 魔法师 为 发展 方向 的 阿瑟 梅尔 维德 终于 在 做 了 上 万年 任务 之后 忍无可忍 把 主神 炒 了 包袱 款款 选择 了 风景秀丽 远离 纷争 的 童话世界 准备 养老 RQ 主神 相信 我 你 会 后悔 的 那些 世界 哔 阿瑟 大骗子 资 你 才 有鬼 他 完全 不 知道 主神 难得 好心 的 提醒 已经 和 主神 一起 被 某人 嚼 吧 嚼 吧 吞下去 了 Σ ° △ ° | | | 醴帚 祭凉 ァ 晾 碇 鞘 鼙 疚 挠 置 同行 总是 在 作死别 撩 那个 王子 了 没 看见 他 已 
47876,就 你 这 嗓子 还 想 唱歌 不 我 不光 要 当 歌王 我 还要 成为 全能 天王 
47877,李学浩 在 族谱 的 封皮 中 找到 一本 修道 秘笈 花 了 十年 时间 终于 筑基 成功 不料 急于求成 之下 走火入魔 身死 之后 重生 到 了 日本 的 横滨市 附身 于 一个 刚 升入 高中 的 高一 学生 身上 PS 公布 个 Q 群 333638358 欢迎 大家 
47878,当 李锋 遭遇 重生 大神 的 那 刻起 注定 地球 围绕 着 李锋 而 转 故事 从 95 年 的 天使 之 城 洛杉矶 开始 新人 新书 求 各位 书友 尽量 支持 新人 不易 万分 感谢 公布 各 书友 群 605938198 欢迎 各路 书友 进来 插 嗑 打屁 
47879,退役 特战 精英 夏若飞 意外 发现 祖传 画卷 中竟 内含 乾坤 自带 一方 独立 的 小 空间 空间 里 有 促进 植物 生长 的 灵 潭水 有 医治 百病 的 神秘 灵花 还 自带 十倍 时间 流速 栽 什么 都 是 精品 种 什么 都 长得 飞快 养 什么 都 能通 灵性 从此 栽 栽花 种种 树 养养 动物 撩 撩 美女 夏若飞 开启 了 一段 精彩纷呈 的 别样 人生 已 完成 130 万字 作品 重生 之 长风破浪 460 万字 作品 超 极品 纨绔 人品 保证 请 放心 收藏 阅读 书荒 的 亲们 可 移步 老书 开宰 书友 群 300769830 
47880,其实 这是 一个 和生 孩子 有关 的 故事 分手 总是 痛苦 的 尤其 是 分 在 虐 死 单身 狗 的 情人节 这天 而 产科医生 林苏寒 和 外科医生 许懿 不但 在 这天 分 了 手 还 莫名其妙 一脚 穿越 到 了 古代 异时空 嗯 开膛 破肚 总是 吓人 的 但 不 吓 吓人 怎么 对得起 穿越 人士 的 身份 呢 
47881,重 生成 前朝 忘恩负义 的 逃难 女正 逼 得 一个 小豆 丁去 卖身 为 仆季 清菱 看着 小豆 丁身 契上 的 名字 眼泪 都 要 流下来 了 大爷 咱们 打个 商量 都 说 宰相肚里 能 撑船 既然 将来 您 要 出将入相 能 不能 就 放过 我 这 一遭 
47882,文艺 版 不朽 已 提前 进场 带 着 宁静 的 馥郁 与 芬芳 除了 破裂 黑暗 的 聚光灯 不可 恕 的 原罪 荆棘 王冠 我 出场 的 时候 还 需要 令 群星 颤抖 的 BGM 让 白夜 褪尽 的 微风 以及 鲜血 凝结 的 威严 之花 通俗 版 我 是 大 魔王 我 就是 来装 B 的 
47883,他 爱 上 了 她 在 她 还 不 知道 他 是 谁 的 时候 他 想 给 她 一切 只是 他 需要 时间 她 也 一样 她 甚至 无法 抵抗 他 清澈 的 眼神 不该 开始 的 往往 都 会 开始 一旦 开始 了 就 只能 在 甜蜜 与 伤痛 中 沉沦 他 说 不要 想将来 将来 让 我 来 想 她 说 我 不要 将来 我 只要 现在 但是 真的 能 做到 吗 有 一种 爱 停不下 却 到 不了 
47885,当 国际 主题公园 巨头 纷纷 进入 中国 跑马 圈地 时  目前 国内 七成 左右 的 主题公园 还 在 为 盈利 而 努力 秦央带 着 系统 往 主题公园 行业 冲锋 不 为 别的 只为 把 家乡 的 美景 呈现 在 世界 之上 把 我们 引以为傲 的 华夏文化 呈现 在 世界 之 列 
47886,在 遥远 的 东方 存在 着 一个 数次 拒绝 了 米其林 三星 评价 的 奇怪 小店 那里 价格昂贵 一碗 配汤 蛋炒饭 288RMB 哦 忘 了 还有 一碟 泡菜 但 就算 是 这样 也 有 很多 人 排队 等候 那里 不 接受 预定 只 接受 本人 现场 排队 无数 人开 着 专机 专程 排队 当然 并 不 提供 停机位 或 停车位 那里 服务 恶劣 竟然 让 顾客 自己 端菜 收拾 碗筷 对 了 还要 擦 桌子 哦 上帝 这 老板 简直 疯 了 米其林 美食 杂志 
47887,他 踩 他 于 脚底 蔑视 嘲讽 因为 他 是 高高在上 的 富家 少爷 而 他 只是 他 花钱 雇来 的 保镖 人卑命 贱 \u3000 \u3000 四年 辗转 再次 相遇 他成 了 默默无闻 衣食 拮据 的 劳动 下层 而 他 曾 最 瞧不起 的 那个 男人 已然 站 在 了 权势 巅峰 \u3000 \u3000 少爷 你 知道 我 找 你 多久 呵呵 整整 四年 \u3000 \u3000 你 放手 \u3000 \u3000 挣非争 是 挣扎 挣脱 的 意思 小哈 读者群 号 \u3000 344209364 
47888,方云 爸妈 我要 退学 什么 老爸 猛地 一惊 反问 了 一句 你 说 什么 方云 爸妈 我要 退学 咣当 一声 老妈 手中 的 碗 摔 得 粉碎 神经质 大叫 休想 绝对 不 可能 方云 你 给 我 听 清楚 了 这 不 可能 方云 心中 隐藏 了 一个 天大 的 秘密 他 做 了 个 无比 真实 的 噩梦 如同 地球 有 春夏秋冬 宇宙 也 有 大四 纪 三个 月 后 大夏 纪 来临 大夏 的 风儿 从 无垠 虚空 吹 来 星空 开始 沸腾 宇宙 温度 飙升 太阳 中 冬眠 万年 玄冰 之中 保暖 的 怪兽 先后 苏醒 大夏 的 地球 燃烧 燃烧 让 人 惊悚 的 是 噩梦 中 的 剧情 正在 件 件 上演 推荐 博 
47889,前生 软弱 被动 过得 苦不堪言 重 来 一次 就 能 变得 高贵 聪慧 人见人爱 了 吗 赵檀生 仰头 问天 她 也 不 知道 为什么 无量 天尊 会 给 她 这种 弱鸡 再 来 一次 的 机会 但 她 知道 一个 有 理想 有 道德 无 底线 的 神棍 注定 是 不可 阻挡 的 
47890,洛邱 无意之中 成为 了 一家 俱乐部 的 老板 但是 这家 俱乐部 好 奇怪 它 不仅仅 拥有 一个 工作 了 三百年 的 人偶 女仆 而且 还会 贩卖 各种 古怪 的 东西 洛邱 渐渐 发现 他 生活 着 的 社会 之中 拥有 着 多 不胜 数为 欲望 所 驱使 的 家伙 而 这些 家伙 都 会 走 到 他 的 面前 用 着 他们 的 一切 寿命 宝物 甚至 是 灵魂 来 进行 交易 购买 心仪 的 东西 而 每 一次 的 成功 的 交易所 给 洛 邱 带来 的 都 是 存活 的 时间 祭献 成功 这次 获得 的 寿命 是 九十九年 就 这样 洛邱 开始 了 自己 也 不 知道 尽头 的 俱乐部 老板 的 生涯 PS 这 是 群 对 这 是 群 307841437 
47891,穿越 斗破 苍穹 仅仅只是 开端 穿梭 诸天 横扫 万界 生死 看淡 不服 就 干 目前 经历 世界 斗破 苍穹 斗罗 大陆 超 神学院 一统 斗罗 大陆 再 回斗破 生化 末日 一统 斗气 大陆 武动 乾坤 大 主宰 众神 之 战神 墓 多元 宇宙 
47892,有道是 自古 红颜 多 薄命 传说 蛮荒 之国凤 冥 有 一 公主 倾城 美貌 温柔 贤德 能 占卜 通灵 可 昌盛 国运 然灵体 反噬 难以 高寿 龙熙 国王 慕其 名为 坐 乱世 霸主 之位 派 温润 如玉 的 二 皇子 登门 求 娶 强 结秦晋之 好 一场 有 预谋 的 和亲 就此 展开 这是 一个 当 骗子 遇上 另外 一个 骗子 的 故事 
47893,单亲 女孩 迪伦 15 岁 的 世界 一片狼藉 与 母亲 总是 无话可说 在 学校 里 经常 受到 同学 的 捉弄 唯一 谈得来 的 好友 也 因为 转学 离开 了 这 一切 都 让 迪伦 感到 无比 痛苦 她 决定 去 看望 久 未 谋面 的 父亲 然而 路上 突发 交通事故 等 她 拼命 爬 出 火车 残骸 之后 却 惊恐 地 发现自己 是 唯一 的 幸存者 而 眼前 竟是 一片 荒原 此时 迪伦 看到 不远处 的 山坡 上 一个男孩 的 身影 男孩 将 她 带 离 了 事故现场 但是 迪伦 很快 意识 到 男孩 并 不是 偶然 出现 的 路 人 他 似乎 是 特意 在 此 等候 命运 从 他们 相遇 的 那刻 开始 发生 了 无法 预料 的 转变 
47894,巍巍 千年 道 门 三万 门徒 三千 弟子 三百 真人 三十位 大 真人 掌教真人 屹立 于 当世 巅峰 浩浩 百年 皇室 千万 子民 百万 大军 十万 官宦 百余 红袍 公卿 皇帝 陛下 坐拥 这 锦绣江山 真 人们 行走 江湖 传述 道祖 至理 公卿 们 高踞 庙堂 牧守 天下 众生 暗卫府 潜于 世内 为 皇帝 侦缉 天下 镇 魔殿 隐于 世外 为 掌教 镇压 邪魔 儒家 法家 书生 激辩 王霸 义利 道 门 佛门 修士 论道 长生 轮回 徐北游 则 是 负剑 而行 在 他 握 剑 的 第一天 他 就 明白 一个 道理 握住 夏蝉 未必 是 抓住 夏天 但是 握住 了 这 把 剑 便是 握住 了 一个 江湖 终 有 一天 他会 一剑 横行 三千里 千军万马 
47895,冯君 身为 985 的 双学位 毕业 就 失业 了 在 都市 中 艰难 打拼 偏偏 还 放不下 架子 他 的 处境 可想而知 直到 有 一天 他 和 手机 被 雷劈 了 猛然 发现 原来 自己 可以 化身 数据 进入 app 中 化身 数据 进入 app 中能 做 什么 能 做 的 太 多 了 尽情 想像 吧 慢 着 手机 银行 的 存款 住手 那个 不能 乱改 当然 这 并 不仅仅 是 全部 然后 他 还 发现自己 居然 可以 自由 进入 仙侠 位面 让 我们 跟随 冯君 踏上 奇妙 的 修仙 之旅 落花 时节 又 逢 君 这话 可不是 白说 的 
47896,钢铁 铸就 的 繁华都市 给 了 我们 舒适 的 生活 但 同时 也 禁锢 了 我们 的 天性 一个 普通 的 白领 青年 一扇 神奇 的 冒险 之 门 孤岛 求生 丛林 历练 冰川 独行 大漠 迷途 末日 挣扎 墓穴 寻幽 外星 探险 洪荒 狩猎 推开 冒险 之门 带 你 体验 最 艰难 的 求生 最 刺激 的 冒险 释放 属于 我们 的 原始 天性 
47897,想要 钱 给 你 想要 美女 给 你 想要 去 修真 满足 你 想要 重生 满足 你 然后 呢 当 你 的 任何 想法 都 被 满足 之后 呢 教 你 如何 使用 上帝 从此 人生 不用 愁 哦 差点 忘 了 上帝 总是 在 来世 才 满足 你 
47899,穿越 到 玛丽 苏文里 当 女配 面对 来势凶猛 的 诸位 男主 外带 机遇 无敌 的 女主方 清铃 只好 低调 低调 再 低调 只是 那 不是 女主 的 好 姐妹 吗 干嘛 老 盯 着 她 不放 啊 还有 那 几号 女配 不要 来 找麻烦 好不好 她 真的 是 无辜 的 啊 辛辛苦苦 修炼 到 一半 却 发现 魂魄 不全 终身 不得 进阶 她 改 何去何从 本文 女主 偶尔 范二 活跃 气氛 不白 不苏 欢迎 入坑 
