id,abstract
47967,老荣 老柴 老渣 老 月 老合此 五老 谓之 五花 金皮彩 挂 评团 调柳 谓之 八门 五花八门 谓之 江湖 写 一个 真实 存在 却 并 不 为 人 熟知 的 江湖 写 几个 真实 存在 却 并 不 为 人 熟知 的 行当 写 几种 真实 存在 却 并 不 为 人 熟知 的 手艺 写 几位 真实 存在 却 并 不 为 人 熟知 的 手艺人 写 几件 真实 存在 却 并 不 为 人 所 熟知 的 事情 安县 戏法 罗 湖南 鬼马 张 江东 快手 刘 西南 傅家 北方 穆派 华北 韩家 门 京城 单 义堂 徐徐 揭开 一副 真实 存在 的 江湖 彩门 画卷 
47968,古老 的 仙道 世界 历久弥新 一代代 天骄 英豪 你 方唱 罢 我 登台 正是 一个 大 时代 沉寂 许久 之 时 一个 穿越 而来 的 少年 在 曾经 闻名天下 现已 废弃 多时 的 壶 梁 探出 自己 的 罪恶 之手 我 告诉 你们 只有 一级 小号 自带 的 技能 才 是 最 实用 的 例如 有个 技能 官名 拾取 诨名 摸 尸 PS 简介 先 改成 这个 用 着 建 了 个 读者群 697475270 
47969,这是 我国 文学史 上 一部 杰出 的 现实主义 的 长篇 讽刺 小说 描写 了 封建社会 后期 士大夫 的 生活 和 精神状态 小说 主题 恢宏 内容 丰富 语言 自然 明快 文笔 淋漓 酣畅 达到 了 我国 古典小说 中 讽刺 艺术 的 高峰 
47970,潘壳 嗄 炅 址 悖 在 火车 上救 了 美女 明星 贝雪茵 同时 获得 了 欢喜佛 舍利 借助 欢喜佛 舍利 林枫 掌握 了 透视 功能 林枫 的 命运 也 发生 改变 且 看林枫 如何 在 都市 之中 逍遥 
47971,江湖 传言 孙家 善剑 却 不知 孙家 的 飞针 更是 惊天地泣鬼神 孙家 幼女 孙小梅 自小 不 受 宠爱 被 罚跪 在 地下室 却 无意 中 发现 了 一本 家传 绝学 经过 刻苦 修炼 她 终于 连成 神针 一晃 十年 官富 横行 盗匪 猖獗 皇帝 无能 看着 百姓 受苦 她 决定 替天行道 杀 了 贪官 金有 才 平 了 以 匪首 王 飞天 为首 的 黄花 寨 就 出 穷苦 良家妇女 认识 了 清官 赵世飞 最终 两人 喜结良缘 
47972,在 这场 诸神 的 游戏 中 胜利 不会 属于 任何人 你 可以 选择 逃避 或者 死亡 一旦 妄图 生存 你 将 面临 最 真实 的 恐惧 与 神 照面 当神 褪下 圣洁 的 躯壳 化身为 残暴 血腥 的 怪物 准备 好 了 么 他 从 天堂 来 正向 地狱 去 
47973,白岩松 刘同 蒋方舟 阿 来 阎连科 张晓龙 倾情 推荐 献给 内心 漂泊 无依 的 你 关于 亲人 关于 故乡 真挚 暖心 请勿 在 公众 场合 阅读 比如 地铁 以免 流泪 遭 围观 作者 为 80 后 媒体 人 人称 天才 达达 韩寒 口中 的 写作 大师 24 岁任 新周刊 杂志 主编 这本 蔡崇达 随笔集 刘德华 李敬泽 白岩松 作序 推荐 以 人物 肖像画 的 方式 描绘 了 福建 渔业 小镇 的 风土人情 和 时代 变迁 在 温情 而 又 残酷 的 故事 讲述 中 阐述 了 作者 对 父母 家乡 的 缅怀 对 朋友 命运 的 关切 
47974,四年 前 陶意 莫名其妙 的 失 了 身 狼狈不堪 被 退 了 婚 被 威胁 着 生下 了 孩子 最后 连 孩子 看 都 没 看 上 一眼 就 弄 丢 了 她 用 四年 的 时间 舔 舐 伤口 却 因为 工作 指派 无意间 走进 了 一对 父子 的 世界 冷酷 而 又 闷骚 的 男人 自闭症 严重 又 别扭 的 孩子 一切 让 她 晕头 转象 更 让 她 感到 窒息 的 是 当年 的 真相 侵犯 她 的 男人 孩子 的 踪迹 慢慢 浮出 了 水面 她 才 发现 原来 她 只是 一枚 可怜 的 棋子 连落 在 哪里 都 是 他 算计 好 的 墨君夜 你 不要 太 过份 他 有趣 地 看着 她 我 不介意 再 过份 一点 喜欢 就 点击 追书 收藏 吧 推荐 钻石 也 来者不拒 哦 O ∩ _ ∩ O 
47975,一场 梦幻 的 意境 改变 了 主人公 楚河 的 命运 逼 得 善良 的 他 开始 步步 堕落 本 以为 会 掉入 地狱 苦熬 人生 却不曾 想 登上 天堂 享尽 极乐 
47976,有 一天 司如 遇到 了 一个 系统 然后 她 去 了 三千 世界 再 然后 她 遇到 了 很多 做 任务 的 人 
47977,路漫漫其修远兮 吾将上下而求索 道 之 所在 虽 万千 人逆之吾往 矣 
47978,女配 想 踩 着 她 攻略 男主 男配 翻身 上位 炮灰 路人 想 夺 她 机缘 打 她 脸逆袭 人生 可惜 她 是 BUG 一样 的 存在 史上 最难 攻略 的 女 BOSS 没有 之一 
47980,群众演员 秦烨 穿越 平行 世界 得到 大 明星 系统 这个 世界 和 地球 的 文化差异 很大 没有 了 那些 我们 熟知 的 文学作品 音乐作品 影视作品 大 明星 系统 里 更是 有 许多 神奇 的 功能 大 明星 转盘 可以 抽到 各种 神奇 的 物品 影帝 封龙 贴 透视 药水 隐身 胶囊 等等 幸运 上 上 签 桃花 签 财运 签 幸运 签 倒霉 签 商城 各种各样 的 逆天 物品 有 了 这款 系统 秦烨 从 一位 不 知名 的 群众演员 最终 实现 了 自己 的 明星 梦 
47981,一柄 秋水 长剑 一袭 磊落 青衫 她 是 云荒 第一位 女剑 仙人 人皆道 她 醉心于 剑 之 极 狂妄 到 挑战 不朽 不灭 的 唯一 真神 没有 人 明白 杀 了 他 她 就 能 回家 
47982,妞妞 嗯 你 爱不爱 爸爸 爱有 多 爱 很 爱 很 爱 是 多 爱 啊 像 天空 一样 大 的 爱 嗯 在 登临 人生 巅峰 的 时候 罗凯 回到 了 重 生前 的 那一刻 当 他 再次 见到 妞妞 才 明白 自己 的 归来 正是 为了 弥补 对 女儿 的 亏欠 于是 罗凯 发誓 这 一生 他 要 用尽 所有 的 力量 让 妞妞 成为 世界 上 最 幸福 的 宝贝 爸妞群 494193990 热忱 欢迎 大家 的 加入 
47983,都市 繁华 纷扰 人生如梦 却 得 一 美食 足矣 今天 开始 做菜 做 美食 狂人 开 一家 小店 只为品 舌尖 上 的 美味 小店 只 接受 三次 堂食 以后 必须 预约 且 价格昂贵 一碗 外婆 手工 面 标价 888RMB 哦 这 老板 肯定 疯 了 
47984,前世 的 白粉 在 重生 后 走向 狂饭 亲妈 饭 的 不归路 网瘾 少女 : 我们 认识 快 10 年 了 要 不要 见 一面 啊 ! 说不定 有 惊喜 啊 男主 : 不要 网恋 就是 见光死 ! 允儿 亲故 啊 回国 也 不 说 下 晚上 去 你家 喝一杯 我 爱 吃 的 你 知道 啊 多 做点 嘿嘿 男主 : 别来 我气 还 没消 不 就 说 要 做 你 姐夫 嘛 就 在 少时 内传 我 是 基佬  现在 还是 头条 呢 西卡 : 呀 你 要 潜 我 就 说 啊 ! 逼 的 我 退团 高兴 了 男主 : 剧本 不该 这样 的 啊 某萝莉 : 欧尼酱 你 为 她 做 这么 多 她 都 不选 你 想 不想 报复 啊 我 教 你 个 方法 我 还 2 年 就 成年 了 男主是 我 没 把 你 教好 我 错 了 
47985,恐怖 的 恶魔 在 身后 追赶 你 勇敢 的 少女 啊 快 去 创造 奇迹 为了 活命 少女 快去 努力 奇幻 文有 男主有 金手指 封面 制作 不准 吃糖 本文 将 于本周 四即 十月 二十三日 入 v 谢谢 支持 即将 要 写 的 文综 四大名著 同 人 言情 向 城里 的 老鼠 不 收藏 一只 嘛 戳 下方 图片 可 到 专栏 
47986,简介 不 存在 的 书 都 是 假 的 简介 当然 也 是 假 的 啊 哈哈哈 哈哈哈 假 的 都 是 假 的 什么 修仙 什么 小说 统统 都 是 假 的 不要 碰 朕 朕 不要 吃药 朕 没 疯 总有 书友 想害 朕 哈哈哈哈 你们 这些 人 都 想害 朕 护驾 护驾 VIP 全订 群 的 群号 229370094 新书 我 真 不是 仙 二代 隆重 发布 全新 旅程 开启 亲们 可以 去 看看 啦 
47987,一 锄头 挖地 挖 到 超大 咸鱼 干 不是 事儿 被 咸鱼 干臭 晕 就 有点 尴尬 了 晕 了 后 做梦 预见 凄惨 未来 就 玄幻 了 悲惨 1 秦鱼 郁郁寡欢 然后 浑身 带 着 咸鱼 干 醉人 芳香 的 一只 猫 出现 了 猫 本殿 是 天神 之子 为了 消灭 邪恶 选择 被 封印 千年 万年 你 就是 我 的 有缘人 快 别 废话 了 跟 我 一起 拯救 三千 小 世界 吧 说完 后 它 的 肚子 咕咕 叫 了 一面 现实 种田 一面 快 穿 攻略 各种 邪恶 BOSS 后来 她 从 内心 闺秀 喜欢 种田 的 温柔 少女 进化 成 了 表里不一 笑里藏刀 的 温柔 小姐姐 秦鱼 我 真的 只是 想 种田 而已 
47988,夏侯 虞 觉得 既然 她 和 萧桓 是 政治 联姻 那 就 各自为政 各取所需 维持 表面 上 琴瑟和鸣 好 了 可 没想到 生死关头 萧桓 却 把 生机 留给 了 她 重回 建安 三年 夏侯 虞 忍不住 好奇 的 打量 新婚 的 丈夫 萧桓 这 一 打量 不要紧 却 把 自己 给 掉 进 了 坑里 了 
47989,无 穿越 当 海贼 世界 多出 了 一个 闯祸 者 会 是 怎么样 当路 飞 多出 了 一个 兄弟会 是 怎么样 当 草帽 海贼团 多出 了 一个 人 又 是 怎么样 悲剧 是否 会 重演 热血 是否 依旧 一切 尽 在 此书 
47990,一个 养在 大院 高干 圈里 养女 的 故事 后 寻来 的 亲 妹妹 想 夺走 她 的 一切 后 寻来 的 亲生 母亲 是 帮凶 重生 了 还 让 她们 再次 算计 吗 她 微微一笑 不让 他们 自寻死路 她 怎么 能 心安 轻松 版 多年 后 李 月华 被 众人 追问 是 怎么 与 那些 纨绔子弟 感情 如此 深厚 时 她 微微一笑 一起 劫过 同学 一起 偷看 过 妖精 打架 送过 鸡 送 过 鸭 就 差 送秋波 的 友谊 吧 众人 新书 尚书 大人 易 折腰 谢父 从 二品 降 为 五品 后 谢家 的 姑娘 为了 婚事 各显神通 上辈子 谢元娘 抢 了 谢文惠 的 婚事 没落 得个 好下场 这辈子 她 想 从 小户人家 找个 潜力股 结果 屡遭 变故 皆 
47991,本书 为 公版书 为 不受 著作权法 限制 的 作家 艺术家 及其 它 人士 发布 的 作品 供 广大读者 阅读 交流 
47992,现代 宅女 夏青然 表示 欲哭无泪 一 觉醒 来 居然 穿 到 小说 里  而 她 还是 恶毒 女配 什么 男主们 怎么 都 来 追 她 不要 啊 和 女主 抢 男人 她 活腻了 才 会 干 注意 注意 本文 NP 本文 转自贴 吧 
47993,工业革命 之后 欧洲 科技 发展 数百年 新 中国 成立 不过 几十年 普通 科技产业 我们 需要 埋头 追赶 在 高精尖 端 领域 我们 需要 弯道 超车 作为 一名 在 军工 单位 奋斗 了 数十年 的 技术人员 谢凯 重生 了 回到 了 那个 改变 了 他 跟 很多 人 一生 的 日子 这辈子 他 不 打算 再 接受 命运 而是 利用 自己 的 知识 去 让 身边 的 人 改变命运 也 是 这种 改变 提前 让 共和国 军工 某些 领域 实现 了 弯道 超车 也 在 大部分 领域 追赶 上 了 欧洲 列强 的 步伐 坦克 火箭炮 导弹 先进 战机 核潜艇 航母 都 跟 谢凯 没关系 啊 国外 技术 封锁 禁运 没事儿 咱想 办法 想要 中国 武器装备 这 
47994,修真 聊天 群同 人文 我 叫 宋书 玉 我 的 哥哥 叫 宋书 航 听说 哥哥 是 个 萝莉控 大家 都 叫 他 霸霸 宋 喔 还有 叫 霸霸儒 的 我 经常 偷偷 上 哥哥 的 扣扣 发现 他 有 一个 九洲 一号 群 里面 都 是 一群 中二病 的 大 哥哥 和 大 姐姐 原来 这个 世界 上 还有 这么 多人 需要 治疗 哥哥 说 他 是 为了 拯救 他们 才 留在 群里 的 哥哥 最棒 了 
47995,世界 上 真是 什么 奇葩 的 事情 都 有 听说 过 修仙 的 还是 第一次 听说 种仙 的 灵溪 山上 有个 洞洞 里 住 着 个 老 神仙 老 神仙 种下 一棵 仙树 百年 才 结 一次 果 一天 来 了 个 小妖精 仙果 没有 吃 到 却 得到 一颗 果核 她 相信 种 什么 瓜得 什么 豆 吃 了 仙家 之物 便 会长 仙气 于是 把 果核 吞进 了 腹中 从此 便 踏上 了 不 一样 的 修仙 之 路 
47996,末法 时代 历经 无量 量 劫 修炼 纪元 即将 终结 最后 的 气运 结合 遁 去 的 一 演化 至宝 诸天 棋盘 被 末法 时代 最后 一个 修行 之 人 得到 开启 了 一段 浪迹 诸天 的 传奇 
47997,都 说 时间 是 把 杀猪刀 可 她 被 这 把 刀 杀 了 之后 又 被 这 把 刀 眷顾 了 那么 重生 之后 咱 必然 得 幸福 
47998,大 梦 三千 逍遥 一世 逆天 修仙 缔造 传奇 杜小白 是 一个 善良 充满 正义感 的 好人 他 坚信 好人 有 好 报 只有 他 自己 清楚 不过 是 想要 换 一个 活法 罢了 这 一世 只 为 自己 而活 不管 是 凡人 也好 仙人 也罢 开心 最 关键 书友 群 656861316 
47999,嫉妒 憎恨 绝望 愤怒 恐惧 纷飞 的 玻璃 碎片 成 了 最 残忍 的 一道 风景 这里 是 刀剑 神域 的 世界 一个 死亡 游戏 在 这里 欢颜 难见 在 这里 只有 战斗 － － － － － － － － － － － 已 完结 小说 海贼王 之 漫漫 长路 收藏 和 票票 赶紧 滴 
48000,吾 名白 诃 生于 修真 世家 白家 其上 有个 哥哥 名轩 为 数百年 前 的 战魔 天将 以战 闻名 名入 封神榜 封璇 天将 有个 道侣 为 上界 仙君称 东霜仙君 职掌 上 界 不周 山以东 的 霜雪 而 我 自己 修习 万年 在 数百年 前终 得 上 仙之位 因居 蜀地 又 占 了 个 德字 封德 蜀 上 仙 但 这 都 已 是 数百年 前 的 事儿 了 百年之后 我 在 三界 开 了 家 小店 想 做点 小本生意 父母 同意 了 哥哥 与 夫君 我 想 也 应该 是 同意 的 我 这 小店 的 名字 叫云鬼意 为 魂 做 得 是 你 情 我 愿 的 买卖 只是 交易 之物 为 魂魄 罢了 小店 的 门面 只有 一个 有缘人 出现 它 便 也 会 出现 
48001,前世 顾流惜 眼盲 心盲 认错 了 人 为了 假冒 的 冉 清影 背弃 一切 却害 的 她 真正 牵挂 之 人为 她 命丧 黄泉 绝望 之下 引颈 自刎 的 她 却 回到 了 四年 前 这次 她 发誓 一定 不惜一切 陪 着 她 可 谁 能 告诉 她 上辈子 名动 天下 的 闻 大 阁主 怎么 是 个 病秧子 名副其实 的 是 个 走 几步 就 喘 碰 几下 就 晕 的 病 美人冉 清影 顾 姑娘 可否 赏脸 同游 闻 墨弦惜 儿 看到 她 我 心口 疼顾 流惜 怎么 又 疼 了 那 我们 回去 无视 某人 顾流惜 闻墨 弦 你 不要 胡来 害羞 挣扎 闻 墨弦惜 儿 你 挣扎 地 我 心口 疼顾 流惜 唔 放弃 闻 墨弦惜 儿顾 流惜 你 有 病闻墨 弦 
48002,吴大光 重生 了 家徒四壁 不说 还有 个 四岁 闺女 叫 杏花 要 闹 哪样 
48003,自来 也 我 是 谁 我 在 哪 我 在 干什么 邓桀 醒醒 开始 了 这次 你 打 辅助 注意 一点 别 再 买 什么 三项 了 邓桀带 着 火影 的 人物 开始 了 在 召唤师 峡谷 与 其他 位面 人物 的 战斗 卡普 你 孙子 就 在 我 手上 识相 点 放下 手里 的 无尽 好好 说话 卡普真 当 我 没玩过 看剑本 故事 纯属虚构 如有雷同 不胜 荣幸 
48004,她 是 个 父母双亡 的 死 宅 但 有 万能 大哥 护着 日子 可好 过 了 奈何 难逃 野心勃勃 的 亲戚 们 算计 谋害 来到 异世 之后 方知 有 兄长 护着 有 多 好 令 她 没想到 的 是 这辈子 的 她 是 个 武林高手 还 被 师父 交付 重担 当起 了 一教 之主 想到 从此 背负着 成千上万 教众 的 生计 黎 浅浅 整个 人 都 不好 了 真是太 瞧得起 她 了 凭 她 这细 胳臂 她 扛 得 起 吗 教中 长老 们 不服 时不时 找 她 的 麻烦 朝中 的 皇子 们 也 纷朝 她 递出 橄榄枝 别以为 她 不 知道 这些 贵 人们 面上 朝 她 笑 的 甜 背后 捅 她 刀子 可是 毫不手软 焦头烂额 之际 她 那 堪称 白莲花 的 嫡母 和 嫡姐 以及 她 那 好 嫡 祖母 似乎 嫌 她 
48005,武帝 罢黜百家 独尊 儒术 导致 道 门 式微 又 加之 儒教 方兴 在 这 青黄不接 的 紧要关头 各大 势力 蠢蠢欲动 一名 以贩 梨 为生 的 市井小民 机缘巧合 中 被 牵扯 进来 被 当做 魔门 魁首 最后 卷入 了 这场 正邪 纷争 天地 为 炉 兮 造化 为工 阴阳 为炭 兮 万物 为 铜 看 我 用 你 的 炭 借 你 的 工 如何 毁 了 你 的 炉 
48006,这是 一个 穿越 者 在 火影 的 平行 世界 搞 事情 的 故事 
48007,夜黑风高 虚实 杀 各位 玩家 欢迎 来到 全息 杀人 游戏 虚实 幻境 这个 游戏 不 简单 不 撩妹 不 搞 基 专注 互相 伤害 书友 群 471036516 
48008,牝鸡 焉能 司晨 你 让 我 去 追 绝代 双骄 的 邀 月 和 怜星 我 也 不 说 什么 了 好歹 还是 人 铁扇公主 是 怎么回事 系统 那 是 罗刹 啊 你 确定 你 没出 故障 九尾 妖狐 苏妲己 也 要 追 那 真的 是 妖怪 啊 这 是 一个 走上 不归路 的 渣 男 为了 不 被 抹杀 不得不 继续 渣 男 的 日常 
48009,意外 身死 穿越 洪荒 先天 阴阳 石 之一 孕育 而生 难道 是 昊天 不会 吧 竟然 是 傀儡 玉帝 既来之 则安之 既然 老天 让 我 重活 一次 那 就 改变命运 不成 圣 也 要 君临 三界 女娲 瑶池 后土 嫦娥 广大 美女 们 哈哈 朕 来 了 我 是 昊天 我 为 自己 代盐 每天 1200 更新 两章 不见不散 
48010,平行 世界 中山 和 黛 的 故事 之一 恶灵 危机 希望 只会 在 平行 世界 
48011,血 妖姬 最新 章节 列 小说 血 妖姬 妖 卿卿 著  血 妖姬 全文 阅读 她 是 谁 吸血鬼 妖精 还是 未知 的 神秘 种族 上 古时候 的 残忍 灭杀 让 她 的 种族 完全 破碎 她 要 恢复 实力 她 要 恢复 记忆 灵魂 但 残破 的 记忆 碎片 让 她 只能 在 各个 世界 中 寻觅 自己 的 一部分一部分 只有 当 危险 来临 当 致命 来临 血 妖姬 之力 才 会 暂时 苏醒 拯救 一步步 走过 修炼 成长 看 血 妖姬 如何 找回 完美 ; lt ; p ; gt ; 
48013,1 下载 一款 可疑 的 游戏 2 捕捉 几只 神奇 的 宠物 当 伙伴 3 在 轻松 有趣 的 日常 里 带领 宠物店 走上 崛起 之 路 实体书 13 册 已 出版 各大 电商 有售 读者群 513717593 无 粉丝 值 要求 VIP 群 5672882565000 及 以上 粉丝 值可入 
48014,华夏 第一本 关于 幻术 的 专着 是 明代 的 神仙 戏术 记载 古代 幻术 二十多种 可惜 此书 已 失传 真正 集 中国 幻术 大成者 是 清末 唐再丰 所 着 的 鹅幻 奇书 一个 少年 带 着 鹅幻 奇书 来到 了 火影 世界 只 为 争夺 最强 幻术 的 荣耀 月 读别 天神 操控 五感 伊邪 那 支伊邪 那美 九龙 取水 白鹤 升空 芝麻 变鱼 口吐 四花 使 鬼 打门 鞍马 明镜 微微一笑 嚯 嚯 真正 的 幻术 又 岂 是 这般 肤浅 
48016,家族 是 国内 老牌 世家 之一 权势 滔天 母亲 是 影响力 巨大 的 国际 巨星 父亲 是 灵气 复苏 时代 修真 保守派 的 代表 人物 之一 自己 本身 就是 血脉 优异 的 顶级 修真 种子 关键 是 人长 得 又 帅 朋友 也 多 进入 国内 四大 修真 学院 之一 的 道院 成绩 更是 名列前茅 比 一般 人 还 努力 的 姬安 一直 都 以为 自己 是 人生 赢家 直到 有 一天 他 得到 一只 单片 全框 眼镜 在 那 之后 他 能够 看到 许许多多 的 人 头上 的 标签 而 当 他 呆呆地 站 在 镜子 前 愣愣 地 看到 在 他 的 头顶 之上 墨色 的 云朵 缓缓 汇成 两个 硕大 的 字 反派 他 的 心态 崩 了 
48017,如果 人生 能够 重 来 宁愿 从来 没有 遇见 他 可 人生 真的 重 来时 他 又 来 了 那么 定要 有 怨 报怨 有仇 报仇 
48018,希望 你 能 在 我 的 虚伪 之中 看出 一点 真实 的 感动 愿 你 今后 既有 软肋 又 有 盔甲 生活 闪闪发亮 ° з ° 
48019,绝处逢生 的 叶天 发现自己 眼中 的 世界 变 了 变得 光芒四射 璀璨夺目 古董 名画 黄金 钻石 珠宝 俯拾皆是 唾手可得 科科斯岛 的 海盗 宝藏 大洋 深处 的 纳粹 黄金 丛林 之中 的 玛雅 文明 所罗门王 的 秘密 消失 的 亚特兰蒂斯 它们 都 已 不再 神秘 而是 彻底 敞开 了 大门 只 等 叶天 去 探索 去 发现 那 还 等 什么 呢 出发 
48020,佛宗 我 有 六字 神通 消灾 去 病 玄远 我道 门 也 有 九字 真言 护道 长生 十字 教 我 有 永生 天堂 接引 世人 玄远 我道 门 也 有 十方 净土 广度 众生 婆罗门 派 我 有 诸天 神灵 庇佑 信徒 玄远 我道 门 也 有 三清 四御 五 老六司 七元 八仙 九曜众 炮灰 报告 有人 作弊 横跨 千古 降临 异界 从 末法 之 地 到 道 古之陆 身负 道 尊 遗泽 玄远 一路 横 推造 清微 福地 建 冲虚 洞天 传 三千 道 法立 八百 旁门 与 神灵 相争 同佛子 论道 于 北海 御龙 在 苍梧 戏风待 得 道 门 再兴 我 即 逍遥 长生 
48021,少年 苏庭 携陆压 传承 穿越 仙侠 神话 世界 炼就 斩仙 飞刀 成就 雷火 之体 上 震 云霄 下慑 幽冥 诸天 神仙 无敢 犯者 我 有 一刀 诸天 万界 神仙 妖魔 无有 不惧者 
48022,远古 之时 巫 沟通 大地 熔炼 魔魂 掌司 命运 却 为 天所斥 天意 如刀 权柄 被 篡夺 且 惨遭 诸圣 忌惮 的 巫族 旦夕之间 被 毁灭 残留 火种 侥幸 破碎 时空 的 屏障 若干年 过去 苦寒 之地 一位 法力 高强 的 巫女 在 和 群妖 斗争 中 无奈 将 自身 以及 群妖 的 灵魂 融合 而成 一块 宝石 结晶 从那之后 玉中 的 战斗 亦 从未 休止 过 而今 四魂之玉 意外 破碎 以九幽 黄泉 刀为 穿插 引线 即将 勾勒 出 一段 凄美 的 爱恨 情仇 故事 qq 交流 群 615498555 
48023,陆零 重生 变成 了 陆绫好 在 她 获得 了 各种 神级 天赋 和 血脉 御剑 乘风 来剑系 最终 结算 伤害 翻倍 身法 最终 结算 翻倍 晓风残月 绝境 灵力 翻倍 皓腕 凝 霜雪 身怀 如此 多 的 顶级 战斗 天赋 最后 却 进 了 一个 奶妈 的 门派 灵山 开 什么 玩笑 而且 还 被 分配 到 了 最 垃圾 的 第 ⑨ 峰 陆绫怒 了 她 准备 咸鱼翻身 像 龙 傲天 一般 一路 踩 人 打 脸冲 上 云霄 将 这个 灵山 变成 绫山 最后 争霸 修仙 界 然后 梦醒 了 师姐 吃饭 了 来 了 来 了 师妹 今天 又 是 什么 好吃 的 争霸 什么 的 果然 还是 算了 但是 大 师姐 是 一定 要 当 的 修为 上 不 去 的话 痛经 真的 会 死 
48024,乡村 小 直播 大 看台 直播 奖励 多 上山 打猎 配良 弓 下水 捉鱼 好 网兜 山间 野趣 欢乐 多卖萌 宠物 不能 少开 山路 下 地河 采摘 野果 直播 乐事 多 玩玩 乐 赚 赚钱 逗逗 狗 撵 野猪 乡下 小 直播 有 吃 又 有 喝 点滴 烦心事 不算 多四 八大 肉 红灯 大枣 乡村 主播 见识 多 
48025,二乔 看着 自己 的 微信 界面 黑山羊 我 是 水蓝星 人士 我们 这里 刚刚 经历 了 末世 你 呢 二乔 心里 默默 吐槽 道 我 在 华夏 国 我 正在 经历 时代 变迁 她 叫 二乔 却 不是 三国 里 的 倾城 美人二乔 而是 白 水沟 村 的 庄二乔 村里人 称 庄家 黑三妮 
48026,张 先生 请问 您 的 食材 为什么 可以 畅销 全世界 请问 您 的 科技 公司 怎么 研发 出 这么 多 惊艳 的 产品 的 听说 您 还 会 武术 是 个 武功 高手 是 吗 被誉为 世界 上 最 优秀 的 男人 请问 您 是 怎么 做到 的 呢 怎么 做到 的 张毅 轻笑 一声 说道 首先 你 要 学会 忽悠 然后 呢 记者 们 都 激动 了 然后 你 得 要 有 一个 领主 论坛 张毅 在 心中 想到 一个 可以 和 诸天 万界 交流 的 领主 论坛 
48027,阿龙 像 个 长不大 的 孩子 一样 每天 玩 着 一些 小孩子 都 不 玩 的 游戏 比如 口袋妖怪 之类 的 他 玩 这种 游戏 甚至 可以 玩 一个 通宵 这天 通宵 打雷 下雨 被 雷 给 劈 了 这 一世 的 普通 少年 到 了 那个 世界 又 会 怎么样 呢 还 会 平凡 一生 吗 
48028,一千多年 前云空 帝国 灭亡 大派 雄起 均分 天下 武道 联盟 应运而生 这是 一个 飞速 现代化 的 武侠 年代 这是 一个 不断 变革 着 的 武道 时代 武道 不断 变强 一代 强 过 一代 武者 在 经脉 外 开辟 了 窍 穴 的 征途 周身 窍穴通 地桥 奇经八脉 开天关 而 来自 地球 的 路羽 在 这个 世界 重获 新生 
48029,出嫁 当天 哥哥 死 了 爹娘 丢 了 这 一切 好像 都 是 云舒 的 未婚夫 干 的 换个 未婚夫 照样 好好 走江湖 漫漫 江湖 路 咦 怎么 身边 的 人 都 在 接二连三 的 死 我 不会 是 死神 吧 
48030,野性 飞禽走兽 花鸟 鱼虫 牵着 两只 胖 熊猫 上 春晚 给 大家 拜年 让 华夏 人民 记住 了 纪安 的 名字 一张 光膀子 围 兽皮 在 塞伦盖蒂 大 草原 上 与 狮 同行 的 照片 让 他 火遍 全世界 跟 猩猩 摔跤 卧底 狼群 狮群 混进 野兽 堆里 玩 直播 的 他 是 独 一份 从 遛狗 直播 开始 少年 一步步 成长 为 都市 兽王 
48031,吾 乃 红云 就 想 问 一句 老好人 就 该 被 欺负 就 该 陨落 吗 一个 老好人 转变 腹黑 男 吞噬 洪荒 的 历程 ps : 贫道 在 混沌 中 开辟 了 一个 大千世界 诸位 道友 可以 前来 观赏 企鹅 群 : 554278756 
48032,骚年 来 成为 我 的 孩子 成为 吸血鬼 吧 = 有 什么 好处 吗 你 将 获得 永恒 的 生命 与 无尽 的 财富 = 哦 那怕 太阳 吗 呃 吸血鬼 当然 是 怕 阳光 的 这 是 人设 不能 改 不过 = 那 算了 诶 算了 这 你 真的 不来 吗 成为 吸血鬼 就 能 左拥右抱 哦 = 请 务必 让 我 上车 
48033,乱世 多 枭雄 玄阳 聚仁侠 本文 讲述 玄阳 弟子 在 乱世 阴谋 里 艰难 抉择 不忘 初心 的 成长 故事 
