id,abstract
118120042,25 岁 是 人生 最 重要 的 一年 你 选择 了 怎样 的 道路 你 将 获得 怎样 的 人生 25 岁 如何 规划 你 的 人生 是 全 亚洲 备受 欢迎 的 青年 导师 松浦弥 太郎 写给 千万 青年 的 人生 规划 指南 他 以 独特 的 人生 历程 和 生活 哲学 激励 了 无数 年轻人 改变 了 他们 的 命运 50 篇 成长 故事 10 万字 肺腑之言 33 年 奋斗 历程 涵盖 人生 规划 人 脉 积累 自我 提升 团队 管理 投资 理财 创业 晋升 等 人生 最 重要 的 50 个 方面 教导 现在 的 年轻人 25 岁 如何 规划 自己 的 人生 25 岁 如何 让 内心 变得 更加 强大 25 岁 如何 让 自己 积累 丰富 的 人脉 资源 25 岁 如何 不断 提升 自我 价值 建立 自我 品牌 25 岁 如何 学会 带 团队 25 岁 如何 学会 投资 理财 25 岁 如何 学会 平衡 工作 和 生活 25 岁 如何 为 10 年 后 成为 自己 喜欢 的 样子 而 努力 松浦弥 太郎 将 自己 25 岁 时 如果 能 知道 该 怎么 做会 更好 的 50 条 秘诀 真诚 分享 出来 这些 唯有 过来 人才 知道 的 人生哲理 给 年轻人 指明 逆袭 人生 的 正确 路径 请 记住 25 岁 正值 人生 起飞 阶段 也 是 认真思考 自己 想要 做 什么 的 黄金 时期 若 这 本书 能 成为 你 的 人生 良伴 将 是 你 我 莫大 的 荣幸 编辑 推荐 全 亚洲 备受 欢迎 的 青年 导师 松浦弥 太郎 写给 千万 青年 的 人生 规划 指南 人生 仅 有 一次 想 好 怎么 过 才能 过得 好 25 岁 时 你 选择 了 怎样 的 道路 10 年 后 你 将 获得 怎样 的 人生 北大清华 人大 等 全国 百余所 高校 都 希望 年轻人 读到 的 一 本书 50 篇 成长 故事 10 万字 肺腑之言 33 年 奋斗 历程 涵盖 人生 规划 人 脉 积累 自我 提升 团队 管理 投资 理财 创业 晋升 等 人生 最 重要 的 50 个 方面 一部 让你在 人生 十字路口 找到 努力 方向 学会 规划 人生 懂得 设计 未来 的 暖 心之作 风靡 日 韩澳台 等 国家 和 地区 掀起 人人 网 豆瓣 微信 微博 人民日报 1000 万次 话题 热议 马云 俞敏洪 张德芬 李嘉诚 扎克 伯格 稻盛和夫 蔡康永 李开复 范玮琪 等 成功人士 的 心灵 启示 特别 收录 作者 写给 中国 年轻 朋友 的 诚恳 序言 写给 中国 读者 朋友 的 一封信 我 的 出发点 其实 是 一连串 的 失败 高中 辍学 的 我 连 一句 英文 也 不会 说 便 远渡重洋 到 美国 迎接 20 几岁 的 人生 从 时薪 两 美元 的 工作 开始 我 打过 各种 工 终于 开 了 一家 小 书店 开始 进入 出版业 到 现在 成为 COWBOOKS 的 负责人 并 担任 生活 手帖 的 总编辑 我 绝对 不是 一掷千金 的 大 梦想家 而是 累积 每 一个 小 成功 才 造就 现在 的 我 一路 走来 领受到 周遭 前辈 的 诸多 教诲 也 从 不同 的 经验 累积 各种 学习 法则 我 希望 以 这些 事物 为 基础 集结成 一本 教导 现在 25 岁 左右 的 年轻人 如何 享受 美好生活 以及 如何 面对 工作 的 人生 规划 手册 25 岁 正值 人生 起飞 阶段 也 是 认真思考 自己 想 做些 什么 的 黄金 时期 若 这 本书 能 成为 你 的 人生 良伴 将 是 我 莫大 的 荣幸 ─ ─ 松浦弥 太郎 
118120485,北大 最 励志 双胞胎 90 后 最 喜爱 的 同龄 作家 苑子 文苑 子豪 全新 暖心 之作 20 个 关于 勇气 成长 与 爱 的 正 能量 青春 故事 送给 同样 有 梦想 的 你 总有一天 我会 穿越 人 海 发光 发亮 刘同 倾情 推荐 特别 收录 1 尼泊尔 治愈 旅行 日志 2 暖 男 哥哥 和 逗 比 弟弟 的 日常 3 百余 张 精美 摄影 及 超有 爱 兄弟 照 无论 你 现在 的 处境 如何 都 请 不要 轻易 下结论 好 的 请 坚持 坏 的 请 努力 你 要 看到 别人 的 光芒 更要 信仰 自己 的 力量 我们 每 一点 的 付出 大多数 的 尝试 和 所有 的 等待 都 有 意义 你 要 坚信 努力 的 人会 有 好运气 肯 付出 就 能 冲出 黑暗 漫漫长夜 后 黎明 终 会 抵达 我们 都 一样 年轻 又 彷徨 
118121062,见 了 太 多 糟糕 的 事情 反倒 觉得 一切 都 会 好 的 有 了 太 多 糟糕 的 情绪 反倒 知道 怎么 应对 这些 能 接吻 就 不要 说话 能 拥抱 就 不要 吵架 能 行动 就 不要 发呆 能 团聚 就 不要 推辞 好 的 东西 不要 珍藏 今天 能 做 的 事 不要 等到 明天 从现在起 答应 自己 的 事 就 尽力去做 到 答应 自己 要 去 的 地方 就 尽力 去 抵达 这个 世界 太 危险 时间 就 该 浪费 在 美好 的 事物 上 卢思浩 从 17 岁 开始 写文 他 总是 尝试 用 最 真实 的 文字 记录 下 身边 每件 美好 的 事 他 说 只要 心里 有光 就 不用 害怕 黑夜 这本 真诚 的 书用 温暖 的 文字 告诉 你 不要 怕 关于 生活 卢思浩说 成长 的 一部分 就是 你 会 不断 地 和 熟悉 的 东西 告别 和 一些 人 告别 做 一些 以前 不会 做 的 事 爱 一个 可能 没有 结果 的 人 不 做 一些 事心 痒痒 做 了 又 觉得 自己 傻 很 久 以后 我 才 明白 所谓 的 成长 就是 越来越 能 接受 自己 本来 的 样子 也 能 更好 的 和 孤单 的 自己 失落 的 自己 挫败 的 自己 相处 并且 接受 它 然后 面对 它 无论 将来 会 遇到 谁 生活 都 是 先 从 遇到 自己 开始 的 关于 友情 卢思浩说 有些 友情 是 不会 被 时间 打败 的 妖孽 但 即便如此 我们 都 不再 像 从前 一样 能 时刻 陪伴 时常 联系 惟愿 你 过 得 好像 你 照片 一样 好愿 你 能 顺利 像 你 当时 憧憬 的 那般 愿 有人 陪 你 颠沛 像 你 一直 等待 的 那样 来 日 相聚 再 把 当时 的 傻 逼 事儿 和 回忆 下酒 关于 梦想 卢思浩说 总 有些 时刻 你 会 不再 相信 了 可 在 心底 你 又 会 有所 追寻 可 你 又 还是 豁出去 去 等待 去 努力 在 每 一个 追寻 的 过程 中有 太多 的 不 可控 谁 都 不 知道 明天 是 天堂 还是 地狱 你 唯一 能 做 的 就是 现在 努力 跑 不过 时间 就 跑 过 昨天 的 自己 不 惧怕 黑夜 是因为 心里 有光 关于 爱 卢思浩说 你 会 渐渐 发现 有话 聊 是 两个 人 在 一起 的 基本 标准 这 世上 没有 谁 有 义务 去 等 谁 维系 一份 关系 或者 感情 从来 都 是 两个 人 的 事 保持 必要 的 关心 保持 前行 为了 相似 的 目标 共同努力 两个 人才 能 保持 在 同一个 频率 里 说话 总是 要 解释 半天 或者 根本 说 不到 一起 去 多 烦心 能 聊得 来 真的 太 重要 先 找到 自己 的 频率 才能 找到 跟 你 频率 相同 的 人 首先 变成 自己 不 讨厌 的 样子 再 去 遇 一个 无需 取悦 的 人 一个 人 细腻 敏感 甚至 偶尔 矫情 这 完全 没有 什么 不好 谁 都 有 这种 时候 心里 能 被 感动 是 好事 只要 在 工作 学习 时能 保持 效率 就 好 但 人 切记 不要 太 玻璃心 学会 拒绝 不 瞎操心 学会 坚持 不 因为 别人 一句 话 难受 半天 纠结 自己 保持 自我 不去 迎合 任何人 更 不 去 指责 别人 的 人生 加油 
118121643,Thirtyyearsafterwomenbecame50percentofthecollegegraduatesintheUnitedStatesmenstillholdthevastmajorityofleadershippositionsingovernmentandindustryThismeansthatwomensvoicesarestillnotheardequallyinthedecisionsthatmostaffectourlivesInLeanInSherylSandbergexamineswhywomensprogressinachievingleadershiproleshasstalledexplainstherootcausesandofferscompellingcommonsensesolutionsthatcanempowerwomentoachievetheirfullpotentialSandbergisthechiefoperatingofficerofFacebookandisrankedonFortuneslistofthe50MostPowerfulWomeninBusinessandasoneofTimes100MostInfluentialPeopleintheWorldIn2010shegaveanelectrifyingTEDTalkinwhichshedescribedhowwomenunintentionallyholdthemselvesbackintheircareersHertalkwhichbecameaphenomenonandhasbeenviewedmorethantwomilliontimesencouragedwomentositatthetableseekchallengestakerisksandpursuetheirgoalswithgustoInLeanInSandbergdigsdeeperintotheseissuescombiningpersonalanecdotesharddataandcompellingresearchtocutthroughthelayersofambiguityandbiassurroundingthelivesandchoicesofworkingwomenSherecountsherowndecisionsmistakesanddailystrugglestomaketherightchoicesforherselfhercareerandherfamilySheprovidespracticaladviceonnegotiationtechniquesmentorshipandbuildingasatisfyingcareerurgingwomentosetboundariesandtoabandonthe 
118122627,滚蛋 吧 ! 肿瘤 君 : 我 与 癌症 斗争 的 一年 里 由 熊顿 本人 创作 以 她 治疗 的 过程 和 内心 感触 为 素材 讲述 了 一个 癌症 患者 笑 对 生活 的 感人 纪实 在 睁眼 就是 治疗室 入耳 就是 化疗 吃药 体温 白细胞 增减 的 环境 里 她 乐观 的 记录 了 自己 的 每 一段 经历 用 画笔 细心 捕捉 了 来自 父母亲 人 朋友 的 关怀 和 生活 中 的 点滴 感动 一个 风趣 幽默 的 漫画家 在 经历 疾病 给 她 带来 的 天翻地覆 的 变化 后 仍旧 用 作品 里 难以置信 的 坚强 和 幽默 风趣 的 自嘲 泰然处之 也 能 从中 获得 积极 面对 人生 挫折 的 正 能量 相信 滚蛋 吧 ! 肿瘤 君 : 我 与 癌症 斗争 的 一年 里 能 帮助 千千万万 的 读者 留下 彼此 人生 中 最 珍贵 的 东西 信念 阅读 此书 读者 能 感受 到 这本 漫画 簿子 已经 与 她 略显 脆弱 的 生命 融为一体 
118123128,这是 韩国 青年 导师 金兰 都 因为 痛 所以 叫 青春 系列 的 第一部 第二部 千万次 摇摆 才能 长大成人 http : bookdoubancomsubject24869702 已 在 中国 热卖 因为 痛 所以 叫 青春 写给 独自 站 在 人生 路口 的 你 内容简介 漫漫 人生路 一直 在 迷路 在 一个 讲究 拼爹 的 时代 要 拼 什么 才能 拼出 未来 改变 亚洲 亿万 年轻人 的 疗愈 经典 一位 导师 父亲 写给 迷茫 孩子 的 疼痛 共鸣 全 亚洲 重印 512 次 10 个 月 销售 破 150 万 45 周 横扫 各大 排行榜 榜首 很多 时候 在 学业 上 在 工作 上 甚至 在 感情 问题 上 这些 年轻人 甚至 还 没有 迈出 踏进 社会 的 第一步 就 已经 沦为 一个 loser 失败者 在 因为 痛 所以 叫 青春 写给 独自 站 在 人生 路口 的 你 中 作者 金兰 都 如实 地 把 为 人 父母 的 成年人 们 所 不曾 来得及 去 了解 的 这代 年轻人 的 困苦 和 不安 展现 了 出来 作者 帮助 他们 诊视 这些 无法 向 他人 倾诉 的 苦痛 并 告诉 他们 如何 才能 从 这种 苦 找到 为 未来 打拼 的 能量 
118124515,一部 围绕 青少年 篮球运动 的 日本 幽默 卡通 巨片 是 九十年代 以来 在 中国 内地 最 火爆 最为 经典 的 日本 漫画 漫画 讲述 的 是 一 名叫 樱木花道 的 高一 新生 追求 篮球梦 的 故事 他 在 初中 的 恋爱 失败 了 50 次 上 了 高中 为了 赢得 晴子 的 芳心 加入 了 湘北 篮球 社并 以 惊人 的 速度 进步 开始 了 他 的 篮球 生涯 在 那里 他 遇上 了 女生 心目 中 的 篮球 偶像 流川枫 以及 宫城 三井 等 人 的 出现 湘北 篮球 社 不断 成长 
118125659,人生 不 需要 大道理 一点 小 哲学 就够 了 100 个 基本 是 张德芬 最 喜欢 的 日本 生活 美学 大师 松浦弥 太郎 对 其 生活 哲学 的 最高 诠释 一本 精致 实用 的 人生 箴言 录在 这 本书 中松浦以 更 贴近 的 姿态 更 诚恳 的 思考 审视 日常 的 美好 原来 好 的 生活 可以 很 容易 恪守 基本 才能 享受 生活 原来 通过 有效 的 自我管理 能够 真正 理解 自己 的 本质 100 个 基本 是 写给 自己 的 信条 看似 简单 的 人生哲学 里 蕴含 了 不 简单 的 生活 智慧 后半部 分为 其 书店 COWBOOKS 成立 十周年 之际 松浦为 所有 工作人员 写下 重新 检视 的 100 条 管理 准则 将 每天 的 失败 当作 教训 莫忘 初衷 全力以赴 兼具 杂志 总编 独立 书店 老板 等 多重 身份 的 松浦弥 太郎 其 独到 的 生活 美学观 被 数百万 日本 人 推崇 100 个 基本 是 他 的 代表作 在 日本 一经 推出 就 广受 赞誉 一年 之内 重印 多达 11 次 本书 采用 双色 印刷 书末 更 附上 了 笔记 页 让 你 把 对 生活 的 方向 及 人生 的 体验 化作 文字 写下 专 属于 自己 的 100 个 基本 
118130266,◎ 全球 首部 埃隆 • 马斯克 授权 著作 了解 埃隆 • 马斯克 最 全面 最 真实 最 经典 读本 ◎ 创业者 必读 首次 披露 马斯克 如何 建立 和 运营 PayPal 特斯拉 SpaceXSolarCity 等 公司 的 细节 ◎ 创新者 必读 关于 科技 梦想 创业 工作 团队 人生 马斯克 首次 公开 创新 的 秘密 ◎ 故事 迷 必读 硅谷 最 优秀 科技 作家 阿什利 • 万斯 历时 将近 4 年 遍访 300 余人 写 就 记录 马斯克 传奇 人生 的 经典著作 ◎ 科幻 迷 必读 从 科幻小说 到 火星 探险 一部 关于 人类 好奇心 的 伟大 史诗 ◎ 本书 独家 收录 32 张埃隆 • 马斯克 成长 创业 和 婚姻生活 的 珍贵 图片 ◎ 纽约时报 经济学 人 亚马逊 年度 商业 图书 20 余国 版本 全球 热卖中 ◎ 罗永浩 王 小川 周鸿祎 张鹏余晨 周航 撰文 致敬 埃隆 • 马斯克 是 风格 独具 的 梦想家 也 是 眼光 独到 一再 开 创新 商业模式 的 企业家 从 PayPal 到 特斯拉 SpaceX 太阳城 他 的 创业 历程 中 遭遇 了 无数 棘手 的 事件 但是 每 一次 突破 都 令 全球 惊艳 无论 钟情 于 什么 领域 他 都 可以 展现出 惊人 的 专注 力 44 岁 的 马斯克 已经 涉足 颠覆 互联网 金融 汽车 航空 以及 能源业 他 近乎 疯狂 的 对 科技 的 专注 使 他 成为 目前 最 成功 的 连续 创业者 和 科技 创业家 硅谷 资深 科技 记者 阿什利 • 万斯 与 马斯克 超过 40 个 小时 的 深度 对话 记录 了 他 从 粗放 贫瘠 的 南非 到 国际 商业 世界 顶峰 的 不凡 之 旅在 三年 多 的 时间 里 作者 首次 深入 特斯拉 SpaceX 等 公司 采访 了 马斯克 的 伙伴 员工 家人 朋友 超过 300 人 真实 地 讲述 了 马斯克 在 创立 运营 他 那些 足够 改变 世界 的 公司 包括 PayPal 特斯拉 SpaceX 和 太阳城 时 发生 的 惊人 故事 同时 也 揭示 了 企业家 和 创业者 如何 专注 于 创业 本身 并 同时 管理 多 领域 公司 所 需要 的 能力 方法 和 经验 以及 如何 在 与 许多 竞争对手 交手 时 不断 推进 企业 创新 的 步伐 埃隆 • 马斯克 的 人生 经历 和 无数 改变 世界 的 伟大 实业家 的 经历 一样 是 那种 可以 被 千百次 地写 进 小说 搬 上银幕 后 每 一次 重看 都 依然 激动人心 的 属于 全人类 的 传奇 故事 
118130641,每天 都 進步 1% 一年 後 你 會 進步 37 倍 每天 都 退步 1% 一年 後 你 會 弱化 到 趨近 於 0 你 的 一點 小 改變 一個 好 習慣 將會產生 複 利效 應 如 滾 雪球 般為 你 帶來 豐碩 的 人生 成果 一 出版 立刻 風行 全球 企業界 運動界 教育界 瘦身 界 都 在 用 的 習慣 養成 實作 指南 Amazon 紐約 時 報華爾街 日報 今日 美國報 出版 人 週刊 暢銷 書 商業 雜誌 FastCompany 評為 2018 年 7 本 最佳 商業 書 之一 商業 內幕 BusinessInsider 網站 選為 2018 年 最佳 自我 成長 書籍 職涯 網站 TheMuse 推薦 最能 幫助 你 增進 工作效率 的 書 善用 「 複 利 」 效應 讓 小小的 原子 習慣利 滾利 滾出 生命 的 大 不同 天天 細微 改變會 累積成 巨大 差異 這 就是 原子 習慣 的 驚人 力量 本書 作者 詹姆斯 ‧ 克利 爾 在 高 二 的 一場 棒球 賽中 意外 被 球棒 擊中 臉 嚴重 受傷 甚至 被 實施 人工 昏迷 經過 好 幾個 月 的 治療 雖然 痊 癒 出院 可以 重新 踏上 球場後來 也 進入 大學 棒球 隊 卻 只能 坐在 板凳 席幾乎 沒有 上場 機會 然而 在 頭部 嚴重 受傷 之 後 的 第六年 他 被 選為 他 所 就 讀大學 的 最佳 男性 運動員 並且 入選 ESPN 的 全美 明星 陣容 整個 美國僅 有 33 人 獲得 這項 殊榮 從 運動 生涯 幾乎 結束 到 入選 全美 明星 陣容 甚至 在 畢業 時 獲得 學業 方面 的 總統 獎章 他 是 怎麼 做到 的 一切 只 因 他 認識且 善用 了 「 原子 習慣 」 的 力量 ◎ 有效 建立 永久 良好 習慣 的 系 統化 「 行為 改變 四法則 」 雖然 知道 習慣 很 重要 但 你 經常為 了 自己 的 壞 習慣 苦惱 想要 戒除 卻力 不 從心 或者 你 想 養成 好 習慣 卻 老 是 半途而 廢其實 問題 不 在 你 身上 而是 你 遵循 的 行為 改變系 統出 了 問題 作者 從 生物 學 心理 學及 神經 科學 中擷 取菁華 結合 自己 親身 實踐 的 經驗 創造 出 簡單 易懂 容易 執行 的 「 行為 改變 四法則 」 這套 法則 可運用 於 學業 工作 家庭 健康 財 富人 際關 係 等 人生 各個 面向 有效 幫助 你 打造 好 習慣 戒除 壞習慣 ◎ 風行 各界 的 習慣 養成 指南 本書 作者 是 世界 知名 的 習慣 養成 專家 經常 受邀 到 各界 演講 例如 NFLNBAMLB 的 球隊 以及 美國 運通麥 肯錫 美林 證券 奇異 公司 本田 汽車 思科 系統 IKEA 等 知 名企 業本書 提供 的 系 統性 方法 不 只 適用 於 個 人 還能 運用 在 ‧ 商業 讓 顧 客養 成購 買 你 的 產品 或 服務 的 習慣 ‧ 親子 教養 讓 孩子 養成 良好 的 生活 習慣 ‧ 教育 讓 學生 建立 良好 的 讀書 習慣 ◎ 你 可以 在 這本書 中學到 的 10 件 事 ‧ 建立 一套 每天 進步 1% 的 系統 ‧ 戒除 壞習慣 保持 好 習慣 ‧ 避免 多數 人 在 改變 習慣 時 常犯 的 錯 ‧ 克服 「 缺乏 動機 和 意志力 」 的 問題 ‧ 建立 更強 大 的 身分 認同 與 信心 ‧ 騰出 時間 建立 新習慣 即使 你 忙 瘋 了 ‧ 設計 讓 你 更 容易 成功 的 環境 ‧ 做出 可以 造就 巨大 成果 的 微小 改變 ‧ 在 養成 好 習慣 的 路上 走 偏時 回到 正軌 ‧ 將本書 中 提到 的 概念 運用 在 實際 生活 中 
118131639,本书 是 苑子 豪 全新 小说集 共收录 七篇 短篇小说 在 这 本书 中苑子 豪 编织 了 一个 庞大 的 世界 高中 时 优秀 到 耀眼 的 校草 却 偏爱 茉莉花 香味 的 纸巾 沉默 热爱 游泳 的 大 男孩 一直 都 陷入 与 父亲 的 对抗 城市 中 合租 的 年轻人 抽着 烟 似乎 有着 无限 心事 每天 都 会 见到 的 小卖 店老板 说 自己 有个 明星 老婆 一起 走过 多年 的 恩爱 情侣 却 不知 如何 说 再见 每个 故事 之间 并非 独立 存在 每个 人物 之间 也 有 命运 的 交互 和 重叠 复杂 而 隐秘 浪漫 的 青春 无常 的 命运 追逐 的 梦想 顾盼 的 希望 波澜 的 人生 苑子 豪 笔下 的 人物 与 我们 一样 都 正在 经历 着 生活 带来 的 困境 也 有 一些 只能 自己 走过 的 黑暗 瞬间 而 这 本书 就 想 做 点亮 黑夜 的 那束 光芒 苑子 豪用 他 那 动人 的 笔触 告诉 我们 每个 人 的 生活 都 会 有 像 被困 在 井里 一样 的 绝望 时刻 就算 看不到 希望 也 要 一直 奔跑 下去 当 你 没有 力气 跑不动 的 时候 不 一定 是 大步 飞奔 也 可以 是 缓慢 前行 我们 每 一个 人 都 不要 害怕 这 漫长 黑夜 
118132284,名人传 是 法国 作家 罗曼罗兰 所著 贝多芬 传 米开朗琪罗 传 和 托尔斯泰 传 的 合称 名人传 的 三位 传主 都 是 人类 历史 上 极富 天才 而 创建 至伟 的 人物 他们 的 人生 丰富多彩 他们 的 作品 精深 宏博 他们 的 影响 历经 世代 而 不衰 罗曼罗兰 紧紧 把握住 这 三位 有着 各自 领域 的 艺术家 的 共同之处 着力 刻画 他们 在 扰 患 困顿 的 人生 征途 上 历尽 苦难 与 颠 踬 而 不 改 初衷 的 心路历程 凸现 他们 崇高 的 人格 博爱 的 情感 和 广阔 的 胸襟 从而 为 我们 谱写 了 另 一阕 英雄 交响曲 
118132737,在 这本 图文并茂 的 写真 书中 胡歌用 自己 平实 的 笔触 讲述 了 2006 年 夏天 车祸 发生 的 来龙去脉 面对 突如其来 的 打击 支离破碎 的 一切 自己 坦然 面对 的 乐观 和 真诚 以及 将 被 撞 碎 的 幸福 一个个 一片片 拾回 的 心路历程 此外 胡歌 的 童年 趣事 学习 唱歌 和 演戏 的 片段 好友 的 祝福 一并 收录 到 了 本书 中 还有 近 百幅 首度 曝光 的 照片 翔实 记录 了 胡歌 从 人生 轨迹 一帆风顺 的 青春偶像 蜕变 成 一个 日渐 成熟 坦然 面对 生命 的 幸福 拾荒者 的 过程 在 本书 里 胡歌 娓娓道来 讲述 自己 对 生活 生命 的 理解 和 感悟 文字 平实 感人 从从容容 的 字里行间 一个 阳光 健康 日渐 成熟 的 幸福 的 拾荒者 胡歌 悄然 向 我们 走来 编辑 推荐 当 残酷 找到 我 我 要 面对 的 只有 支离破碎 的 一切 我要 做 的 就是 立刻 把 它们 捡回来 首度 披露 胡歌 车祸 的 来龙去脉 首度 讲述 胡歌 乐观 面对 人生 的 心路历程 
118133754,从 被 发现 的 第一天 起墨菲 定律 就 被 证明 是 对 事情 出错 的 最好 解释 它 告诉 我们 容易 犯错 是 人类 与生俱来 的 弱点 不论 科技 多 发达 错误 都 会 发生 而且 我们 解决问题 的 手段 越 高明 面临 的 麻烦 就 越 严重 这本 独特 的 合集 是 迄今 收录 墨菲 定律 最多 的 版本 在 国外 每年 都 有 再版 此版 除了 一如既往 地 收集 了 墨菲 定律 的 最佳 注释 之外 还 加入 了 21 世纪 之后 的 最新 变化 证明 随着 科技 的 进步 更 多 的 事情 会 出错 比如 ● 电脑 靠不住 人 更 靠不住 靠 人 维护 的 所有 系统 当然 也 靠不住 ● 女人 像 游艇 需要 定期维护 和 关注 而且 花费 很 高 男人 像 公共汽车 下 一班 迟早会 来 ● 如果 把 研究 女人 胸部 的 精力 放在 研究 航天 计划 上 我们 或许 已经 在 月球 上 练摊儿 了 ● 婚姻关系 就 像 一只 狗 和 一根 骨头 他 她 可能 碰 都 不 碰 那根 骨头 但 也 不 允许 其他 狗 靠近 
118134217,本书 是 百万 畅销书 作家 中国 优质 新 偶像 李尚龙 写给 千万 年轻人 的 成长 激励 之 书 全书 41 篇 作者 亲历 亲闻 的 故事 如同 41 个 特写镜头 把 生活 的 现实 功利 残酷 拆开来 给 你 看 为 你 提供 全新 的 观察 生活 和 审视 自己 的 视角 告诉 你 年轻 时 没有 安稳 平淡 的 中间 选项 你 要么 大汗淋漓 地 出众 活 出 耀眼 且 丰盛 的 自己 要么 小心翼翼 地 出局 被迫 面对 人生 的 遗憾 和 后悔 多篇 火爆 朋友圈 的 正 能量 好文 舒适 区终 有 一天 会 毁掉 青春 寂寞 是 最好 的 增值 期忙 起来 多好 因为 闲下来 更累 下班 后 的 生活 决定 了 人 的 一生 弱者 看 平台 强者 造 平台 别 怕麻烦 人好 的 朋友 都 是 麻烦 出来 的 等 也 都 收录 在 本书 当中 
118134805,咪 蒙 现象 国民 励志 女作家 在 这个 功利 的 世界 作品 会 说话 它 承认 你 的 努力 国民 励志 女作家 咪 蒙 引爆 新 媒体 阅读 神话 微信 公众 号 粉丝 超过 300W 单篇 平均 阅读 量 超过 100W 超过 218692036 次 阅读 6 亿次 转发 平均 每 6 秒钟 就 有 一个 人读 过 咪 蒙 的 文字 58256 人 因此 改变 了 一生 为什么 我们 要 这么 拼 如何 在 这 操蛋 的 世界 保持 快乐 我 喜欢 这个 功利 的 世界 同名 文章 转发 超过 2087560 引发 全城 热议 读 罢 咪 蒙 的 文章 浑身 热血沸腾 恨不得 分 分钟 冲锋陷阵 名篇 如何 在 这 操蛋 的 世界 里 保持 快乐 你 觉得 为时已晚 的 时候 恰恰 是 最早 的 时候 所谓 情商 高 就是 懂得 好好 说话 致 贱人 我 凭 什么 要 帮 你 为什么 我们 要 这么 拼是 的 我 更 喜欢 努力 的 自己 成为 朋友 圈里 经常出现 的 正 能量 好文 写给 每 一个 为了 让 自己 变得 更好 而 不断 向上 的 你 咪 蒙 每篇 文章 都 有 大量 的 经典 金句 写给 想 成为 更好 的 自己 的 你 当 你 发光 发亮 自然 万众瞩目 国民 励志 女作家 咪 蒙 献给 每 一个 人 的 梦想 之书当 你 足够 优秀 所有 你 想要 的 一切 都 会 主动 找 上 你 当 你 发光 发亮 自然 万众瞩目 当 你 觉得 为时已晚 的 时候 恰恰 是 最早 的 时候 这个 世上 只要 你 敢 再 大 的 不 可能 都 会 变成 可能 我 喜欢 这个 功利 的 世界 更 重要 的 是 功利 的 背后 它 承认 的 是 你 的 努力 我们 深知 世界 的 复杂 黑暗 和 荒谬 依然 选择 面对 复杂 保持 欢喜 写给 每 一个 为了 让 自己 变得 更好 而 不断 向上 的 你 
118135306,本书 收集 了 路遥 创作 谈 自传 言论 方面 的 文章 
