id,abstract
118014343,奇迹 一部 新人 处女作 上市 第一周 即 登上 纽约时报 畅销 榜 至今 已 累计 80 周 仍 高居 Top1 全美 销量 破 百万册 作者 因此 书 被 时代周刊 评为 年度 影响力 人物 比尔 • 盖茨 年度 荐 书 第一名 美国 亚马逊 年度 编辑 选书 第一名 纽约时报 华尔街日报 波士顿 环球 报 畅销书 排行 第一名 Goodreads 读者 票选 超越 米歇尔 成为 获 年度 最佳 图书 洛杉矶 时报 最佳 传记 奖 纽约时报 卫报 华盛顿邮报 泰晤士报 星期日 泰晤士报 经济学 人 奥普拉 杂志 美国 国家 公共 广播电台 等 二十多家 权威 媒体 年度 图书 一个 惊人 的 故事 真正 鼓舞人心 我 在 阅读 她 极端 的 童年 故事 时 也 开始 反思 起 自己 的 生活 你 当 像 鸟 飞往 你 的 山 每个 人 都 会 喜欢 它 甚至 比 你 听说 的 还要 好 比尔 • 盖茨 教育 意味着 获得 不同 的 视角 理解 不同 的 人 经历 和 历史 接受 教育 但 不要 让 你 的 教育 僵化 成 傲慢 教育 应该 是 思想 的 拓展 同理 心 的 深化 视野 的 开阔 它 不 应该 使 你 的 偏见 变得 更 顽固 如果 人们 受过 教育 他们 应该 变得 不 那么 确定 而 不是 更 确定 他们 应该 多 听 少 说 对 差异 满怀激情 热爱 那些 不同于 他们 的 想法 塔拉 • 韦斯特 弗 福布斯 杂志 访谈 你 可以 用 很多 说法 来 称呼 这个 全新 的 自我 转变 蜕变 虚伪 背叛 而 我 称之为 教育 塔拉 • 韦斯特 弗 作者 亲定 中文版 书名 你 当 像 鸟 飞往 你 的 山 人们 只 看到 我 的 与众不同 一个十七岁 前 从未 踏入 教室 的 大山 女孩 却 戴 上 一顶 学历 的 高帽 熠熠生辉 只有 我 知道 自己 的 真面目 我 来自 一个 极少 有人 能 想象 的 家庭 我 的 童年 由 垃圾场 的 废铜烂铁 铸成 那里 没有 读书声 只有 起重机 的 轰鸣 不 上学 不 就医 是 父亲 要 我们 坚持 的 忠诚 与 真理 父亲 不 允许 我们 拥有 自己 的 声音 我们 的 意志 是 他 眼中 的 恶魔 哈佛大学 剑桥大学 哲学 硕士 历史 博士 我 知道 像 我 这样 从 垃圾堆 里 爬出来 的 无知 女孩 能 取得 如今 的 成就 应当 感激涕零 才 对 但 我 丝毫 提不起 热情 我 曾 怯懦 崩溃 自我 怀疑 内 心里 有 什么 东西 腐烂 了 恶臭 熏天 直到 我 逃离 大山 打开 另 一个 世界 那 是 教育 给 我 的 新世界 那 是 我 生命 的 无限 可能 
118014844,平凡 的 世界 是 一部 现实主义 小说 也 是 一部 小说 形式 的 家族史 作者 浓缩 了 中国 西北 农村 的 历史 变迁 过程 在 小说 中 全景式 地 表现 了 中国 当代 城乡 的 社会 生活 在 近十年 的 广阔 背景 下 通过 复杂 的 矛盾 纠葛 刻划 社会 各阶层 众多 普通人 的 形象 劳动 与 爱情 挫折 与 追求 痛苦 与 欢乐 日常生活 与 巨大 社会 冲突 纷繁 地 交织 在 一起 深刻 地 展示 了 普通人 在 大 时代 历史进程 中 所 走过 的 艰难曲折 的 道路 
118015479,本书 讲述 了 一个 渔夫 的 故事 古巴 老 渔夫 圣地亚哥 在 连续 八十四 天没捕 到 鱼 的 情况 下 终于 独自 钓上 了 一条 大马 林鱼 但 这鱼 实在 大 把 他 的 小船 在 海上 拖 了 三天 才 筋疲力尽 被 他 杀死 了 绑 在 小船 的 一边 在 归程 中 他 再 遭到 一条 鲨鱼 的 袭击 最后 回港 时 只 剩 鱼头 鱼尾 和 一条 脊骨 而 在 老 圣地亚哥 出海 的 日子 里 他 的 忘 年 好友 一直 在 海边 忠诚 地 等待 满怀信心 地 迎接 着 他 的 归来 
118020883,这 本书 收入 斯蒂芬 金 的 四部 中篇小说 是 他 作品 中 的 杰出 代表作 其 英文版 一经 推出 即 登上 纽约时报 畅销书 排行榜 的 冠军 之位 当年 在 美国 狂销 二十八 万册 目前 这 本书 已经 被 翻译成 三十 一种 语言 同时 创下 了 收录 的 四篇 小说 中有 三篇 被 改编 成 轰动一时 的 电影 的 记录 其中 最为 著名 是 曾 获 奥斯卡奖 七项 提名 被 称为 电影史 上 最 完美 影片 的 肖申克 救赎 又 译 刺激 一九九 五 这部 小说 展现 了 斯蒂芬 金于 擅长 的 惊悚 题材 之外 的 过 人 功力 书中 的 另 两篇 小说 纳粹 高徒 与 尸体 拍成电影 后 也 赢得 了 极佳 的 口碑 其中 尸体 还 被 视为 斯蒂芬 金 最具 自传 色彩 的 作品 
118021316,牧羊 少年 圣地亚哥 接连 两次 做 了 同一个 梦 梦见 埃及 金字塔 附近 藏有 一批 宝藏 少年 卖掉 羊群 历尽 千辛万苦 一路 向南 跨海 来到 非洲 穿越 死亡 之海 撒哈拉 大 沙漠 期间 奇遇 不断 在 一位 炼金术士 的 指引 下 他 终于 到达 金字塔 前 悟出 了 宝藏 的 真正 所在 
118021802,本书 的 主人公 保尔 柯察金 饱尝 了 生活 的 苦难 炼就 了 革命 精神 和 反抗 性格 十月革命 爆发 后 只有 十六岁 的 他 就 参加 了 红军 无论 在 战 炮火 中 还是 在 国民经济 复 时期 可察金 都 表现 出 大无畏 精神 钢铁 一般 的 意志 强烈 的 爱国主义 和 对 人民 的 无限 的 无限忠诚 由于 在 战争 中 多次 负伤 以及 劳累过度 他 全身 瘫痪 双目失明 被 牢牢 禁锢 在 床上 但 他 占 胜 了 精神 与 肉体 的 打击 拿 起笔 来 歌颂 为 建立 苏维埃 政权 而 奋斗 的 英雄 
118022704,责任 梦想 努力 坚定 张艺兴 的 24 年 经历 了 充满 了 春 之 朝气 夏 之 溽热 秋 之 丰盛 冬 之 变革 的 四季 从 青涩 少年 蜕变 为 耀眼 巨星 张艺兴 首次 记录 成长 点滴 这是 熟悉 又 陌生 的 张艺兴 童年 时 经常 思考 我 的 世界 的 问题 对 那个 时候 的 我 自己 来说 这种 天旋地转 的 需要 一个 人 静静的 时刻 好像 很 重要 十七岁 只身 赴 韩 有人 问 我 在 韩国 那 两年 的 生活 是 什么 颜色 我 想 了 很 久 是 没有 颜色 的 我 不 知道 努力 是 什么 颜色 二十一岁 以 EXO 成员 身份 正式 出 道 所有人 只能 帮助 那个 想要 成长 的 你 没有 人会求 着 你 去 成长 因为 那 是 你 自己 的 事情 二十三岁 被 推上 舆论 的 风口浪尖 不管 别人 说 什么 我 只 做 我 内心 认为 正确 的 事 问心无愧 堂堂正正 一个 简单 又 坚强 的 张艺兴春 之 朝气 在 万物 如新 的 时节 与 世界 初见 家人 的 爱 是 一种 幸福 更是 一份 责任 夏 之 溽热 在 严酷 艰难 的 时刻 退去 青涩 找回 自己 需要 战斗 从来 没有 天分 只有 努力 秋 之 丰盛 在 耀眼 的 季节 坚定 向前 把 喜欢 的 事 做到 极致 做 给 自己 看 也 做 给 怀疑 我们 的 世界 看冬 之 变革 在 蓄势待发 的 转折 期间 从未 忘却 初 心 就算 世界 只 剩下 自己 也 不要 丢 了 梦想 我会 疲惫 但 不会 胆怯 我会 失败 但 不会 退缩 我 就是 我 的 世界 
118023306,鲁滨逊 飘流 记是 18 世纪 英国 作家 达尼尔 笛福 的 代表作品 也 是 一部 具有 广泛 的 世界性 影响 的 作品 小说 以 1704 年 一名 苏格兰 水手 亚历山大 薛 里基 洛克 航海 遇险 飘流 在 一个 荒岛 上 并且 单独 留居 了 四年 才 被 救回 了 故事 作为 素材 加工 而成 的 小说 的 主人公 鲁滨逊 是 一 青年 性喜 冒险 他 不顾 父亲 的 劝阻 决心 要 过 海上 生活 开头 号 几次 航海 以商 颇为 顺利 但 有 一次 为 土耳其 海盗 所俘 幸而 不久 脱 脱逃 至 巴西 经营 蔗田 和 糖厂 四年 后 因获 暴利 又 往 非洲 反卖 黑 八股 中 于大海 中 遇险 船上 全部 船员 葬身鱼腹 仅 鲁滨逊 一个 脱难 飘流 至 一 荒岛 之上 从此 他 孤独 一个 在 岛 羊 造船 等 后来 他 救 了 一个 野人 俘虏 取名 礼拜五 鲁滨逊 在 岛上 生活 了 二十八年 最后 一艘 英国 船航经 荒岛 他 才 有 机会 搭船 回国 
118024359,这 本书 处处 透露 出 沟通 与 理解 的 意味 它 跨越 时代 限制 帮助 我们 探索 爱 的 本质 引导 我们 过 上 崭新 宁静 而 丰富 的 生活 它 帮助 我们 学习 爱 也 学习 独立 它 教诲 我们 成为 更 称职 的 更 有 理解 心 的 父母 归根到底 它 告诉 我们 怎样 找到 真正 的 自我 正如 开篇 所 言 人生 苦难 重重 M 斯科特 派克 让 我们 更加 清楚 人生 是 一场 艰辛 之旅 心智 成熟 的 旅程 相当 漫长 但是 他 没有 让 我们 感到恐惧 相反 他 带领 我们 去 经历 一系列 艰难 乃至 痛苦 的 转变 最终 达到 自我 认知 的 更 高 境界 
118024898,二十二岁 的 林 朝夕 在 父亲 确诊 阿尔茨海默 病 这天 得知 自己 暗恋 多年 的 校园 男神 裴 之 即将 出国深造 的 消息 对方 考取 的 学校 恰是 父亲 当年 为 她 放弃 的 那 所 同样 自幼 与 奥数 结缘 裴 之 在 通往 数学 之 路上 步履 不停 的 背影 令 曾 被 父亲 寄予厚望 却 半途而废 的 林 朝夕 幡然醒悟 自己 与 真正 的 天才 间 存在 无法 追赶 的 遥迢 距离 直到 亲手 敲开 记忆 中 的 那 枚 彩蛋 一道 爱因斯坦 质能 方程式 为 她 开启 了 一段 说走就走 的 逆袭 之 旅在 这场 光怪陆离 的 冒险 中 凭借 多年 奥数 竞赛 经验 开挂 的 林 朝夕 豁然 发觉 那些 曾经 辜负 的 光阴 遗弃 的 信条 未竟 的 梦想 错失 的 羁绊 乃至 父亲 的 病症 在 她 拾获 这份 来自 命运 的 垂青 时 一切 便 都 有 了 重新 弥补 的 可能 哪怕 是 开局 坏 到极点 的 人生 亦 有 无限 生机 
118025366,富 爸爸 穷爸爸 是 一个 真实 的 故事 作者 罗伯特 清崎 的 亲生 父亲 和 朋友 的 父亲 对 金钱 的 看法 截然不同 这使 他 对 认识 金钱 产生 了 兴趣 最终 他 接受 了 朋友 的 父亲 的 建议 也 就是 书中 所说 的 富 爸爸 的 观念 即 不要 做 金钱 的 奴隶 要 让 金钱 为 我们 工作 并 由此 成为 一名 极富 传奇色彩 的 成功 的 投资 家 
118025977,长跑 的 目标 不是 更 快 而是 更强 明明 这么 痛苦 这么 难过 为什么 就是 不能 放弃 跑步 因为 全身 细胞 都 在 蠢蠢欲动 想要 感受 强风 迎面 吹拂 的 滋味 宽政 大学 宿舍 竹青庄 的 十名 舍友 凑成 杂牌 长跑队 在 队长 清濑灰二 的 魔鬼 训练 下 从零开始 向 日本 历史 最 悠久 的 长跑 接力赛 箱根 驿传 挺进 这 十名 大学生 包括 两名 田径队 逃兵 一对 神经 大条 又 聒噪 的 双胞胎 俊帅 漫画 宅 男 尼古丁 中毒 的 万年 留级生 逻辑 超强 的 毒舌 精英 不爱 跑步 的 黑人 留学生 老实 好 青年 百发百中 猜谜 王 这些 选手 刚 开始 时连 自己 是 田径队 都 不 知道 且 一半 成员 没有 长跑 经验 他们 能否 创造 箱根 驿传 史上 最大 奇迹 不到 最后 一棒 没人 知道 答案 箱根 驿传 二三 事 1 \t 日本 历史 最 悠久 的 长跑 接力比赛 始于 1920 年 每年 1 月 2 日 3 日 举办 由 关东 学生 田径 联盟 主办 读卖新闻 协办 是 日本 新年 最 重要 的 全民 关注 的 体育赛事 2 \t 路线 从 读卖新闻 东京 本社 前 出发 至 箱根 芦之湖 后 折返 去程 有 5 个 区间 回程 同样 有 5 个 区间 合计 10 个 区间 总长 约 217 公里 3 \t 参赛 门槛 为 曾经 取得 17 分钟 内 完成 5 公里 的 记录 赛 正式 记录 后 调整 为 16 分钟 30 秒 内 完成 5 公里 或 34 分钟 内 完成 10 公里 4 \t 参赛 队伍 共 20 所 大学 代表队 各 10 名 选手 每支 队伍 的 每位 参赛选手 至少 要 跑 20 公里 第 4 区 例外 为 185 公里 编辑 推荐 △ 直木赏 得 主编 舟 记多田 便利 屋 作者 三浦 紫苑 历时 六年 创作 之 运动 励志 文学 代表作 明明 这么 痛苦 为什么 就是 不能 放弃 跑步 长跑 的 目标 不是 更 快 而是 更强 跑步 真谛 亦 是 人生 心诀 △ 以 日本 全民 关注 的 体育 盛事 箱根 驿传 为 背景 强风 吹拂 的 世界 铸就 一起 奔跑 的 热血青年 2012 年 由 村上春树 首次 执笔 文案 的 长跑 广告片 在 箱根 驿传 期间 投放 鼓舞 大 地震 后 民众 士气 而 片中 于 痛苦 中 超拔 的 驿传 精神 也 通过 互联网 在 全 亚洲 传播 疼痛 无可避免 苦痛 却 可以 自己 选择 △ 以 20 公里 时速 接力 完成 217 公里 长跑 十名 大学生 挑战 不 可能 任务 的 青春 群像 跑步 是 孤单 的 运动 跑步 者 却 可以 不 孤单 强风 吹拂 中 一支 勉强 取得 参赛 资格 的 弱小 田径队 在 队长 清濑灰二 率领 之下 与 传统 强校 比肩 较量 队员 们 共同 经历 魔鬼 训练 与 严酷 现实 终于 创造 箱根 驿传 史上 最大 奇迹 强风 吹拂 只有 跑者 了解 的 状态 纵 有 疾风 起 人生 不言弃 
118030413,自控力 内容简介 作为 一名 健康 心理学家 凯利 • 麦格 尼格 尔博士 的 工作 就是 帮助 人们 管理 压力 并 在生活中 做出 积极 的 改变 多年 来 通过观察 学生 们 是 如何 控制 选择 的 她 意识 到 人们 关于 自控 的 很多 看法 实际上 妨碍 了 我们 取得成功 例如 把 自控力 当作 一种 美德 可能 会 让 初衷 良好 的 目标 脱离 正轨 所以 麦格 尼格 尔 要求 她 的 学生 了解 影响 自控 的 生理学 基础 心理 陷阱 和 各种 社会 因素 麦格 尼格 尔 吸收 了 心理学 神经学 和 经济学 等 学科 的 最新 洞见 为 斯坦福大学 继续 教育 项目 开设 了 一门 叫做 意志力 科学 的 课程 参与 过 这门 课程 的 人称 其 能够 改变 一生 这门 课程 就是 自控力 一书 的 基础 本书 为 读者 提供 了 清晰 的 框架 讲述 了 什么 是 自控力 自控力 如何 发生 作用 以及 为何 自控力 如此 重要 海报 
118031673,20 世纪 一个 独特 的 生命 个体 以 其 勇敢 的 方式 震撼 了 世界 她 海伦凯勒 一个 生活 在 黑暗 中 却 又 给 人类 带来 光明 的 女性 一个 度过 了 生命 的 88 个 春秋 却 熬过 了 87 年 无光 无声 无语 的 孤绝 岁月 的 弱女子 然而 正是 这么 一个 幽闭 在 盲聋哑 世界 里 的 人 竟然 毕业 于 哈佛大学 德 克利夫 学院 并用 生命 的 全部 力量 处处 奔走 建起 了 一家家 慈善机构 为 残疾人 造福 被 美国 时代周刊 评选 为 20 世纪 美国 十大 英雄 偶像 创造 这一 奇迹 全靠 一颗 不屈不挠 的 心 海伦 接受 了 生命 的 挑战 用 爱心 去 拥抱 世界 以 惊人 的 毅力 面对 困境 终于 在 黑暗 中 找到 了 人生 的 光明面 最后 又 把 慈爱 的 双手 伸向 全世界 
118032026,因为 无力 扶养 母亲 将 年 仅 八岁 的 昭广 寄养 到 佐贺 乡下 的 外婆家 没想到 迎接 他 的 却是 一间 破烂 茅屋 在 那 物质 匮乏 的 日子 里 乐观 的 外婆 却 总有 神奇 的 办法 让 生活 过 下去 始终 让 家里 洋溢着 笑声 和 温暖 
118033153,内容简介 这是 一套 完整 的 个人 影响力 打造 和 财富 升级 的 干货 指南 全书 分为 打基础 大 升级 终极 三项 内容 主线 共含 17 个 板块 内容 每个 板块 下设 10 个子 项 围绕 主题 进行 阐释 囊括 时间 状态 情商 学霸 读书 写作 讲课 牛 人 贵人 团队 社群 销售 品牌 冠军 赚钱 写书 终极 17 项 关键词 充分 契合 当下 个人成长 及 财富 升级 需要 掌握 的 核心 技能 全书 所有 内容 均 是 作者 自己 实际 践行 后 的 总结 且 经过 大量 高效 社群 和 读者 验证 亲测 有效 加速 变化 的 时代 写给 能 成事 的 你 让 自己 变得 更好 是 解决 一切 问题 的 关键 ! 编辑 推荐 樊登 任泉 冯仑管 清友 倾力 推荐 让 自己 变得 更好 是 解决 一切 问题 的 关键 ! 17 个 战略 主题 170 篇 实战 锦囊 提供 一套 完整 的 个人 影响力 打造 和 财富 升级 的 干货 指南 语录 式 文字 风格 简洁 凝练 直接 高效 每一项 内容 都 是 作者 自己 实际 践行 后 的 总结 且 经过 大量 高效 社群 和 读者 验证 亲测 有效 每章 结尾 增设 全章 金句 总结 ＋ 践行 笔记 记录 自己 的 收获 和 践行 随书 附赠 超值 大礼包 扫码 关注 微 信号 剽悍 一只 猫 即可 获得 神秘 惊喜 
118034623,谁动 了 我 的 奶酪 是 个 简单 的 寓言故事 内容 充满 了 人生 中 有关 变化 寓意深长 的 真理 这 是 个 有趣 且 能 启蒙 智慧 的 故事 内容 是 在 描绘 四个 住 在 迷宫 里 的 人物 他们 竭尽所能 地 在 寻找 能 滋养 他们 身心 使 他们 快乐 的 奶酪 的 过程 这 四个 小人物 中有 两只 是 名叫 嗅 嗅 和 匆匆 的 老鼠 其他 两位 则 是 身体 大小 和 老鼠 差不多 的 小人 名叫 唧唧 和 哼哼 而且 这 两个 小人 的 外型 与 行为 和 现今 的 人类 差不多 这里 所谓 的 奶酪 是 一种 比喻 它 可以 被 当成 我们 生命 中 最 想得到 的 东西 它 可能 是 一份 工作 人际关系 金钱 财产 健康 心灵 的 宁静 书中 所谓 的 迷宫 代表 的 是 一个 你 花费 时间 与 精力 追寻 你 所 欲求 的 东西 的 地方 它 可以 是 你 所 服务 的 机构 或 你 所 居住 的 社区 在 故事 里 这些 人物 面临 突如其来 的 变化 最后 他们 之中 有 一个 成功 地 对 这些 变化 做出 适当 的 应变 并 在 迷宫 的 墙上 写下 他 改变 自己 的 心路历程 及 从中 所 得到 的 经验 当 你 看到 那些 墙上 的 标语 时 你 就 能 自己 找出 处理 变化 的 方法 了解 了 这些 方法 你 就 不会 感到 太 多 压力 并且 能够 在生活中 或 工作 中 得到 更 多 的 成就感 不管 你 怎么 定义 这些 成就感 和 压力 
118035114,人 可以 被 毁灭 但 不能 被 打败 一位 老人 孤身 在 海上 捕鱼 八十四 天 一无所获 等 终于 钓到 大鱼 用 了 两天 两夜 才 将 其 刺 死 返航 途中 突遭 鲨鱼 袭击 经过 一天 一夜 的 缠斗 大鱼 仅存 骨架 但 老人 并未 失去 希望 和 信心 休整 之后 准备 再次 出海 编辑 推荐 截至 2017 年 1 月 113 位 诺贝尔文学奖 得主 作品 中文版 总 销量 海明威 高居榜首 累计 突破 400 万册 海明威 等 了 64 年 的 中文 译本 终于 来 了 华语 传奇 作家 鲁羊译 自 海明威 1952 年 亲自 授权 的 CharlesScribnerssons 初版 定 本 国际 著名 插 画师 SlavaShults 全新 震撼 手绘 配图 中 美 作家群 首次 联袂 推荐 作家 榜 官方 唯一 推荐 译本 影响 历史 的 百部 经典 之一 美国 历史 上 里程碑式 的 32 本书 之一 1986 年 法国 读书 杂志 推荐 的 理想 藏书 老人与海 是 我 这 一生 中能 写 得 最好 的 一部 作品 本书 作者 海明威 美国 历史 上 最 耀眼 的 传奇 作家 诺贝尔文学奖 美国 普利策 奖得主 
118035635,● 她 是 全球 最 成功 的 女性 之一 她 是 马克 扎克 伯格 的 左膀右臂 具有 天生 的 管理 天赋 ● 她 是 美国 薪酬 最高 的 女 高管 被 美国 媒体 誉为 「 硅谷 最有 影响力 女人 」 ● 她 身居 福布斯 百强 女性 榜 第 5 名 荣登 时代周刊 封面人物 并 被 时代 杂志 评为 全球 最具 影响力 的 人物 她 就是 Facebook 首席 运营官 谢丽尔桑 德伯格 今天 她 奉献 上 她 的 最新 力作 向前 一步 激励 全球 女性 勇敢 地 追求 自己 的 目标 实现 事业 与 家庭 生活 的 完美 平衡 强大 的 推荐 阵容 阳光 媒体 董事会 主席 杨澜 SOHO 董事长 张欣为 本书 撰写 推荐 序王石 李开复 徐小平 王秋扬 夏华何 振红 王潮 歌 徐巍 等 诸多 知名 企业家 知名 媒体 人 强力 推荐 从 现在 开始 LETSLEANIN ! 本书 连续 7 周 荣登 亚马逊 总榜 第一 连续 6 周 位居 纽约时报 非 虚构 类 畅销书 排行榜 第一 作为 全球 最 成功 的 女性 之一 谢丽尔桑 德伯格 在 本书 中 深刻 地 剖析 了 男女 不 平等 现象 的 根本原因 解开 了 女性 成功 的 密码 她 认为 女性 之所以 没有勇气 跻身 领导层 不敢 放开 脚步 追求 自己 的 梦想 更 多 是 出于 内在 的 恐惧 与 不 自信 她 在 书 中 鼓励 所有 女性 要 大胆 地 「 往 桌前 坐 」 主动 参与 对话 与 讨论 说出 自己 的 想法 同时 她 还 为 女性 提出 了 如下 成功 密码 激励 女性 勇于 接受 挑战 满怀 热情 地 追求 自己 的 人生目标 1 向前 一步 勇敢 进取 通常 女性 在 总会 在 无意识 中 妨碍 自己 的 发展 降低 对 自己 的 期望值 甚至 很 容易 就 放弃 工作 放弃 获得 更大 成就 的 可能性 与 男性 相比 女性 在职 场中 的 态度 仍然 不够 积极 不够 进取 2 平衡 工作 与 生活 伴侣 的 支持 非常 重要 那种 认为 女性 只有 抛开 家庭 才能 达到 事业 巅峰 的 说法 其实 并 不 成立 事实证明 绝大多数 的 成功 女性 都 拥有 一位 相当 支持 自己 事业 的 人生 伴侣 3 拥有 更加 开放 的 心态 女性 应该 对 事业 上 的 挑战 持有 更 开放 的 心态 如果 一份 工作 能 让 她 学到 新 的 技能 并且 更 快乐 更 满足 那 就 意味着 她 在 自我 提升 中 不断 发展 女性 只有 向前 一步 勇敢 地 LEANIN 才能 发挥 出 自己 的 潜力 获得 事业 与 家庭 的 双重 平衡 享受 成功 的 幸福 人生 
118040144,人性 的 弱点 全集 汇集 了 卡耐基 的 思想 精华 和 最 激动人心 的 内容 是 作者 最 成功 的 励志 经典 出版 后 立即 获得 了 广大读者 的 欢迎 成为 西方 世界 最 持久 的 人文 畅销书 主要 内容 包括 与 人 相处 的 基本 技巧 平安 快乐 的 要诀 如何 使人 喜欢 你 如何 赢得 他人 的 赞同 如何 更好 地 说服 他人 让 你 的 家庭 生活 幸福快乐 等 十篇 
118040657,孤独 之前 是 迷茫 孤独 之后 是 成长 很长 一段 日子 里 我 靠 写 东西 度过 了 太 多 的 小 无聊 伪 伤感 假 满足 与 真 茫然 我 在意 细节 算 敏感 但 知道 体谅 算 善良 我 说 喜欢 便是 喜欢 我 不想 回答 便是 真的 不 知道 如何 作答 有时 我 佯装 镇定 或 笑 得 开心 心里 总 觉得 自己 与 这个 世界 格格不入 不停 对抗 学着 顺从 冷静 旁观 终 明白 我们 都 不 应该 是 别人 世界 的 参与者 而是 自己 世界 的 建造 者 这 本书 里 记录 了 33 种 孤独感 希望 能 让 你 想起 自己 某种 忘我 无形 的 成长 最后 愿 你 比 别人 更 不怕 一个 人 独处 愿 日后 想起 时 你 会 被 自己 感动 
118041115,2013 年 欧洲 首席 畅销小说 入围 2012 年 布克 文学奖 同名 电影 拍摄 中 台湾 读者 表示 很久没 有读 一 本书 读 到 凌晨 是 一个 简单 素朴 但会 令人 深深感动 的 故事 笑泪 交织 的 阅读 2013 年 春季 英国 最具 影响力 理查 与 茱蒂 读书 俱乐部 书单 第 1 名欧 普拉 读书 俱乐部 夏日 选书 美国 图书馆 协会 选书 2012 年 英国 最 畅销 新人 小说 出版 人 周刊 纽约时报 泰晤士报 嘉人 今日 美国 等 各大 媒体 高 评价 推荐 他 以为 人生 就 这么 过去 了 直到 收到 那 封信 1 个人 87 天 627 英里 有关 爱 的 回归 自我 发现 日常生活 的 信念 以及 万物 之美 这 一年 我们 都 需要 哈罗德 安静 而 勇敢 的 陪伴 哈罗德 弗莱 六十岁 在 酿酒厂 干 了 四十年 销售 代表 后 默默 退休 没有 升迁 既 无 朋友 也 无 敌人 退休 时 公司 甚至 连 欢送会 都 没开 他 跟 隔阂 很深 的 妻子 住 在 英国 的 乡间 生活 平静 夫妻 疏离 日复一日 一天 早晨 他 收到 一封信 来自 二十年 未见 的 老友 奎妮 她 患 了 癌症 写信 告别 震惊 悲痛 之下 哈罗德 写 了 回信 在 寄出 的 路上 他 由奎妮 想到 了 自己 的 人生 经过 了 一个 又 一个 邮筒 越走越远 最后 他 从 英国 最 西南 一路 走到 了 最 东北 横跨 整个 英格兰 87 天 627 英里 只 凭 一个 信念 只要 他 走 老友 就 会 活下去 这是 哈罗德 千里 跋涉 的 故事 从 他 脚步 迈开 的 那 一刻起 与 他 六百多 英里 旅程 并行 的 是 他 穿越 时光隧道 的 另 一场 旅行 
118041604,活法 作者 稻盛和夫 是 日本 战后 经济 的 传奇 除 每 一个 人 的 人 生活 法 之外 企业 和 国家 甚至 社会 全人类 的 生存之道 也 包括 在 活法 所 阐述 的 范围 之内 为什么 这样 说 呢 因为 它们 都 是 一个 个人 的 集合体 在 应该 拥有 的 人 生活 法 这 一点 上 不 存有 任何 差异性 
118042125,人生 是 路遥 的 一部 中篇小说 发表 于 1982 年 它 以 改革 时期 陕北高原 的 城乡 生活 为 时空 背景 叙述 了 高中 毕业生 高 加林 回到 土地 又 离开 土地 再 回到 土地 这样 人生 的 变化 过程 高 加林 同 农村 姑娘 刘巧珍 城市 姑娘 黄亚萍 之间 的 感情纠葛 构成 了 故事 发展 的 矛盾 也 正是 体现 那种 艰难 选择 的 悲剧 
