id,abstract
118203916,当下 的 力量 堪称 心灵 读物 经典 英文版 自 2004 年 出版 至今 被 翻译成 30 多种语言 畅销 超过 200 万册 本书 为 中文版 第三版 作者 埃克 哈特 • 托利 在 书 中 引导 我们 发现 我们 一直 都 处在 大脑 或 思维 的 控制 之下 生活 在 对 时间 的 永恒 焦虑 中 我们 忘不掉 过去 更 担心 未来 但 实际上 我们 只能 活在 当下 活在 此时此刻 所有 的 一切都是 在 当下 发生 的 而 过去 和 未来 只是 一个 无 意义 的 时间 概念 通过 向 当下 的 臣服 你 才能 找到 真正 的 力量 找到 获得 平和 与 宁静 的 入口 在 那里 我们 能 找到 真正 的 欢乐 我们 能 拥抱 真正 的 自我 17 年 蝉联 美国 亚马逊 畅销书 排行榜 翻译成 50 多种 文字 畅销 全球 500 多万册 我们 这个 时代 最具 影响力 的 心灵 经典 身 心灵 畅销 作家 张德芬 导读 推荐 曾经 有 一位 乞丐 在 路边 坐 了 三十多年 一天 一位 陌生人 经过 这位 乞丐 机械 地 举起 他 的 旧 棒球帽 喃喃地 说 给 点儿 吧 陌生人 说 我 没有 任何 东西 可以 给 你 然后 他 问 你 坐 着 的 是 什么 乞丐 回答 说 什么 都 没有 只是 一个 旧 箱子 而已 自从 我 有 记忆 以来 我 就 一直 坐在 它 上面 陌生人 问 你 曾经 打开 过 箱子 吗 没有 乞丐 说 有 什么 用 里面 什么 都 没有 陌生人 坚持 打开 箱子 看一看 乞丐 这才试 着 打开 箱子 这时 令人 意想不到 的 事情 发生 了 乞丐 充满 了 惊奇 与 狂喜 箱子 里 装满 了 金子 那些 没有 找到 他们 真正 财富 存在 的 欢乐 以及 与 它 紧密联系 在 一起 的 深深 的 不可动摇 的 宁静 的 人 就是 故事 中 的 那个 乞丐 即便 已经 拥有 很多 物质 上 的 财富 他们 依然 在 四处寻找 欢乐 成就 安全 或 爱情 的 残余 他们 不 知道 自己 不仅 已经 拥有 了 所有 这些 还 拥有 了 比 这些 更为 珍贵 的 东西 那 就是 当下 的 力量 这 不仅仅 是 一 本书 它 还 蕴含着 活生生 的 能量 这种 能量 可以 奇迹般地 改变 你 的 生活 而且 事实证明 它 已经 改变 了 无数 人 的 生命 轨迹 这 不是 一口气 读完 的 书 它 将 陪伴 你 一生 每次 阅读 都 会 有 不同 的 体验 我们 一直 都 处在 思维 的 控制 下 生活 在 对 时间 的 永恒 焦虑 中 我们 无法控制 自己 的 大脑 沦为 强迫性 思维 的 奴隶 我们 忘不掉 过去 更 担心 未来 实际上 我们 所 能 拥有 的 一切 只有 当下 一切都是 在 当下 发生 的 而 过去 和 未来 只是 一个 无 意义 的 时间 幻象 通过 向 当下 臣服 我们 才能 找到 力量 的 源泉 发现 平和 与 宁静 的 入口 在 那里 我们 便 放下 焦虑 和 压力 获得 内在 的 智慧 和 真正 的 喜悦 
118204982,"当 美西 战争 爆发 后 美国 必须 立即 跟 西班牙 的 反抗军 首领 加西亚 取得联系 加西亚 在 古巴 丛林 的 山里 没有 人 知道 确切 的 地点 无法 带信 给 他 美国 总统 必须 尽快 地 获得 他 的 合作 这是 有人 对 总统 说 "" 有 一个 名叫 罗文 的 人 有 办法 找到 加西亚 也 只有 他 才能 找 得到 他们 把 罗文 找 来 交给 他 一封 写给 加西亚 的 信 关于 那个 名叫 罗文 的 人 如何 拿 了 信 把 它 装进 一个 油布 制 的 袋 里 封好 吊 在 胸口 划着 一艘 小船 四天 之后 的 一个 夜里 在 古巴 上岸 消逝 于 丛林中 接着 在 三个 星期 后 从 古巴 岛 的 那 一边 出来 已 徒步走 过 一个 危机四伏 的 国家 把 那 封信 交给 了 加西亚 这些 细节 都 不是 重点 重点 是 麦金利 总统 把 一封 写给 加西亚 的 信 交给 了 罗文 而 罗文 接过 信 之后 并 没有 问 他 在 什么 地方 罗文 的 事迹 通过 致 加西亚 的 信 一本 小册子 传遍 了 全世界 并 成为 敬业 服从 勤奋 的 象征 故事 很 简单 但 其中 却 学期 着 学习 与 创业 的 道理 "
118205513,力量 内容简介 秘密 让 全世界 数千万 人以 难以置信 的 方式 改变 生命 而 力量 则 集结 了 自 秘密 上市 之后 作者 朗达 ‧ 拜恩 所 领悟到 的 全部 精华 想要 马上 改变 生命 改变 人际关系 财务状况 健康 工作 和 快乐 指数 你 需要 的 就是 这 股 力量 力量 中说 了 许多 人 运用 力量 心想事成 的 故事 并 提供 拥有 梦想 人生 的 详细 指引 把 你 自然 且 喜悦 地 掌控 自身 命运 所 需 的 一切 讯息 都 整合 在 一起 你 需要 知道 的 每件事 都 已经 包含 力量 这 本书 里 作者 朗达 • 拜恩 从 一个 债务缠身 公司 频临 倒闭 的 人 通过 运用 书中 的 这股 力量 最终 变成 世界 上 最 有 影响力 的 人物 之一 过上 了 幸福 喜乐 的 生活 你 也 可以 驾驭 这 股 力量 改变 自己 的 人生 获得 想要 的 一切 点击 链接 进入 魔力 秘密 随书赠送 心想事成 精美 插图 卡片 海报 
118205957,佐贺 的 超级 阿嬷 内容简介 因为 无力 扶养 母亲 只好 将 年 仅 八岁 的 昭广 寄养 到 佐贺 乡下 的 外婆家 在 极端 艰苦 的 日子 里 乐观 的 外婆 却 总有 神奇 法子 让 生活 充满 温暖 力量 和 希望 让 家里 永远 充满 笑声 海报 点击 链接 进入 我 回来 了 阿嬷 甲子 园 的 梦想 : 佐贺 阿嬷 超级 阿嬷 的 信 佐贺 阿嬷 佐贺 的 超级 阿嬷巴 学园 : 佐贺 的 超级 阿嬷 亲子 共读 版 幸福 旅行箱 佐贺 阿嬷 
118210552,名人传 是 法国 作家 罗曼罗兰 所著 贝多芬 传 米开朗琪罗 传 和 托尔斯泰 传 的 合称 本书 的 三位 传主 都 是 人类 历史 上 极富 天才 而 不衰 罗曼罗兰 紧紧 把握住 这 三位 有着 各自 领域 的 艺术家 的 共同之处 着力 刻画 他们 在 忧患 困顿 的 人生 征途 上 历尽 苦难 与 颠 踬 而 不 改 初衷 的 心路历程 凸现 他们 崇高 的 人格 博爱 的 情感 和 广阔 的 胸襟 从而 为 我们 谱写 了 另 一阕 英雄 交响曲 
118211059,本书 以 故事 为主 不拘一格 易读 有趣 清楚 本书 旨在 以 轻松 口语化 的 风格 提出 这个 崭新 的 理论 亲切 而 实际 的 将 女性 人生 风险管理 理论 引入 到 实际 问题 的 各个方面 中来 整本书 的 主要 内容 将 以 第一人称 的 亲身 故事 讲出 但 实则 是 引导 读者 逐渐 掌握 一种 思考 方法 从而 从根本上 高于 知心 大姐 读者 问答 的 皮毛 形式 这 本书 将 成为 女性 用 左脑 思考 的 有力 工具 继续 延续 第一 本书 的 第一人称 故事 使 内容 可读性 强给 读者 以 代入 感 每 一个 故事 实则 都 是 女性 人生 风险管理 理论 的 案例 以 理论 的 内在 逻辑关系 组织 故事 较之 第一 本书 更加 深化 与 提取 论述 部分 通过 标注 重点 方法论 与 箴言 部分 降低 读者 获得 启迪 的 难度 
118211510,编辑 推荐 心理学 博士 采铜 归来 再 掀 心理学 风暴 继 精进 如何 成为 一个 很 厉害 的 人后 采铜 蛰伏 三年 提出 心智 进化论 三年 时间 采铜 都 做 了 什么 从 小小的 铅笔 里 发现 观察 的 玄机 将 其 作为 特别 的 思维 练习 方式 达到 一定 程度 之后 自己 很多 想当然 的 想法 已 被 颠覆 从 畅销 数十年 的 可口可乐 到 美食 界 的 亚德里亚 从 碎片 化 知识 到 唐金型 建筑 从 风行 大江南北 的 黄焖 鸡 米饭 到 老干妈 发现 惯 被 人们 忽略 的 中间 层次 也 是 未来 成功 的 关键因素 构建 属于 自己 的 超 系统 探访 篾匠 姑娘 观看 大芬村 流水线 山寨 作画 惊叹 乐高 积木 精度 研习 星巴克 设计方案 理解 万物 构造 之 法 建立 模块化 的 工作 系统 研究 丰田汽车公司 基于 小批量 循环 的 精益 生产 模式 独创 归一化 方法 继 精进 如何 成为 一个 很 厉害 的 人 之后 精进 2 是 一部 什么 作品 如果 精进 1 是 学习 维度 那 精进 2 就是 将 思维 进行 重新组合 超前 的 理论 重塑 思考 的 路径 找到 解决问题 的 捷径 在 任何 时间 年龄段 遇到 这 本书 它 都 可以 帮到 你 颠覆 惯性 认知 借鉴 性极 强以 心理学 知识 为 基础 让 读者 不知不觉 将 自己 的 思维 和 习惯 重新 整合 跨学科 解读 自由 切换 无缝 对接 不管 你 想 做 什么 都 可以 在 书 中 找到 方法 和 答案 独创 学习 思维 逻辑图 方便 读者 理解内容 构建 自己 的 思维 框架 大 咖们 怎么 评价 这 本书 采铜 亲自 看 这个 世界 从中 摸索 规律 还 带 着 你 看 告诉 你 怎样 去 看 心理学 博士 得到 自我 发展 心理学 专栏 作者 陈海贤 动机 在 杭州 精进 2 不仅 是 精进 1 的 延伸 更是 另 一个 庞大 的 全新 的 系统 纽约 州立大学 石溪 分校 商学院 助理 教授 曹纪 胤 从 精进 1 到 精进 2 采铜 一步步 搭建 起 一座 惊人 的 水晶 殿堂 科幻 作家 全球华语 科幻 星云 奖金 奖得主 吴霜 按照 这 本书 所 介绍 的 方法 学习 和 思考 你 会 在 不知不觉 间 学会 配钥匙 东京大学 博士后 宇宙 从何而来 作者 傅 渥成 看 这 本书 有个 副作用 返老还童 作家 梁边 妖读 透 这 本书 并且 完成 思考题 我敢 放胆 预测 改变 一定 会 发生 就 像 发生 在 我 身上 一样 北京人艺 签约 编剧 王佩 面对 新机遇 时 怎样 更好 地 组合 和 迭代 已有 的 知识 与 技能 从 认知 层面 对 你 的 思维 进行 升级 与 精进 100 天 行动 发起人 知名 自 媒体 warfalcon 始创 人 时间 管理 专家 战隼 如何 从 厉害 的 人 成为 真正 的 大牛 仅仅 了解 底层 原理 是 不够 的 与其 因 自己 的 无知 而 惶恐 不如 因 自己 的 无知 而 镇定 把 一件 事情 做好 最 基本 的 要求 是 稳定 易 被忽视 的 平常 事物 也 有 观察 和 解读 的 价值 也 是 一种 信息 丰足 的 学习 对象 高手 的 明显 特征 是 观察 和 思考 的 有序性 普通人 会 一股脑儿 地 把 不同 的 东西 搅 在 一起 层次 思维 的 关键 不 在于 界定 不同 层次 的 名称 而 在于 能 不能 从 你 熟悉 的 层次 上 跳脱 出来 进入 更 小 或者 更大 的 层次 把 硬件 模块 升级 改造 以 提升 系统 的 整体 品质 增加 软件 模块 的 种类 使 系统 更加 灵活 和 多元 接受 限制 利用 限制 甚至 喜欢 限制 去 跟 限制 做 朋友 内容简介 本书 延续 第一本 拓展 学习 力 的 主旨 是 一本 从 微观 到 宏观 启发 解决问题 方式 思维 的 心理学 书籍 作者 从 视角 层次 组合 限制 的 角度 利用 现实生活 中 的 小 事物 帮助 读者 建立 看 事物 和 解决问题 的 思维 轨迹 又 从 进化 迁移 循环 的 宏观 视角 给 读者 各个 素质 的 层级 提升 给予 方法论 和 思维 方式 的 指导 这 本书 将 帮助 你 ◎ 激发 多元 视角 飞跃 思维 壁垒 ◎ 进入 更大 或 更 小 的 层次 发现 成功 的 关键 暗 知识 ◎ 内外 兼修 实现 基本技能 的 叠加 和 组合 ◎ 思考 限制 
118212088,在 人 的 一生 中 所 遭遇 的 困境 和 不解 在 当下 或许 是 如此 难以 接受 但 在 过后 某一 时刻 会 突然 觉得 这是 最好 的 安排 全文 始终 以 一切都是 最好 的 安排 为主 线 传递 着 正 能量 十个 最好 篇章 里 52 个 温暖 人心 的 故事 入世 出世 中 贯穿 着 对 人生 对 情感 对 事业 的 感悟 折射出 生活 的 简单 与 复杂 在 世间 百态 中 领略 禅意 的 美 时间 扑面而来 我们 终将 释怀 这 不是 一本 心灵鸡汤 而是 心灵 鱼汤 营养 丰富 同时 也 要 小心 刺 一切都是 最好 的 安排 这 本书 你 看不透 可惜 看透 了 又 可悲 它 给 所有 钻牛角尖 走进 死胡同 的 人 挖 一条 出路 本书 作者 辉 姑娘 长年 从事 艺人 经纪 的 工作 与 当红 明星 接触 多 了 在 娱乐圈 混迹 久 了 训练 出 百毒不侵 的 强大 心理素质 这 本书 也 是 她 自己 每每 感到 活不下去 时 的 一粒 速效 救心丸 关键时刻 真能 救命 只有 放弃 问 为什么 我们 才能 安于 当下 以 臣服 之心 接受 一切 不说 悲不说 愁 一生 故事 独自 守 
118214942,这 本书 讲解 的 是 一套 识别 个人 优势 并 将 其 发挥 为 才干 的 方案 最终 目的 是 将 才干 变为 优秀 的 工作 表现 这套 方案 的 核心 是 网上 进行 的 优势 识别器 StrengthsFinder 测试 里面 有 34 个 主导 主题 及其 成千上万 的 组合 读者 通过 这些 测试 和 这 本书 的 讲解 来 了解 如何 最 有效 地 将 自己 的 优势 和 才干 转化 为 个人 和 事业 的 成功 
118215924,外村 自幼 生长 在 北海道 的 深山 小 村庄 家境贫寒 刻板 平凡 的 中学 生活 一成不变 的 山居 岁月 没有 选择 的 迷茫 前途 似乎 都 注定 了 他 无论怎样 努力 也 无法 摆脱 出身 的 困扰 偶然 有 一天 老师 让 他 帮忙 接待 一位 钢琴 调音师 那架 年久失修 的 钢琴 经过 调音师 的 妙手 竟 发出 宛如 天籁 的 美妙 音色 琴音 就 像 一道 微光 照亮 外村 的 灰暗 人生 从 那 一刻起 外村 便 立志 成为 一名 调音师 然而 不得不 承认 人 与 人 的 先天 条件 千差万别 他 来自 封闭 落后 的 环境 此前 从未 接触 过 钢琴 纵然 拼 尽全力 刻苦 练习 反复 聆听 钢琴 乐曲 诚惶诚恐 地 跟着 前辈 仔细 观摩 在 客户 眼中 在 神秘 高贵 的 钢琴 面前 他 仍然 是 个 畏缩 羞怯 欠缺 天赋 的 乡村 青年 生来 没有 拿到 一手 好牌 那么 努力 是否 有用 只有 音乐 生而平等 与 自然 世界 融为一体 被 包容 被 接纳 被 一视同仁 说不出口 的话 难以 言 尽 的 迷茫 和 挫折 或许 可以 让 音乐 替 你 发声 外村 能否 如愿 告别 大山 走进 音乐 的 广袤 森林 呢 
118221411,本书 以 案例 加 评论 的 形式 展现 了 一名 销售 总经理 的 销售 职业 中 的 无数个 精彩 片段 融合 商战 经营 销售 技巧 职场 成长 为 一体 全面 向 广大读者 展示 了 销售 职场 的 决胜 技巧 和 人生 中 的 取胜 之道 内容 围绕 外企 中 一名 新 上任 的 武汉 办事处 主任 如何 在 逆境 中 和 落后 的 局面 下 运用 销售 智慧 拼抢 得 一个 又 一个 订单 的 故事 解读 了 本土 商业 环境 下 的 各种 销售 规则 和 销售 技巧 以及 职场 智慧 文中 先是 讲述 案例 后面 附上 简短 评论 点题 加上 文后 的 附录 内容 为 作者 多年 商场 上 的 血汗 经验 具有 极高 的 借鉴 价值 更 有 在 天涯 链接 时 产生 的 与 网友 互动 问答 集锦 集中体现 了 一般 销售员 们 面临 的 各种 实际 问题 及其 应对 建议 与 措施 对 广大 销售 职场 人员 具有 实际 的 指导意义 深受 网友 们 推崇 
118222884,美国 出版 史上 的 奇迹 1960 年 首版 至今 从未 间断 再版 影响 五代 美国 年轻人 从 在 公开场合 说话 不 超过 五个 词 的 胆小鬼 到 内心 饱含 力量 的 世界 第一夫人 她 在 本书 分享 她 的 人生 经验 就 像 一个 祖母 母亲 姐姐 或 挚友 恐惧 时间 女性 教育 独立 内心 建设 自我实现 字字 质朴 句句 有声 生活 教会 我 首次 出版 于 1960 年 是 埃莉诺 罗斯福 生命 最后 岁月 里 所 写 的 一 本书 这是 一本 关于 个人 探索 和 改变 生活 的 富于 启发性 的 手册 也 是 一个 阅历 丰富 的 祖母 告诉 我们 生活 智慧 的 书 给人以 信心 力量 和 勇气 人生 最大 的 经验 以 她 七十六岁 的 年纪 她 说 是 经验 人生 到 极限 这 本书 给 了 我们 很多 具体 的 建议 比如 怎样 利用 时间 怎样 克服 恐惧 如何 使 自己 对 他人 有用 如何 调整 自我 怎样 做 一个 独立 的 个体 怎样 跟 人 交往 时 让 他人 表现 出 最好 的 那 一面 怎样 负责 任 怎样 参与 社会 做出 改变 让 自己 和 他人 过 上 更好 的 生活 等等 你 从 生活 中学 到 了 什么 来 帮助 你 解决 各种 难题 这位 美国 人 心目 中 真正 的 第一夫人 在 本书 中 给出 了 答案 这是 一个 女儿 妻子 母亲 祖母 宝贵 的 人生 经验 在 任何 时代 都 会 引发 共鸣 
118223435,生命不息 折腾 不止 完整 收录 罗永浩 从 2009 年 到 2014 年 12 月 的 六场 一个 理想主义者 的 奋斗 演讲 以及 罗永浩 从 出生 到 长大成人 的 成长 故事 原汁原味 还原 老罗 幽默 的 语言 和 演讲 现场 的 盛况 每个 单数 页 都 让 人 热血沸腾 每个 双数 页 都 让 人 捧腹大笑 在 中国 没有 任何 一个 科技 公司 开 发布会 敢 卖 门票 老罗 却 笑嘻嘻 地走了 这条 不 寻常 的 路 他 的 锤子 科技 新品 发布会 近万人 的 场分 分钟 抢 不到 票 购票 系统 一度 崩溃 盛况 堪比 一票 难求 的 郭德纲 跨 年 演出 很少 有 一个 中国 人能 如此 独特 有品 理想 商战 励志 幽默 简直 集 商业 大片 的 所有 元素 于 一身 他 曾经 是 一名 英语老师 结果 讲课 内容 以老罗 语录 的 形式 风靡 大江南北 他 曾经 执导 过 电影 结果 星巴克 中杯 之争 桥段 至今 仍 被 网友 津津乐道 他 曾经 维权 结果 自己 的 卡通 海报 每年 都 被 各种各样 的 315 活动 拿 去 当做 维权 标志 老罗做 的 事情 并 不 稀奇 好多 人 都 做 过 或者 正在 做 着 但是 偏偏 只有 他 可以 不遗余力 折腾 出好 大 的 动静 而且 不 忘 一路上 跟 大家 表演 说学逗唱 当 人们 说 到 相关 事情 的 时候 总 情不自禁 地 提起 他 并且 满脸 笑意 如果 你 想 弄清楚 老罗 怎么 就 这么 牛 了 不妨 读读 这 本书 他 在 书里 把 什么 都 倒 给 了 你 甚至 那些 纠结 的 心理过程 你 会 发现 这 本书 比 那些 成功 励志书 好 了 一万倍 因为 句句 掏 心窝子 没有 一句 假大空 的话 
118223972,林肯 传 描写 了 林肯 从 4 岁 到 56 岁 遇刺 身亡 数十年 间 的 事业 经历 心路历程 和 美国 的 总统 生活 林肯 凭着 强烈 的 求知欲 和 朴实 幽默 的 性格 从 一个 穷苦 的 孩子 逐渐 成长 为 伐木 人 店伙计 土地 测量员 律师 众议员 和 总统 他 当选 总统 对 南方 种植园主 的 利益 构成 严重威胁 南方 各州 向 北方 发起 战争 并 先后 宣布 退出 联邦 凭借 对 公正 的 执着 追求 和 为 废除 奴隶制 的 不屈 斗志 林肯 号召 民众 为 维护 联邦 统一 而战 南北战争 爆发 1862 年 9 月 22 日 林肯 发表 解放 黑人 奴隶 宣言 宣布 自 1863 年 1 月 1 日起 废除 南方 各州 的 奴隶制 奴隶 将 成为 自由人 
118224463,上 世纪 九十年代 我社 编辑出版 了 一套 工程浩大 的 世界 文学名著 文库 该 文库 由 200 种 图书 组成 比较 全面 地 反映 了 世界 文学 的 最高 成就 
118230803,在 时间 上 拎 得 清 的 人少 奋斗 十年 本书 是 时间 效率 管理 专家 畅销书 作家 全球 青年 领导力 GYL 的 创始人 张萌 送给 青年人 的 成长 加速器 书中 作者 通过 亲身 实践 提出 自我 管理体系 的 四大 模型 时间 管理 目标 管理效率 管理 健康 管理 指导 年轻人 如何 通过 输入 即 知识 技能 来源 的 四类 场景 阅读 以 人为 师 计划 课程 与 会议 以及 行走 的 力量 最终 实现 正确 输出 写作 演讲 及 实践 能力 在职 场 中学 会 套路 少走弯路 掌握 正确 的 方法 每天 效率 提高 一点点 构建 职场 硬 本领 你 就 能 收获 更好 的 人生 
118231977,别 独自 用餐 是 法拉奇 的 第一部 作品 也 是 一本 畅销书 法拉奇 用 亲身经历 讲述 了 一个 来自 贫穷 家庭 的 孩子 从 给 人 当 球童 起 悟出 人际交往 和 人脉 对 成功 的 重要性 这 让 他 在 寻求 和 接受 别人 帮助 的 同时 也 热情 地 帮助 需要 帮助 的 人 以此 形成 了 一个 良好 的 社交圈 成为 成功 的 职业 经理人 除了 才华 和 天赋 任何 成功 还 源于 人们 在 世界 中 丰富 的 情感 联系 本书 告诉 读者 如何 根据 自己 的 个性 和 特点 建立 自己 的 圈子 提升 自己 的 社交圈 实现 自己 的 职业 发展 就 许多 问题 给出 了 具体 的 可 操作 的 建议 比如 在 一次 会议 一次 聚餐 或 一次 偶然 联系 中 建立 双方 关系 的 方法 本书 著名 交际 案例 部分 介绍 了 众多 知名人士 的 社交 案例 包括 比尔 • 克林顿 富兰克林 • 德拉诺 • 罗斯福 凯瑟琳 • 格 兰姆 戴尔 • 卡内基 本杰明 • 富兰克林 和 弗农 • 乔丹 等 本书 通俗易懂 各种 事例 贯穿 其中 读 起来 胜似 一本 故事书 适合 多种 职业 和 年龄层 的 读者 对 商场 上 和 政界 的 读者 很 值得 借鉴 对刚 走出 校门 的 大学生 也 会 有 帮助 还 可 做 为 教育 孩子 的 一点 参考 帮助 孩子 从小 知道 成功 的 路上 不 可能 一个 人 达到 顶峰 你 需要 寻求 和 得到 别人 的 帮助 的 道理 
118232830,我们 都 一样 年 幼时 渴望 长大 长大 后 忙 着 彷徨 这 本书 将 讲述 青春 里 的 你 我 都 曾 经历 的 故事 或许 每个 人 的 青春 都 有 一张 相似 的 脸 它 写 满 困惑 也 可爱 至极 渴望 被 爱 却 畏惧 表达 向往 自由 却 有勇无谋 偏爱 某人 却 负气 离开 听过 那么 多 道理 还是 任性 而 为 明知 前路 多艰 还要 逆流 直上 后悔 错过 良辰美景 无数 却 依然 坚持 特立独行 二十几岁 的 年纪 我们 憧憬未来 的 无限 可能 也 总是 频频 张望 着 旧 时光 的 单纯 美好 于是 就 这样 被 从前 和 以后 反复 拉扯 左右 徘徊 着 自卑 困惑 着 可是 人 总要 学着 穿过 迷雾 独自 长大 希望 每个 阅读 这 本书 的 年轻人 纵然 见识 世间 恶意 也 怀有 改变 生活 的 热 枕 在 人群 中 遗世独立 是 你 光芒万丈 也 是 你 
118235203,三年 前热帖 写 在 三十岁 到来 这 一天 在 网上 被 转发 三百多万 次 受到 广泛 关注 进而 扩展 成书 在 书 中 潇洒 姐王潇 生动 坦诚 地 分享 了 自己 和 朋友 们 的 生活 经历 所 讲述 的 是 求学 恋爱 和 工作 各个 时期 的 挣扎 与 困惑 有 让 人 捧腹 爆笑 的 幽默 段子 也 有 让 人 鼻子 发酸 的 血泪 故事 分享 案例 的 同时 潇洒 姐 分析 了 作为 独立 女性 应该 具备 的 态度 探讨 了 在 人生 迷茫 期 如何 告别 纠结 与 困境 如何 作出 正确 的 选择 三年 过去 了 潇洒 姐 和 故事 主人公 们 的 人生 已经 翻篇 经过 耐心 的 培育 和 漫长 的 等待 潇洒 姐 播下 的 梦想 种子 已经 开出 花来 那些 曾经 处在 人生 米 字 路口 的 故事 主人公 们 经历 过 阵痛 与 挣扎 也 作出 了 最 适合 各自 的 人生 选择 正如 潇洒 姐所言 能够 得到 与 体会 的 究竟 如何 全 在于 自己 埋下 的 伏笔 无法 怨天尤人 只有 扪心自问 早 一步 看清 自己 面临 的 问题 早 一天 规划 自己 的 人生 就 能够 早 一天 体会 到 收获 的 喜悦 对 自己 对 生活 有所 期待 的 读者 们 明白 要 趁早 跟 潇洒 姐 一起 规划 人生 做 最好 的 自己 吧 
