id,abstract
120513972,经济学 和 法律 有 什么 关系 呢 假设 立法者 提议 持枪 抢劫犯 必须 判 终身 监禁 媒体 社论 强烈 支持 对 犯罪 采取 强硬手段 律师 提出异议 认为 这种 惩罚 太 残酷 和 不合 常规 法学家 则 在 思考 这个 议案 的 公平正义 问题 而 经济学家 则 发现 持枪 抢劫 的 判罚 跟 谋杀 一样 会 鼓励 抢劫犯 杀掉 被害人 这种 直达 问题 本质 的 能力 使得 经济学 不仅 适用 于 解释 法律 还 有助于 法律 的 制定 利用 大量 的 常见 案例 加上 他 渊博 的 芝加哥 学派 经济学 知识 大卫 D 弗里德曼 坚定 地为 法律 的 经济 分析 辩护 他 简洁 明快 地 厘清 了 法律 与 经济学 的 关系 这种 行文 风格 适合 学生 律师 和 外行 读者 同时 又 不会 牺牲 观点 的 深度 法律 的 经济 分析 并 没有 颠覆 传统 法律 学者 的 结论 对 同一 法律 问题 比如 是否 废除 死刑 它 能 被 不同 的 立场 所用 而是 改变 了 双方 辩论 的 本质 比如 在 讨论 房屋 租赁 法时 一般 观点 会 认为 它 要么 偏袒 房东 或 要么 偏袒 租客 但 经济 分析 明确 表示 长期 来看 一个 糟糕 的 法律 会 对 双方 都 造成 损害 此外 跟 传统 法律 理论 不同 经济 分析 用 相同 的 基本概念 如 经济 效率 和 方法 去 理解 和 评估 不同 类别 的 法律条文 比如 合同法 财产法 刑法 侵权 法等 不管 是 当下 的 美国 法律 还是 其他 历史 时期 或 其他 地方 的 法律 这本 经典 入门 适合 公检法 公务员 律师 对 法律 经济学 感兴趣 的 读者 
120514599,故 我们 要 研究 中国 政治史 或 社会史 或 经济史 只当 在 文化 传统 之一 体性 中来作 研究 不可 各别 分割 我们 当 从 政治史 社会史 来 研究 经济史 亦 当 从 政治 思想 社会 思想 来 研究 经济 思想 又 当 从 政治 制度 社会制度 来 研究 经济 制度 在 此 三者 之上 则 同 有 一 最高 的 人文 理想 在 作 领导 钱穆 如何 研究 经济史 中国 下 一步 的 挑战 或许 在于 重构 与 自身 传统 与 世界 的 联系 在 对 西方 学说 理论 的 引进 介绍 之外 还 需要 重新 理解 自身 的 历史 演进 本书 重视 政治 社会 文化 与 思潮 之间 的 相互 联系 涵盖 了 历朝历代 的 土地 制度 基础设施 投资 主要 是 水利 及 漕运 货币制度 与 税收政策 还 包括 政府 还是 市场 主导 的 经济 思想 争论 林毅夫 北大 中国 经济 研究 中心 主任 前 世界银行 首席 经济学家 1954 至 1955 年 期间 钱穆 先生 曾于 香港 新亚 书院 先后 讲授 中国 经济史 及 中国 社会 经济史 两门 课程 扼要 地 讲述 了 由 上古 春秋战国 至 明清 时代 的 经济 情况 及 财政政策 并 道 出 经济 与 政治 文化 社会 军事 法律 宗教 之间 的 相互影响 和 联系 评价 政策 和 朝代 兴亡 之 关系 叶龙 曾 师从 钱穆 多年 详尽 笔录 及 整理 了 先师 两门 课程 的 内容 对 一些 内容 做出 了 补释 形成 流畅 易读 的 文章 在 香港 信报 经评 版 陆续 刊出 后 受到 了 读者 的 热烈欢迎 最后 集结 出版 形成 本书 本书 不仅 填补 了 钱穆 先生 缺乏 经济 专门 史 著作 的 遗憾 更令 读者 能够 通过 阅读 中国 经济史 加深 对 钱穆 先生 其他 著作 的 理解 以 体悟 钱穆 先生 强调 要 在 文化 传统 一体 性中 做 研究 的 教诲 贯穿 全书 的 主要 经济 问题 包括 农业 经济 及 土地 分配 基建 及 水利工程 工商业 发展 货币制度 改革 社会阶层 现象 税制 及 徭役 等 细读 两千年 的 经济史 我们 可以 发现 今天 中国 的 社会 经济 面貌 深受 历史 传统 的 影响 希望 此书 能够 帮助 读者 解读 目前 推行 政策 背后 的 原因 和 影响 同时 起到 镜鉴 作用 将 有益 的 经验 应用 于 今日 商业 社会 避免 失败 的 教训 重蹈覆辙 
120515049,经济学 第 19 版 是 世界 著名 经济学 大师 萨缪尔森 先生 的 绝笔 之作 作者 在 前 18 版 的 基础 上 进行 了 精心 的 修订 并 融入 了 时代 变革 的 元素 和 最新 的 经济 数据 在 保持 把 注意力 始终 放在 经济学 的 基本概念 和 核心 理论 这一 风格 的 前提 下 对 货币政策 货币 与 国际 金融体系 经济 增长 通货膨胀 与 经济 政策 做 了 重点 论述 或 重写 对 前沿 的 实践 及 理论 成果 如 经济 发展 模式 选择 混合经济 政府 债务 稳定 经济 经济 增长 与 居民 福利 等 也 给出 了 最新 介绍 该版 经济学 是 萨缪尔森 先生 抛开 了 意识形态 与 政治 因素 后 对 当前 宏微观 经济 的 所思 所 想 尤其 是 他 在 此书 倡导 的 混合经济 具有 前瞻性 和 实践性 值得 广大读者 及 政府 管理者 学习 和 借鉴 
120515784,穷人 如何 成为 穷人 被 看做 穷人 取决于 与 他们 同 在 的 我们 既 非 贫穷 也 不 富有 的 普通人 的 生活 方式 以及 我们 如何 赞许 或者 反对 这种 生活 方式 这些 如何 投射 了 关于 我们 自身 的 现实 当 生产者 的 社会 转变 为 消费者 居多 的 社会 穷人 意味着 完全 不同 的 事 成为 穷人 曾经 的 意义 来源 来自 于 失业 今天 它 的 意义 主要 来自 于 有 缺陷 的 消费者 flawedconsumer 的 困境 鲍曼 在 本书 中 回顾 了 工作 伦理 的 起源 现代 社会 的 转变 福利 状况 的 影响 和 穷人 被 社会化 生产 以及 文化 界定 的 新 路径 并 提及 穷人 与 贫穷 可能 的 未来 他 勾勒 出 在 当代 穷人 的 故事 里 被忽视 过度 解读 和 被 隐藏 的 部分 并 试图 回答 贫穷 能够 用 普遍 公认 的 方法 来 对抗 和 征服 吗 
120520218,经济 发展 理论 一书 是 约瑟夫 熊彼特 早期 成名 之作 熊彼特 在 这本 著作 里 首先 提出 的 创新 理论 当时 曾 轰动 西方 经济学界 并且 一直 享有盛名 此书 最先 以 德文 发表 于 1912 年 修订 再版 于 1926 年 越 数年 又 重印 了 德文 第三版 1934 年 以 德文 修订本 为 依据 的 英译本 由 美国哈佛大学 出版社 出版 被 列为 哈佛 经济 丛书 第 46 卷 现在 的 中译本 据此 英译本 译出 熊彼特 的 经济 发展 理论 以 对于 利润 资本 信贷 利息 和 经济周期 的 考察 作为 副标题 涉猎 范围 可谓 极其 广泛 但是 书中 最具 特色 和 最 引人注目 的 还是 他 所 提出 的 创新 理论 全书 共 分为 六章 第一第二 两章 最为 重要 从 静止 状态 的 循环 流转 到 经济 发展 的 根本 现象 特别 是 第二章 u3000 对 经济 发展 包括 从 企业家 的 特点 和 功能 生产 要素 的 新 组合 创新 的 涵义 和 作用 直到 资本主义 的 产生 熊彼特 都 作 了 开创性 的 精辟 的 论述 既 是 理论 上 的 探讨 也 是 历史 发展 过程 的 概述 第三 四五 各 章则 进一步 分别 阐述 了 信贷 与 资本 企业家 利润 以及 资本 的 利息 我们 可以 概括地说 创新 理论 就是 熊彼特 经济 发展 理论 的 核心 
120521374,国家 为什么 会 有 贫富 之分 牛津大学 教授 罗伯特 • C 艾伦 探究 了 地理 全球化 技术 进步 经济 政策 和 制度 之间 的 交互作用 并 揭示 出 这些 因素 以 何种 方式 决定 了 世界 的 贫富 格局 他 旁征博引 鉴古知 今 借助 大量 的 史料 分析 了 影响 经济 增长 的 各大 要素 阐释 了 为什么 我们 的 世界 一直 处于 不 均衡 之中 全球 经济史 由 当代 全球 经济 史学家 英国牛津大学 教授 罗伯特 • C 艾伦 所著 艾伦 教授 以 丰富 的 史料 和 大量 的 图表 分析 了 世界 经济 格局 的 现状 和 成因 还 在 书 中 特别 深入 地 研究 了 新 中国 经济 的 历史 转型 他 对 中国 经济 的 未来 发展 寄予厚望 并 断言 中国 将 再 此 成为 世界 上 最大 的 制造业 国家 在 克里斯托弗 • 哥伦布 和 瓦斯科 • 达 伽马 完成 航海 探险 之前 中国 就是 世界 第一 世界 将 重新 回到 起点 全球 经济史 由 社会 经济 史学家 北大 教授 萧国亮 作序 推荐 
120521996,本书 考察 了 灯塔 荷兰 郁金香 泡沫 蜜蜂 和 果园 佃农 分成 制 键盘 路径 依赖 通用汽车 收购 费雪 车体 美国 标准 石油 垄断 等 11 个 著名 寓言 对 广泛 流传 的 市场 失灵 理论 提出 了 强有力 的 挑战 经济学家 曾 使用 这些 寓言故事 来 证明 提供 公共 产品 实施 产业 管制 对大 企业 实施 反垄断 等 公共 干预 的 合理性 使得 这些 故事 在 经济学 法学 和 管理学 等 领域 中 被 不断 提起 在 公共政策 方面 产生 广泛 影响 然而 本 文集 的 作者 们 发现 这些 寓言 实际上 只是 以讹传讹 的 神话 而已 经济学 分析 应该 扎实 地建 基于 对 制度 细节 交易成本 的 经验 研究 而 不能 依赖于 虚构 的 故事 本书 适合 经济学 和 法学 爱好者 公共政策 制定者 行业 分析师 及 投资人 是 新 制度 经济学 法律 经济学 的 经典 入门 书 此次 再版 增录 了 科斯 严格 意义 上 的 收官 之作 经济学 的 研究 操守 以及 彼得 加伯 的 经典 名篇 郁金香 狂潮 以 浙江大学 科斯 经济 研究 中心 为 平台 12 位 教授 联手 重译 
120522540,如果 你 只有 十几岁 阅读 这 本书 会 让 你 从 童话般 的 寓言故事 中 获得 经济学 的 启蒙教育 如果 你 是 二十几岁 阅读 这 本书 可以 让 你 再度 温习 一遍 你 在 大学 经济学 课堂 里 让 你 迷糊 的 经济学 天书 不过 这 一次 保证 你 再也不会 迷糊 了 如果 你 是 三十几岁 到 五十几岁 这 本书 可以 纠正 你 思维 中 所 滞留 的 的 所有 有 偏差 的 经济学 常识 经济学家 已经 把 你 的 大脑 固化 了 现在 该是 你 清醒 的 时候 了 如果 你 已经 退休 了 没关系 这 本书 既 可以 让 你 衡量 你 以前 的 经济学 人生 是否 完美 也 可以 让你在 孙辈 面前 有 了 培养 他们 智慧 人生 的 最佳 读物 不信 你 就 试试看 如何 对 经济 领域 的 各种 细节 和 现象 进行 整体性 分析 这是 一项 艰巨 的 任务 特别 是 在 很多 专家 似乎 不 可能 承担 这项 任务 时 它 便 显得 尤为 艰巨 但是 当 你 开始 切实 接触 到 经济学 的 基本要素 时 就 会 发现 这项 任务 比 你 想象 的 容易 得 多 经济 为什么 会 崩溃 一书 运用 插图 幽默 口吻 以及 讲故事 的 平实 手法 将 经济学 从 高不可攀 的 架子 上取 下来 放 回到 厨房 的 餐桌上 它本 就 该 属于 那个 地方 这个 关于 鱼 渔网 存钱 借钱 的 故事 揭露 了 全球 经济 对话 中 暗藏 的 众多 漏洞 希夫 兄弟 以 机智幽默 的 手法 阐释 了 经济 增长 的 根源 贸易 储蓄 及 风险 三者 的 重要性 滞涨 的 根源 利率 的 影响 及 政府 的 刺激 机制 消费信贷 的 破坏性 本质 等 问题 两位 作者 还 谈及 其他 许多 经济 原则 问题 这些 问题 经常 被 讨论 却 常常 被 误解 这 究竟 是 一本 什么样 的 书 竟然 能 激起 这么 多人 的 阅读 狂潮 想 弄 明白 还是 翻开 读一读 吧 
120523603,这是 一本 集纳 索罗斯 思维 方式 的 书 而 不仅仅 像 市面上 大部分 作品 那样 只 告诉 你 索罗斯 过去 的 所作所为 书中 你 将 听到 索罗斯 亲自 讲述 他 的 哲学 和 他 对 未来 的 种种 分析 我 在 人生 过程 中 逐渐 形成 了 一个 理念 架构 它 既 帮助 了 我 经营 对冲 基金 去 赚钱 又 使 我 以 政策 研究 慈善家 的 身份 去 用钱 这是 一本 涉猎 广泛 而 思想 集中 的 著作 如果 关于 索罗斯 你 只 想 读 一 本书 那么 这 本书 是 你 最好 的 选择 目录 序 第一 讲人 的 不确定性 原则 第二 讲 金融市场 第三 讲 开放 社会 第四 讲 资本主义 与 开放 社会 第五 讲 未来 的 路 authorsnotethehumanuncertaintyprinciplefinancialmarketsopensocietycapitalismversusopensocietythewayaheadindex 我 很 遗憾 地 告诉 大家 复苏 的 势头 可能 会 停止 甚至 随之 出现 再次 衰退 而 我 不能 确定 的 是 这 将 发生 在 2010 年 还是 2011 年 乔治 • 索罗斯 索罗斯 这样 的 投资 家 慈善家 总有 一些 独特 的 理念 指导 自己 的 实践 这 本书 恰好 是 他 对 自己 理念 的 总结 和 梳理 希望 我们 的 读者 能 从中 看出 一些 对 自己 有益 的 东西 常振明 中信 集团公司 副董事长 总经理 没有 必然王国 没有 或 然 王国 我们 生活 在 必 错性 和 自反性 相互作用 的 世界 中 证实 不 可能 证伪 也 困难 在 经济 生活 中 非均衡 是 常态 而 均衡 的 实现 只是 偶然 从 人类 不确定性 原则 出发 索罗斯 对 主流 经济学 的 哲学 基础 提出 了 有力 挑战 发人深省 余永定 中国 世界 经济学 会 会长 自信 人生 博浪 世界 经济 从 与 索罗斯 先生 的 交流 和 阅读 中 我 深刻 的 理解 到 理想 与 现实 的 大气 结合 马云 阿里巴巴 集团 主席 兼 首席 执行官 虽然 几年 前 曾经 宣布 退休 索罗斯 从未 离开 舞台 2007 年 以来 的 金融危机 造就 了 无数 失败者 但 索罗斯 是 少数 从中 获利 巨亿 的 投资者 之一 索罗斯 创造 了 对冲 基金 这个 概念 他 从未 停止 过 寻找 下 一个 大 机会 而 下 一个 大 机会 时而 垂青 于 他 索罗斯 开口 人们 应该 倾听 王烁 新世纪 周刊 主编 中国 改革 主编 财新网 总编辑 
120530246,下卷 记载 19932008 年间 的 企业 变革 作者 以 写实 的 手法 和 犀利 的 风格 描绘 了 19932007 年 部分 国企 和 民企 在 改革 和 崛起 中 的 艰难 历程 其中 有 柳传志 张瑞敏 王 石马 云 吴仁宝 等 成功 的 典型 也 有 禹作敏 牟其中 姬长 孔 沈太福 等 昙花一现 的 悲剧 人物 书中用 编年体 的 写法 将 1993 年 以来 发生 在 中国 大陆 经济体制 改革 中 的 大事 作 了 全景式 的 描绘 其中 有 政府 的 决策 有 高层领导 的 指示 有 亚洲 金融风暴 的 影响 更 多 的 是 企业界 人士 台前幕后 的 种种 作为 许多 事实 经过 作者 生动 的 描写 使 人们 能 从 宏观 上 看出 经济体制 改革 的 艰难 和 民企 在 突围 中 的 奋斗 无论 成功 与 失败 都 真实 地 映衬 出 中国 腾飞 中 沉重 的 翅膀 作者 在 企业 史 的 写作 中 摒弃 了 从文件 到 概念 的 模式 以 鲜活 灵动 的 典型 形象 以 人物 为 主体 以 事件 为 血肉 勾画出 这 一时期 中国 企业界 的 脉动 具有 一种 史诗 般的 力量 作者 在 书 中 说 过去 的 三十年 是 如此 的 辉煌 特别 对于 沉默 了 百年 的 中华民族 它 承载 了 太多人 的 光荣 与 梦想 它 是 几乎 一代人 共同 成长 的 全部 记忆 
120530738,乔治 索罗斯 也许 是 有史以来 知名度 最高 最具 传奇色彩 的 金融 大师 1993 年 他 利用 欧洲各国 在 统一 汇率 机制 问题 上 步调 不 一致 的 失误 发动 了 抛售 英镑 的 投机 风潮 迫使 具有 300 年 历史 的 英格兰银行 认亏 出场 1997 年 2 月 他 旗下 的 投资 基金 在 国际 货币 市场 上 大量 抛售 泰铢 这一 行动 被 视为 是 至今 尚未 平息 的 东南亚 金融危机 的 开端 当然 索罗斯 也 并非 无往而不胜 在 1987 年 美国 股灾 中 索罗斯 亏损 46 亿美元 而 他 在 1998 年 俄罗斯 金融危机 中 的 亏损 更高达 30 亿美元 之 巨 尽管如此 他 所 经营 的 量子 基金 并未 因 损失惨重 而 清盘 索罗斯 也 一如既往 地 在 纽约 中央公园 旁 的 办公室 里 评判 市场 不断 发表 令 市场 为 之 震颤 的 独家 观点 金融 炼金术 是 索罗斯 的 投资 日记 读者 可以 从 金融 炼金术 中 欣赏 到 索罗斯 如何 分析 个股 如何 把握 市场 转变 的 时机 如何 面对 不利 的 市场行情 并 及时 调整 对策 从而 在 风云变幻 的 金融市场 中 立于不败之地 的 精彩 艺术 
120531299,长期以来 世人 对 经济学 的 认识 有 两种 倾向 一是 教条主义 以 抽象 的 理论 模型 为 准绳 简单 推演 复杂 的 经济 现实 二是 经验主义 以 复杂 的 经济 现实 来 否定 理论 模型 的 重要性 经济学家 为此 也 备受 诟病 丹尼 • 罗德里克 从 经济学 模型 建构 的 角度 还原 什么 才 是 真正 的 经济学 经济学 理论 之 所有 要 抽象 和 简单化 是 为了 探讨 现象 背后 本质 的 因素 与此同时 经济学家 开发 出 多种多样 的 模型 从 不同 侧面 解释 经济 现实 为 我们 勾画出 一个 更加 全面 的 图景 当然 经济学家 也 会 时不时 地犯 经验主义 的 错误 尤其 是 在 公共政策 领域 他们 误以为 存在 某种 普适 模型 实际上 他们 应该 根据 具体条件 对模型 加以 斟酌 鉴别 选择 适合 的 模型 在 这 一 过程 中 意识形态 和 政治 偏好 不 应 压倒 对 现实 的 体察 和 推理 本书 既 为 经济学 辩护 也 正视 经济学界 面临 的 问题 和 挑战 经济学家 对 社会 现象 的 思考 方式 有 其 优势 但 经济学 的 灵活性 和 条件 适用性 也 是 它 的 阿喀琉斯 之踵 扬长避短 才能 好 地 发挥 经济学 的 独特 价值 
120531796,经济学 的 邀请 精装版 理解 经济学 的 最好 方式 就是 进行 批判 思考 书中 不仅 提供 了 大量 图表 理论 例证 更是 将 各种 模型 给予 了 哲学 意义 上 的 注解 赋予 经济学 以 生命力 严谨 和 批判性 思维 并存 它 就 像是 一本 自助 手册 手把手 教 你 演示 做事 的 方法 
120532285,神州 增订 版序 回顾 平生 在 学术研究 上 我 老老实实 地走了 一段 漫长 而 又 艰苦 的 路 一九六 七写 好 博士论文 佃农 理论 二 ○ ○ 八写 好 中国 的 经济 制度 相距 四十一年 二者 皆 可 传世 思想史 上 没有 谁 的 智力 可以 在 自己 的 顶峰 维持 那 幺 久 上苍 对 我 格外 仁慈 给 我 有 得天独厚 之感 也 回顾 平生 自己 认为 足以 传世 的 英语 文章 约 九篇 之谱 一般 朋友 举 佃农 为首 科斯 选 蜜蜂 的 神话 阿尔钦选 座位 票价 而 巴泽尔则 肯定 价格 管制 理论 是 无与伦比 的 我 自己 呢 选 中国 的 经济 制度 两年 前写 好 初稿 时 我 那样 想 两年 后 的 今天 我 还是 那样 想似 浅 实深 这里 独立 成书 的 制度 一文 牵涉到 的 话题 广泛 细节 多 史实 长 达 三十年 合约 理论 的 分析 达到 了 一个 前不见古人 的 层面 而 其中 好几处 要 靠 机缘巧合 或 时来 运到 才 找到 答案 没有 任何 「 缺环 」 完整 若 天衣无缝 也 读者 要 记住 制度 一文 其实 写 到 二 ○ ○ 七 分析 的 是 新 劳动 合同法 引进 之前 的 经济 奇迹 学术 过于 专注 有 机会 发神经 而 我 的 集中力 惊人 往往 一 发难 收 我 因而 喜欢 这里 那里 分心 一下 于是 搞 摄影 练 书法 写 散文 好 收藏 尝试 过 的 投资 或 生意 无数 这些 行为 惹 来 非议 而 我 喜欢 到 街头巷尾 跑 的 习惯 使 一些 无聊 之 辈 认为 我 早就 放弃 了 学术 不是 昔日 的 史 提芬 张 云云 这些 人 不 知道 经济学 的 实验室 是 真实 的 世界 不多到 那里 观察 算不上 是 科学 至于 那些 认为 我 转向 研究 中国 是 浪费 了 天赋 的 众 君子 属 坐井观天 既 不知 天高 也 不知 地厚 是 的 我 这 一辈 在 西方 拜师学艺 的 人 知道 在 国际 学术 上 中国 毫不 重要 没有 半席 之位 可言 也 怪不得 在 学问 上 炎黄子孙 没有 一家之言 恐怕 不止 二百年 了 今天 老人家 西 望 竟然 发觉 那里 的 经济 大师 不怎么样 不 懂 中国 对 经济 的 认识 出现 了 一个 大缺 环 算不上 真的 懂 经济 中国 的 经济 制度 这本 英中二语 的 书 在 香港 出版 过 三次 这次 攻进 神州 应该 有点 前途 为此 我补 做 了 两件事 其一 是 在 正文 之前 我 加进 两篇 有关 的 文章 介绍 正文 的 重要性 其二 是 在 正文 中 我作 了 些 补充 此文 早就 修改 过 无数次 科斯 要 把 该文 与 其它 文章 一起 结集在 美国 出版 问 我 还有 没有 需要 修改 的 地方 我 反复 重读 找 不到 有 什么 地方 要 改 但 有 几处 不妨 多 说 几句 尤其 是 在 第八节 之后 加 了 四段 我 认为 是 重要 的 就让 国内 的 同学 先读 这些 补充 吧 是 为序 张五常 二 ○ ○ 九年 八月 一日 
120532896,制度 制度 变迁 与 经济 绩效 将 给出 一种 制度 与 制度 变迁 理论 的 纲要 在 过去 20 年 中 我 一直 专注 于 研究 制度 问题 尽管如此 在 一些 先前 研究 的 基础 上 制度 制度 变迁 与 经济 绩效 在 探讨 政治 制度 与 经济 制度 的 本质 以及 它们 是 如何 变迁 方面 要 比 我 冼前 的 研究 更加 深入 制度 制度 变迁 与 经济 绩效 大部分 分析 的 重点 在于 明确 厘定 制度 的 含义 弄清 制度 与 组织 的 区别 是 什么 并 厘清 制度 是 如何 影响 交易 费用 和 生产成本 的 历史 是 重要 的 其 重要性 不仅 在于 我们 可以 从 历史 中 获取 知识 还 在于 种种 社会制度 的 连续性 把 现在 未来 与 过去 连结 在 了 一起 现在 和 未来 的 选择 是 由 过去 所型 塑 的 并且 只有 在 制度 演化 的 历史 话语 中 才能 理解 过去 将 制度 整合 到 经济 理论 与 经济史 的 分析 中去 是 改进 二者 最 重要 的 步骤 之一 
120534767,< 凡尔赛 和约 > 的 经济 后果 是 约翰 • 梅纳德 • 凯恩斯 的 成名 之作 1919 年 凯恩斯 作为 英国 财政部 的 谈判代表 参加 巴黎和会 主张 对德 宽容 试图 减少 协约国 对 德国 的 巨额 赔款 要求 因言 不见 用 辞职 退而著 此书 本书 一经 出版 即 风行 全世界 凯恩斯 把 凡尔赛 会议 上 缔造 的 和平 称为 迦太基 式 的 和平 也 引起 了 很多 争议 本书 的 成功 奠定 了 凯恩斯 世界 著名 经济学家 的 声誉 1944 年 在 建立 战后 的 布雷顿 森林 体系 方面 凯恩斯 作为 主要 参与者 汲取 了 凡尔赛 和约 和 大 萧条 的 教训 在 第二次世界大战 后 美国 推行 对 欧洲 进行 援助 的 马歇尔 计划 很大 程度 上 体现 了 < 凡尔赛 和约 > 的 经济 后果 一书 的 影响 
120535344,作者 用 浅显 生动 的 语言 娓娓 道 出 了 股票投资 的 诸多 技巧 向 广大 的 中小 投资者 提供 了 简单 易学 的 投资 分析方法 这些 方法 是 作者 多年 的 经验总结 具有 很强 的 实践性 对于 业余 投资者 来说 尤为 有益 作者 首先 告诉 投资者 的 就是 这样 一条 投资 规则 不要 相信 投资 专家 的 建议 作者 认为 投资者 只要 对 股票 认真 做 一些 研究 其 成绩 不会 比 专家 差 作者 认为 业余 投资者 有 很多 先天 的 优势 如果 他们 把 这些 优势 发挥 出来 在 投资 时 就 会 比 专家 做 得 还 出色 
120535852,但凡 思考 过 20 世纪 30 年代 大 萧条 问题 的 经济学家 大都 认为 那 是 一场 无妄之灾 而 不是 无法 避免 的 悲剧 他们 认为 假如 当年 赫伯特 • 胡佛 没有 在 经济 萧条 迫在眉睫 时 还 试图 保持 预算 平衡 假如 当年 美联储 没有 以 牺牲 国内 经济 为 代价 来 维护 金本位 假如 当年 政府 官员 迅速 向 境况 不妙 的 银行 注资 以 平复 19301931 年间 蔓延 开来 的 银行 恐慌 那么 1929 年 的 股市 崩溃 将 只会 引发 一场 普普通通 的 很快 被 人 遗忘 的 经济衰退 他们 还 认为 经济学家 和 决策者 已经 汲取 了 教训 真的 是 这样 吗 1929 年 股市 大崩盘 拉开 20 世纪 大 萧条 序幕 1982 年 债务 危机 第三世界 国家 遭遇 危机 后 的 萧条 1991 年 日本 经济 泡沫 破裂 至今 仍 在 萧条 中 徘徊 ; 1997 年 亚洲 金融危机 爆发 诸多 经济体 深陷 衰退 2007 年 美国 次贷 风波 愈演愈烈 经济 萧条 再度 袭来 在 诺贝尔经济学奖 颁奖 前夕 克鲁格曼 再次 预言 21 世纪 严重 经济衰退 无法 避免 世界 或 将 遭遇 失去 的 十年 经济 萧条 从未 远离 我们 萧条 经济学 重返 历史舞台 
